[{"type": "product", "id": 7890248761407, "title": "120 capsules of active vitamins B2、B6、B9、B12 for girls can be taken as vitamin E supplements", "handle": "120-capsules-of-active-vitamins-b2-b6-b9-b12-for-girls-can-be-taken-as-vitamin-e-supplements", "tags": "Food Supplements", "url": "https://shop.aloha.id.vn/products/120-capsules-of-active-vitamins-b2-b6-b9-b12-for-girls-can-be-taken-as-vitamin-e-supplements", "price": "17.28", "product_type": "", "vendor": "eprolo", "status": "active", "sku": "B8D96813B1C74E6CBDDFF2E7BA322A01", "variant": "60 capsules", "image": "https://cdn.shopify.com/s/files/1/0623/5340/8063/files/2BFD32D682C5ED007767B7D75CBA4343.jpg?v=1757165161", "inventory_quantity": 65451, "available": true, "text": "Product: 120 capsules of active vitamins B2、B6、B9、B12 for girls can be taken as vitamin E supplements Type: Vendor: eprolo Tags: Food Supplements Options: {\"Packaging specifications\": [\"60 capsules\", \"90 capsules\", \"120 capsules\"]} Variant: 60 capsules SKU: B8D96813B1C74E6CBDDFF2E7BA322A01 Price: 17.28 Inventory: 65451 Available: True Status: active Body: Product Name: Girls Vitamin Capsules Net content: 60 capsules, 90 capsules, 120 capsules Applicable to: Adults Main raw material: Vitamins Storage method: room temperature Shelf life: 2 years URL: https://shop.aloha.id.vn/products/120-capsules-of-active-vitamins-b2-b6-b9-b12-for-girls-can-be-taken-as-vitamin-e-supplements"}, {"type": "product", "id": 7890248761407, "title": "120 capsules of active vitamins B2、B6、B9、B12 for girls can be taken as vitamin E supplements", "handle": "120-capsules-of-active-vitamins-b2-b6-b9-b12-for-girls-can-be-taken-as-vitamin-e-supplements", "tags": "Food Supplements", "url": "https://shop.aloha.id.vn/products/120-capsules-of-active-vitamins-b2-b6-b9-b12-for-girls-can-be-taken-as-vitamin-e-supplements", "price": "18.80", "product_type": "", "vendor": "eprolo", "status": "active", "sku": "C2F6E789BB5042FA8AE413599693B5BC", "variant": "90 capsules", "image": "https://cdn.shopify.com/s/files/1/0623/5340/8063/files/2BFD32D682C5ED007767B7D75CBA4343.jpg?v=1757165161", "inventory_quantity": 99999, "available": true, "text": "Product: 120 capsules of active vitamins B2、B6、B9、B12 for girls can be taken as vitamin E supplements Type: Vendor: eprolo Tags: Food Supplements Options: {\"Packaging specifications\": [\"60 capsules\", \"90 capsules\", \"120 capsules\"]} Variant: 90 capsules SKU: C2F6E789BB5042FA8AE413599693B5BC Price: 18.80 Inventory: 99999 Available: True Status: active Body: Product Name: Girls Vitamin Capsules Net content: 60 capsules, 90 capsules, 120 capsules Applicable to: Adults Main raw material: Vitamins Storage method: room temperature Shelf life: 2 years URL: https://shop.aloha.id.vn/products/120-capsules-of-active-vitamins-b2-b6-b9-b12-for-girls-can-be-taken-as-vitamin-e-supplements"}, {"type": "product", "id": 7890248761407, "title": "120 capsules of active vitamins B2、B6、B9、B12 for girls can be taken as vitamin E supplements", "handle": "120-capsules-of-active-vitamins-b2-b6-b9-b12-for-girls-can-be-taken-as-vitamin-e-supplements", "tags": "Food Supplements", "url": "https://shop.aloha.id.vn/products/120-capsules-of-active-vitamins-b2-b6-b9-b12-for-girls-can-be-taken-as-vitamin-e-supplements", "price": "22.70", "product_type": "", "vendor": "eprolo", "status": "active", "sku": "26F3EB2C556A4D439F865C39195E1A43", "variant": "120 capsules", "image": "https://cdn.shopify.com/s/files/1/0623/5340/8063/files/2BFD32D682C5ED007767B7D75CBA4343.jpg?v=1757165161", "inventory_quantity": 46121, "available": true, "text": "Product: 120 capsules of active vitamins B2、B6、B9、B12 for girls can be taken as vitamin E supplements Type: Vendor: eprolo Tags: Food Supplements Options: {\"Packaging specifications\": [\"60 capsules\", \"90 capsules\", \"120 capsules\"]} Variant: 120 capsules SKU: 26F3EB2C556A4D439F865C39195E1A43 Price: 22.70 Inventory: 46121 Available: True Status: active Body: Product Name: Girls Vitamin Capsules Net content: 60 capsules, 90 capsules, 120 capsules Applicable to: Adults Main raw material: Vitamins Storage method: room temperature Shelf life: 2 years URL: https://shop.aloha.id.vn/products/120-capsules-of-active-vitamins-b2-b6-b9-b12-for-girls-can-be-taken-as-vitamin-e-supplements"}, {"type": "product", "id": 7885889863743, "title": "35CM Telescopic Lure Rod UL Ultra-short Mini Portable Carbon Fiber Sliding Float Fishing Rod", "handle": "35cm-telescopic-lure-rod-ul-ultra-short-mini-portable-carbon-fiber-sliding-float-fishing-rod", "tags": "camping", "url": "https://shop.aloha.id.vn/products/35cm-telescopic-lure-rod-ul-ultra-short-mini-portable-carbon-fiber-sliding-float-fishing-rod", "price": "35.54", "product_type": "", "vendor": "eprolo", "status": "active", "sku": "8F7013E34B674DD5A52003454660DC0E", "variant": "Straight grip display / 1.5  m", "image": "https://cdn.shopify.com/s/files/1/0623/5340/8063/files/7E744339AC428ABAFC21D1602FDD7776.jpg?v=1756649275", "inventory_quantity": 200, "available": true, "text": "Product: 35CM Telescopic Lure Rod UL Ultra-short Mini Portable Carbon Fiber Sliding Float Fishing Rod Type: Vendor: eprolo Tags: camping Options: {\"Color\": [\"Straight grip display\", \"Grip display\"], \"Length\": [\"1.5 m\", \"1.68 m\", \"1.8 m\", \"1.5 m\", \"1.68 m\"]} Variant: Straight grip display / 1.5 m SKU: 8F7013E34B674DD5A52003454660DC0E Price: 35.54 Inventory: 200 Available: True Status: active Body: Product Category: Lure Rod Material: Carbon Fiber Applicable Scene: Stream Color: Straight grip display, Grip display Length: 1.5m, 1.68m, 1.8m Fishing Rod Length: 1.5m, 1.8m Fishing Place: Reservoir Pond Fishing Rod Tension: Soft Tension Contracted Length: 35CM Original Diameter: 8mm Category: Fishing Rod Specification Sections Folded Length (CM) Tip Diameter (MM) Butt Diameter (MM) Weight (G) 1."}, {"type": "product", "id": 7885889863743, "title": "35CM Telescopic Lure Rod UL Ultra-short Mini Portable Carbon Fiber Sliding Float Fishing Rod", "handle": "35cm-telescopic-lure-rod-ul-ultra-short-mini-portable-carbon-fiber-sliding-float-fishing-rod", "tags": "camping", "url": "https://shop.aloha.id.vn/products/35cm-telescopic-lure-rod-ul-ultra-short-mini-portable-carbon-fiber-sliding-float-fishing-rod", "price": "35.54", "product_type": "", "vendor": "eprolo", "status": "active", "sku": "8F7013E34B674DD5A52003454660DC0E", "variant": "Straight grip display / 1.5  m", "image": "https://cdn.shopify.com/s/files/1/0623/5340/8063/files/7E744339AC428ABAFC21D1602FDD7776.jpg?v=1756649275", "inventory_quantity": 200, "available": true, "text": "50 7 32 0.9 11.5 70 1.68 8 33 0.9 14.5 76 1.80 8 34 0.9 15.5 82 URL: https://shop.aloha.id.vn/products/35cm-telescopic-lure-rod-ul-ultra-short-mini-portable-carbon-fiber-sliding-float-fishing-rod"}, {"type": "product", "id": 7885889863743, "title": "35CM Telescopic Lure Rod UL Ultra-short Mini Portable Carbon Fiber Sliding Float Fishing Rod", "handle": "35cm-telescopic-lure-rod-ul-ultra-short-mini-portable-carbon-fiber-sliding-float-fishing-rod", "tags": "camping", "url": "https://shop.aloha.id.vn/products/35cm-telescopic-lure-rod-ul-ultra-short-mini-portable-carbon-fiber-sliding-float-fishing-rod", "price": "35.96", "product_type": "", "vendor": "eprolo", "status": "active", "sku": "C45FD23406FA41E794F19FF5C7BE1B66", "variant": "Straight grip display / 1.68 m", "image": "https://cdn.shopify.com/s/files/1/0623/5340/8063/files/7E744339AC428ABAFC21D1602FDD7776.jpg?v=1756649275", "inventory_quantity": 100, "available": true, "text": "Product: 35CM Telescopic Lure Rod UL Ultra-short Mini Portable Carbon Fiber Sliding Float Fishing Rod Type: Vendor: eprolo Tags: camping Options: {\"Color\": [\"Straight grip display\", \"Grip display\"], \"Length\": [\"1.5 m\", \"1.68 m\", \"1.8 m\", \"1.5 m\", \"1.68 m\"]} Variant: Straight grip display / 1.68 m SKU: C45FD23406FA41E794F19FF5C7BE1B66 Price: 35.96 Inventory: 100 Available: True Status: active Body: Product Category: Lure Rod Material: Carbon Fiber Applicable Scene: Stream Color: Straight grip display, Grip display Length: 1.5m, 1.68m, 1.8m Fishing Rod Length: 1.5m, 1.8m Fishing Place: Reservoir Pond Fishing Rod Tension: Soft Tension Contracted Length: 35CM Original Diameter: 8mm Category: Fishing Rod Specification Sections Folded Length (CM) Tip Diameter (MM) Butt Diameter (MM) Weight (G) 1"}, {"type": "product", "id": 7885889863743, "title": "35CM Telescopic Lure Rod UL Ultra-short Mini Portable Carbon Fiber Sliding Float Fishing Rod", "handle": "35cm-telescopic-lure-rod-ul-ultra-short-mini-portable-carbon-fiber-sliding-float-fishing-rod", "tags": "camping", "url": "https://shop.aloha.id.vn/products/35cm-telescopic-lure-rod-ul-ultra-short-mini-portable-carbon-fiber-sliding-float-fishing-rod", "price": "35.96", "product_type": "", "vendor": "eprolo", "status": "active", "sku": "C45FD23406FA41E794F19FF5C7BE1B66", "variant": "Straight grip display / 1.68 m", "image": "https://cdn.shopify.com/s/files/1/0623/5340/8063/files/7E744339AC428ABAFC21D1602FDD7776.jpg?v=1756649275", "inventory_quantity": 100, "available": true, "text": ".50 7 32 0.9 11.5 70 1.68 8 33 0.9 14.5 76 1.80 8 34 0.9 15.5 82 URL: https://shop.aloha.id.vn/products/35cm-telescopic-lure-rod-ul-ultra-short-mini-portable-carbon-fiber-sliding-float-fishing-rod"}, {"type": "product", "id": 7885889863743, "title": "35CM Telescopic Lure Rod UL Ultra-short Mini Portable Carbon Fiber Sliding Float Fishing Rod", "handle": "35cm-telescopic-lure-rod-ul-ultra-short-mini-portable-carbon-fiber-sliding-float-fishing-rod", "tags": "camping", "url": "https://shop.aloha.id.vn/products/35cm-telescopic-lure-rod-ul-ultra-short-mini-portable-carbon-fiber-sliding-float-fishing-rod", "price": "36.16", "product_type": "", "vendor": "eprolo", "status": "active", "sku": "E298764BB3AB4CB689F0B14708FB0885", "variant": "Straight grip display / 1.8 m", "image": "https://cdn.shopify.com/s/files/1/0623/5340/8063/files/7E744339AC428ABAFC21D1602FDD7776.jpg?v=1756649275", "inventory_quantity": 100, "available": true, "text": "Product: 35CM Telescopic Lure Rod UL Ultra-short Mini Portable Carbon Fiber Sliding Float Fishing Rod Type: Vendor: eprolo Tags: camping Options: {\"Color\": [\"Straight grip display\", \"Grip display\"], \"Length\": [\"1.5 m\", \"1.68 m\", \"1.8 m\", \"1.5 m\", \"1.68 m\"]} Variant: Straight grip display / 1.8 m SKU: E298764BB3AB4CB689F0B14708FB0885 Price: 36.16 Inventory: 100 Available: True Status: active Body: Product Category: Lure Rod Material: Carbon Fiber Applicable Scene: Stream Color: Straight grip display, Grip display Length: 1.5m, 1.68m, 1.8m Fishing Rod Length: 1.5m, 1.8m Fishing Place: Reservoir Pond Fishing Rod Tension: Soft Tension Contracted Length: 35CM Original Diameter: 8mm Category: Fishing Rod Specification Sections Folded Length (CM) Tip Diameter (MM) Butt Diameter (MM) Weight (G) 1."}, {"type": "product", "id": 7885889863743, "title": "35CM Telescopic Lure Rod UL Ultra-short Mini Portable Carbon Fiber Sliding Float Fishing Rod", "handle": "35cm-telescopic-lure-rod-ul-ultra-short-mini-portable-carbon-fiber-sliding-float-fishing-rod", "tags": "camping", "url": "https://shop.aloha.id.vn/products/35cm-telescopic-lure-rod-ul-ultra-short-mini-portable-carbon-fiber-sliding-float-fishing-rod", "price": "35.54", "product_type": "", "vendor": "eprolo", "status": "active", "sku": "971351C9B04E427BAA47CB41170B1B23", "variant": "Grip display / 1.5 m", "image": "https://cdn.shopify.com/s/files/1/0623/5340/8063/files/7E744339AC428ABAFC21D1602FDD7776.jpg?v=1756649275", "inventory_quantity": 100, "available": true, "text": "Product: 35CM Telescopic Lure Rod UL Ultra-short Mini Portable Carbon Fiber Sliding Float Fishing Rod Type: Vendor: eprolo Tags: camping Options: {\"Color\": [\"Straight grip display\", \"Grip display\"], \"Length\": [\"1.5 m\", \"1.68 m\", \"1.8 m\", \"1.5 m\", \"1.68 m\"]} Variant: Grip display / 1.5 m SKU: 971351C9B04E427BAA47CB41170B1B23 Price: 35.54 Inventory: 100 Available: True Status: active Body: Product Category: Lure Rod Material: Carbon Fiber Applicable Scene: Stream Color: Straight grip display, Grip display Length: 1.5m, 1.68m, 1.8m Fishing Rod Length: 1.5m, 1.8m Fishing Place: Reservoir Pond Fishing Rod Tension: Soft Tension Contracted Length: 35CM Original Diameter: 8mm Category: Fishing Rod Specification Sections Folded Length (CM) Tip Diameter (MM) Butt Diameter (MM) Weight (G) 1.50 7 32 0"}, {"type": "product", "id": 7885889863743, "title": "35CM Telescopic Lure Rod UL Ultra-short Mini Portable Carbon Fiber Sliding Float Fishing Rod", "handle": "35cm-telescopic-lure-rod-ul-ultra-short-mini-portable-carbon-fiber-sliding-float-fishing-rod", "tags": "camping", "url": "https://shop.aloha.id.vn/products/35cm-telescopic-lure-rod-ul-ultra-short-mini-portable-carbon-fiber-sliding-float-fishing-rod", "price": "35.54", "product_type": "", "vendor": "eprolo", "status": "active", "sku": "971351C9B04E427BAA47CB41170B1B23", "variant": "Grip display / 1.5 m", "image": "https://cdn.shopify.com/s/files/1/0623/5340/8063/files/7E744339AC428ABAFC21D1602FDD7776.jpg?v=1756649275", "inventory_quantity": 100, "available": true, "text": ".9 11.5 70 1.68 8 33 0.9 14.5 76 1.80 8 34 0.9 15.5 82 URL: https://shop.aloha.id.vn/products/35cm-telescopic-lure-rod-ul-ultra-short-mini-portable-carbon-fiber-sliding-float-fishing-rod"}, {"type": "product", "id": 7885889863743, "title": "35CM Telescopic Lure Rod UL Ultra-short Mini Portable Carbon Fiber Sliding Float Fishing Rod", "handle": "35cm-telescopic-lure-rod-ul-ultra-short-mini-portable-carbon-fiber-sliding-float-fishing-rod", "tags": "camping", "url": "https://shop.aloha.id.vn/products/35cm-telescopic-lure-rod-ul-ultra-short-mini-portable-carbon-fiber-sliding-float-fishing-rod", "price": "35.96", "product_type": "", "vendor": "eprolo", "status": "active", "sku": "38B0AE4F143B4B9C960D59C6E8512D8B", "variant": "Grip display / 1.68  m", "image": "https://cdn.shopify.com/s/files/1/0623/5340/8063/files/7E744339AC428ABAFC21D1602FDD7776.jpg?v=1756649275", "inventory_quantity": 100, "available": true, "text": "Product: 35CM Telescopic Lure Rod UL Ultra-short Mini Portable Carbon Fiber Sliding Float Fishing Rod Type: Vendor: eprolo Tags: camping Options: {\"Color\": [\"Straight grip display\", \"Grip display\"], \"Length\": [\"1.5 m\", \"1.68 m\", \"1.8 m\", \"1.5 m\", \"1.68 m\"]} Variant: Grip display / 1.68 m SKU: 38B0AE4F143B4B9C960D59C6E8512D8B Price: 35.96 Inventory: 100 Available: True Status: active Body: Product Category: Lure Rod Material: Carbon Fiber Applicable Scene: Stream Color: Straight grip display, Grip display Length: 1.5m, 1.68m, 1.8m Fishing Rod Length: 1.5m, 1.8m Fishing Place: Reservoir Pond Fishing Rod Tension: Soft Tension Contracted Length: 35CM Original Diameter: 8mm Category: Fishing Rod Specification Sections Folded Length (CM) Tip Diameter (MM) Butt Diameter (MM) Weight (G) 1.50 7 32 "}, {"type": "product", "id": 7885889863743, "title": "35CM Telescopic Lure Rod UL Ultra-short Mini Portable Carbon Fiber Sliding Float Fishing Rod", "handle": "35cm-telescopic-lure-rod-ul-ultra-short-mini-portable-carbon-fiber-sliding-float-fishing-rod", "tags": "camping", "url": "https://shop.aloha.id.vn/products/35cm-telescopic-lure-rod-ul-ultra-short-mini-portable-carbon-fiber-sliding-float-fishing-rod", "price": "35.96", "product_type": "", "vendor": "eprolo", "status": "active", "sku": "38B0AE4F143B4B9C960D59C6E8512D8B", "variant": "Grip display / 1.68  m", "image": "https://cdn.shopify.com/s/files/1/0623/5340/8063/files/7E744339AC428ABAFC21D1602FDD7776.jpg?v=1756649275", "inventory_quantity": 100, "available": true, "text": "0.9 11.5 70 1.68 8 33 0.9 14.5 76 1.80 8 34 0.9 15.5 82 URL: https://shop.aloha.id.vn/products/35cm-telescopic-lure-rod-ul-ultra-short-mini-portable-carbon-fiber-sliding-float-fishing-rod"}, {"type": "product", "id": 7885889863743, "title": "35CM Telescopic Lure Rod UL Ultra-short Mini Portable Carbon Fiber Sliding Float Fishing Rod", "handle": "35cm-telescopic-lure-rod-ul-ultra-short-mini-portable-carbon-fiber-sliding-float-fishing-rod", "tags": "camping", "url": "https://shop.aloha.id.vn/products/35cm-telescopic-lure-rod-ul-ultra-short-mini-portable-carbon-fiber-sliding-float-fishing-rod", "price": "36.16", "product_type": "", "vendor": "eprolo", "status": "active", "sku": "F062DCC4F2134E908F9E3ADD8CE3F78F", "variant": "Grip display / 1.8 m", "image": "https://cdn.shopify.com/s/files/1/0623/5340/8063/files/7E744339AC428ABAFC21D1602FDD7776.jpg?v=1756649275", "inventory_quantity": 100, "available": true, "text": "Product: 35CM Telescopic Lure Rod UL Ultra-short Mini Portable Carbon Fiber Sliding Float Fishing Rod Type: Vendor: eprolo Tags: camping Options: {\"Color\": [\"Straight grip display\", \"Grip display\"], \"Length\": [\"1.5 m\", \"1.68 m\", \"1.8 m\", \"1.5 m\", \"1.68 m\"]} Variant: Grip display / 1.8 m SKU: F062DCC4F2134E908F9E3ADD8CE3F78F Price: 36.16 Inventory: 100 Available: True Status: active Body: Product Category: Lure Rod Material: Carbon Fiber Applicable Scene: Stream Color: Straight grip display, Grip display Length: 1.5m, 1.68m, 1.8m Fishing Rod Length: 1.5m, 1.8m Fishing Place: Reservoir Pond Fishing Rod Tension: Soft Tension Contracted Length: 35CM Original Diameter: 8mm Category: Fishing Rod Specification Sections Folded Length (CM) Tip Diameter (MM) Butt Diameter (MM) Weight (G) 1.50 7 32 0"}, {"type": "product", "id": 7890232213567, "title": "Aloe Vera Firming Moisturizer, Gentle Moisturizing Facial Skin Glow Moisturizing Cream", "handle": "aloe-vera-firming-moisturizer-gentle-moisturizing-facial-skin-glow-moisturizing-cream", "tags": "skincare", "url": "https://shop.aloha.id.vn/products/aloe-vera-firming-moisturizer-gentle-moisturizing-facial-skin-glow-moisturizing-cream", "price": "22.78", "product_type": "", "vendor": "eprolo", "status": "active", "sku": "OU-A06-0258-02", "variant": "default title", "image": "https://cdn.shopify.com/s/files/1/0623/5340/8063/files/C2A13B2FAF51E70476F9AD7BBE84BF88.jpg?v=1757157936", "inventory_quantity": 127, "available": true, "text": "Product: Aloe Vera Firming Moisturizer, Gentle Moisturizing Facial Skin Glow Moisturizing Cream Type: Vendor: eprolo Tags: skincare Options: {\"color\": [\"default title\"]} Variant: default title SKU: OU-A06-0258-02 Price: 22.78 Inventory: 127 Available: True Status: active Body: Our aloe vera firming moisturizer contains hyaluronic acid, vitamin E (tocopherol). It enhances skin firmness and improves relaxation. Its application method is very simple: clean the skin, keep the skin dry, evenly apply the product to all parts of the body skin, gently massage until absorbed. It also reduces fine lines and wrinkles, making skin look younger. URL: https://shop.aloha.id.vn/products/aloe-vera-firming-moisturizer-gentle-moisturizing-facial-skin-glow-moisturizing-cream"}, {"type": "product", "id": 7889477337151, "title": "Anti-Aging Serum, Hydrating Repair Brightening Anti-Aging Essence", "handle": "anti-aging-serum-hydrating-repair-brightening-anti-aging-essence", "tags": "skincare", "url": "https://shop.aloha.id.vn/products/anti-aging-serum-hydrating-repair-brightening-anti-aging-essence", "price": "22.78", "product_type": "", "vendor": "eprolo", "status": "active", "sku": "EEA02-A138-30-BU1", "variant": "default title", "image": "https://cdn.shopify.com/s/files/1/0623/5340/8063/files/D087CE3EAC2E2EB5887822CABDF9A7B3.jpg?v=1757045391", "inventory_quantity": 252, "available": true, "text": "Product: Anti-Aging Serum, Hydrating Repair Brightening Anti-Aging Essence Type: Vendor: eprolo Tags: skincare Options: {\"color\": [\"default title\"]} Variant: default title SKU: EEA02-A138-30-BU1 Price: 22.78 Inventory: 252 Available: True Status: active Body: Our Anti-Aging Serum contain collagen, hyaluronic acid, Vitamin C. It can anti aging, replenish moisture, moisturize and nourish skin, fade wrinkles, increase skin elasticity. Its usage is simple: After cleansing and toning, take an appropriate amount of essence and apply it evenly on the facial skin, massage gently with your hands in circular motions to absorb it. Reduces wrinkles, anti-aging, tightens skin, and makes you look younger and more radiant. URL: https://shop.aloha.id.vn/products/anti-aging-serum-hydrating-repair-brighteni"}, {"type": "product", "id": 7889477337151, "title": "Anti-Aging Serum, Hydrating Repair Brightening Anti-Aging Essence", "handle": "anti-aging-serum-hydrating-repair-brightening-anti-aging-essence", "tags": "skincare", "url": "https://shop.aloha.id.vn/products/anti-aging-serum-hydrating-repair-brightening-anti-aging-essence", "price": "22.78", "product_type": "", "vendor": "eprolo", "status": "active", "sku": "EEA02-A138-30-BU1", "variant": "default title", "image": "https://cdn.shopify.com/s/files/1/0623/5340/8063/files/D087CE3EAC2E2EB5887822CABDF9A7B3.jpg?v=1757045391", "inventory_quantity": 252, "available": true, "text": "ng-anti-aging-essence"}, {"type": "product", "id": 7889466753087, "title": "Antioxidant Renewal Serum, Tighten Facial Skin, Lighten Lines, Moisturize And Prevent Aging Serum", "handle": "antioxidant-renewal-serum-tighten-facial-skin-lighten-lines-moisturize-and-prevent-aging-serum", "tags": "skincare", "url": "https://shop.aloha.id.vn/products/antioxidant-renewal-serum-tighten-facial-skin-lighten-lines-moisturize-and-prevent-aging-serum", "price": "22.78", "product_type": "", "vendor": "eprolo", "status": "active", "sku": "WEA03-A010-30-PK1", "variant": "default title", "image": "https://cdn.shopify.com/s/files/1/0623/5340/8063/files/EAD935F75CA27AAC44D1251B19232DCA.jpg?v=1757040395", "inventory_quantity": 112, "available": true, "text": "Product: Antioxidant Renewal Serum, Tighten Facial Skin, Lighten Lines, Moisturize And Prevent Aging Serum Type: Vendor: eprolo Tags: skincare Options: {\"color\": [\"default title\"]} Variant: default title SKU: WEA03-A010-30-PK1 Price: 22.78 Inventory: 112 Available: True Status: active Body: Our anti-wrinkle serum contains hyaluronic acid, ceramide NP, ascorbic acid (vitamin C). It can replenish moisture and lock water in time, deeply nourish skin, fade facial fine lines, improve skin condition, strengthen skin barrier, and make skin firm, hydrated and shiny. Its use method is very simple: after cleaning and drying, take appropriate amount of this product evenly on the face, gently massage with the finger abdomen until absorbed, use twice a day (once in the morning and once in the evening),"}, {"type": "product", "id": 7889466753087, "title": "Antioxidant Renewal Serum, Tighten Facial Skin, Lighten Lines, Moisturize And Prevent Aging Serum", "handle": "antioxidant-renewal-serum-tighten-facial-skin-lighten-lines-moisturize-and-prevent-aging-serum", "tags": "skincare", "url": "https://shop.aloha.id.vn/products/antioxidant-renewal-serum-tighten-facial-skin-lighten-lines-moisturize-and-prevent-aging-serum", "price": "22.78", "product_type": "", "vendor": "eprolo", "status": "active", "sku": "WEA03-A010-30-PK1", "variant": "default title", "image": "https://cdn.shopify.com/s/files/1/0623/5340/8063/files/EAD935F75CA27AAC44D1251B19232DCA.jpg?v=1757040395", "inventory_quantity": 112, "available": true, "text": " persist in continuous use, to help continuous improvement of the skin. It deeply locks in water, nourishes and tightens the skin, thereby reducing the appearance of fine lines on the face. URL: https://shop.aloha.id.vn/products/antioxidant-renewal-serum-tighten-facial-skin-lighten-lines-moisturize-and-prevent-aging-serum"}, {"type": "product", "id": 7890232180799, "title": "Coconut Body Moisturizer, Coconut Moisturizing Essence For The Whole Body To Lubricate Skin And Moisturize Light Lines", "handle": "coconut-body-moisturizer-coconut-moisturizing-essence-for-the-whole-body-to-lubricate-skin-and-moisturize-light-lines", "tags": "skincare", "url": "https://shop.aloha.id.vn/products/coconut-body-moisturizer-coconut-moisturizing-essence-for-the-whole-body-to-lubricate-skin-and-moisturize-light-lines", "price": "22.78", "product_type": "", "vendor": "eprolo", "status": "active", "sku": "OU-A06-0258-04", "variant": "default title", "image": "https://cdn.shopify.com/s/files/1/0623/5340/8063/files/D243A50E079C16F7CA7A634AE94428FC.jpg?v=1757157918", "inventory_quantity": 150, "available": true, "text": "Product: Coconut Body Moisturizer, Coconut Moisturizing Essence For The Whole Body To Lubricate Skin And Moisturize Light Lines Type: Vendor: eprolo Tags: skincare Options: {\"color\": [\"default title\"]} Variant: default title SKU: OU-A06-0258-04 Price: 22.78 Inventory: 150 Available: True Status: active Body: Our coconut body moisturizer contains coconut oil, hyaluronic acid. It enhances skin firmness and improves relaxation. Its application method is very simple: clean the skin, keep the skin dry, evenly apply the product to all parts of the body skin, gently massage until absorbed. It also reduces fine lines and wrinkles, making skin look younger. URL: https://shop.aloha.id.vn/products/coconut-body-moisturizer-coconut-moisturizing-essence-for-the-whole-body-to-lubricate-skin-and-moisturiz"}, {"type": "product", "id": 7890232180799, "title": "Coconut Body Moisturizer, Coconut Moisturizing Essence For The Whole Body To Lubricate Skin And Moisturize Light Lines", "handle": "coconut-body-moisturizer-coconut-moisturizing-essence-for-the-whole-body-to-lubricate-skin-and-moisturize-light-lines", "tags": "skincare", "url": "https://shop.aloha.id.vn/products/coconut-body-moisturizer-coconut-moisturizing-essence-for-the-whole-body-to-lubricate-skin-and-moisturize-light-lines", "price": "22.78", "product_type": "", "vendor": "eprolo", "status": "active", "sku": "OU-A06-0258-04", "variant": "default title", "image": "https://cdn.shopify.com/s/files/1/0623/5340/8063/files/D243A50E079C16F7CA7A634AE94428FC.jpg?v=1757157918", "inventory_quantity": 150, "available": true, "text": "e-light-lines"}, {"type": "product", "id": 7889479008319, "title": "Collagen Anti-Aging Serum, Hydrates Reduces Fine Lines And Firming Skin Care Essence", "handle": "collagen-anti-aging-serum-hydrates-reduces-fine-lines-and-firming-skin-care-essence", "tags": "skincare", "url": "https://shop.aloha.id.vn/products/collagen-anti-aging-serum-hydrates-reduces-fine-lines-and-firming-skin-care-essence", "price": "22.78", "product_type": "", "vendor": "eprolo", "status": "active", "sku": "EE01221181-30ml", "variant": "default title", "image": "https://cdn.shopify.com/s/files/1/0623/5340/8063/files/3C1B31DA1DD9BD10FA32086C193C623A.jpg?v=1757045937", "inventory_quantity": 1000, "available": true, "text": "Product: Collagen Anti-Aging Serum, Hydrates Reduces Fine Lines And Firming Skin Care Essence Type: Vendor: eprolo Tags: skincare Options: {\"color\": [\"default title\"]} Variant: default title SKU: EE01221181-30ml Price: 22.78 Inventory: 1000 Available: True Status: active Body: Our collagen anti-aging serum contains hyaluronic acid, ceramide, and vitamin C. It locks in moisture, stimulates collagen production, eliminates wrinkles and brightens skin. Produce powerful anti-aging effect, smooth penetration of skin, improve sagging, sagging, wrinkles. Its use method is very simple: after cleansing, first after cleansing, take an appropriate amount of this product in the palm, apply a thin layer of essence on the face skin, and fully pat all parts of the face to help it absorb. Helps to lighten "}, {"type": "product", "id": 7889479008319, "title": "Collagen Anti-Aging Serum, Hydrates Reduces Fine Lines And Firming Skin Care Essence", "handle": "collagen-anti-aging-serum-hydrates-reduces-fine-lines-and-firming-skin-care-essence", "tags": "skincare", "url": "https://shop.aloha.id.vn/products/collagen-anti-aging-serum-hydrates-reduces-fine-lines-and-firming-skin-care-essence", "price": "22.78", "product_type": "", "vendor": "eprolo", "status": "active", "sku": "EE01221181-30ml", "variant": "default title", "image": "https://cdn.shopify.com/s/files/1/0623/5340/8063/files/3C1B31DA1DD9BD10FA32086C193C623A.jpg?v=1757045937", "inventory_quantity": 1000, "available": true, "text": "the skin after use, brightening and brightening uneven skin tone, leaving skin fairer and glowing. URL: https://shop.aloha.id.vn/products/collagen-anti-aging-serum-hydrates-reduces-fine-lines-and-firming-skin-care-essence"}, {"type": "product", "id": 7889478778943, "title": "Deep Cleansing Anti-Wrinkle Serum, Facial Skin Smoothing Fine Lines Hydrating Firming And Care Serum", "handle": "deep-cleansing-anti-wrinkle-serum-facial-skin-smoothing-fine-lines-hydrating-firming-and-care-serum", "tags": "", "url": "https://shop.aloha.id.vn/products/deep-cleansing-anti-wrinkle-serum-facial-skin-smoothing-fine-lines-hydrating-firming-and-care-serum", "price": "22.92", "product_type": "", "vendor": "eprolo", "status": "active", "sku": "E标kzy820yx01-30ml", "variant": "default title", "image": "https://cdn.shopify.com/s/files/1/0623/5340/8063/files/0E3BFFDD8C39CF6DED710BBAD0AC87BC.jpg?v=1757045917", "inventory_quantity": 100, "available": true, "text": "Product: Deep Cleansing Anti-Wrinkle Serum, Facial Skin Smoothing Fine Lines Hydrating Firming And Care Serum Type: Vendor: eprolo Tags: Options: {\"color\": [\"default title\"]} Variant: default title SKU: E标kzy820yx01-30ml Price: 22.92 Inventory: 100 Available: True Status: active Body: Our deep cleansing anti-wrinkle serum contains glycerin and hydroxyethyl cellulose. It reduces fine lines and wrinkles by 97%. Its use is simple: Turn the product upside down and gently press the applicator on the base to release the formula. Reduce fine lines and wrinkles after use, and restore supple and firm skin. URL: https://shop.aloha.id.vn/products/deep-cleansing-anti-wrinkle-serum-facial-skin-smoothing-fine-lines-hydrating-firming-and-care-serum"}, {"type": "product", "id": 7890249220159, "title": "Digestive And Intestinal Health Drops, Organic Oregano Oil Drops Treatment", "handle": "digestive-and-intestinal-health-drops-organic-oregano-oil-drops-treatment", "tags": "Docteat Herbal Body Care", "url": "https://shop.aloha.id.vn/products/digestive-and-intestinal-health-drops-organic-oregano-oil-drops-treatment", "price": "22.78", "product_type": "", "vendor": "eprolo", "status": "active", "sku": "GOB07-A060-30-WH1", "variant": "default title", "image": "https://cdn.shopify.com/s/files/1/0623/5340/8063/files/EC6E27B646F99F4547CD4392155D5DFF.jpg?v=1757165395", "inventory_quantity": 99, "available": true, "text": "Product: Digestive And Intestinal Health Drops, Organic Oregano Oil Drops Treatment Type: Vendor: eprolo Tags: Docteat Herbal Body Care Options: {\"color\": [\"default title\"]} Variant: default title SKU: GOB07-A060-30-WH1 Price: 22.78 Inventory: 99 Available: True Status: active Body: Our digestive and gut health drops contain potassium sorbate and mint leaf extract. It can improve gut health. Supplement nutrition and enhance body immunity. The way to use it is simple: Shake it well before serving, 1-2 drops at a time. And can stimulate the body's potential, increase metabolic rate. URL: https://shop.aloha.id.vn/products/digestive-and-intestinal-health-drops-organic-oregano-oil-drops-treatment"}, {"type": "product", "id": 7890248892479, "title": "Docteat Body Care Drops, A Plant-Based Dietary Supplement With Gentle Protection, Balance And Body Shape Management", "handle": "docteat-body-care-drops-a-plant-based-dietary-supplement-with-gentle-protection-balance-and-body-shape-management", "tags": "Docteat Herbal Body Care", "url": "https://shop.aloha.id.vn/products/docteat-body-care-drops-a-plant-based-dietary-supplement-with-gentle-protection-balance-and-body-shape-management", "price": "24.10", "product_type": "", "vendor": "eprolo", "status": "active", "sku": "DE-A06-0002-01", "variant": "default title", "image": "https://cdn.shopify.com/s/files/1/0623/5340/8063/files/C9F2843B644488DCA34344C997D043AB.jpg?v=1757165250", "inventory_quantity": 397, "available": true, "text": "Product: Docteat Body Care Drops, A Plant-Based Dietary Supplement With Gentle Protection, Balance And Body Shape Management Type: Vendor: eprolo Tags: Docteat Herbal Body Care Options: {\"color\": [\"default title\"]} Variant: default title SKU: DE-A06-0002-01 Price: 24.10 Inventory: 397 Available: True Status: active Body: Our body care drops are carefully formulated with extracts of traditional Chinese medicine, gluconolactone and vitamin b1. Designed specifically for daily diet and easy to maintain a normal state. The usage method is extremely convenient: Shake well before taking. Take 1-2 drops each time, 1-2 times a day. And it can be applied to a wide range of life scenarios, making it convenient for daily use. The rich flavor blends well with both hot and cold drinks. The small bottle "}, {"type": "product", "id": 7890248892479, "title": "Docteat Body Care Drops, A Plant-Based Dietary Supplement With Gentle Protection, Balance And Body Shape Management", "handle": "docteat-body-care-drops-a-plant-based-dietary-supplement-with-gentle-protection-balance-and-body-shape-management", "tags": "Docteat Herbal Body Care", "url": "https://shop.aloha.id.vn/products/docteat-body-care-drops-a-plant-based-dietary-supplement-with-gentle-protection-balance-and-body-shape-management", "price": "24.10", "product_type": "", "vendor": "eprolo", "status": "active", "sku": "DE-A06-0002-01", "variant": "default title", "image": "https://cdn.shopify.com/s/files/1/0623/5340/8063/files/C9F2843B644488DCA34344C997D043AB.jpg?v=1757165250", "inventory_quantity": 397, "available": true, "text": "design makes it easy to carry anytime and anywhere. The taste is fresh and smooth on the palate, just right. Just pour it into warm water for convenient daily drinking. URL: https://shop.aloha.id.vn/products/docteat-body-care-drops-a-plant-based-dietary-supplement-with-gentle-protection-balance-and-body-shape-management"}, {"type": "product", "id": 7890248695871, "title": "Docteat Herbal Body Care Drops, Manage Body Shape Gently Pamper Your Body With Dietary Supplements", "handle": "docteat-herbal-body-care-drops-manage-body-shape-gently-pamper-your-body-with-dietary-supplements", "tags": "Docteat Herbal Body Care Drops", "url": "https://shop.aloha.id.vn/products/docteat-herbal-body-care-drops-manage-body-shape-gently-pamper-your-body-with-dietary-supplements", "price": "24.10", "product_type": "", "vendor": "eprolo", "status": "active", "sku": "DE-B08-0003-01", "variant": "default title", "image": "https://cdn.shopify.com/s/files/1/0623/5340/8063/files/88473ECA146C5AFFD33E8F2C85A410CA.jpg?v=1757165091", "inventory_quantity": 380, "available": true, "text": "Product: Docteat Herbal Body Care Drops, Manage Body Shape Gently Pamper Your Body With Dietary Supplements Type: Vendor: eprolo Tags: Docteat Herbal Body Care Drops Options: {\"color\": [\"default title\"]} Variant: default title SKU: DE-B08-0003-01 Price: 24.10 Inventory: 380 Available: True Status: active Body: Our herbal body care drops are carefully blended with Chinese herbal extracts, gluconolactone and vitamin b1. Designed to help maintain a normal metabolism. It is very easy to use: Shake well before taking, 1-2 drops each time, 1-2 times a day. And can help build a slim figure. Mild formulation, suitable for long-term use. Fresh taste, no discomfort. URL: https://shop.aloha.id.vn/products/docteat-herbal-body-care-drops-manage-body-shape-gently-pamper-your-body-with-dietary-supplement"}, {"type": "product", "id": 7890248695871, "title": "Docteat Herbal Body Care Drops, Manage Body Shape Gently Pamper Your Body With Dietary Supplements", "handle": "docteat-herbal-body-care-drops-manage-body-shape-gently-pamper-your-body-with-dietary-supplements", "tags": "Docteat Herbal Body Care Drops", "url": "https://shop.aloha.id.vn/products/docteat-herbal-body-care-drops-manage-body-shape-gently-pamper-your-body-with-dietary-supplements", "price": "24.10", "product_type": "", "vendor": "eprolo", "status": "active", "sku": "DE-B08-0003-01", "variant": "default title", "image": "https://cdn.shopify.com/s/files/1/0623/5340/8063/files/88473ECA146C5AFFD33E8F2C85A410CA.jpg?v=1757165091", "inventory_quantity": 380, "available": true, "text": "s"}, {"type": "product", "id": 7890237095999, "title": "EELHOE  Niacin Vitamin C Whitening Mask (Bag) Hydrating, Moisturizing And Nourishing Skin Daily Skin Care And Beauty Mask", "handle": "eelhoe-niacin-vitamin-c-whitening-mask-bag-hydrating-moisturizing-and-nourishing-skin-daily-skin-care-and-beauty-mask", "tags": "skincare", "url": "https://shop.aloha.id.vn/products/eelhoe-niacin-vitamin-c-whitening-mask-bag-hydrating-moisturizing-and-nourishing-skin-daily-skin-care-and-beauty-mask", "price": "24.12", "product_type": "", "vendor": "eprolo", "status": "active", "sku": "EE-A05-0619-02", "variant": "In bags", "image": "https://cdn.shopify.com/s/files/1/0623/5340/8063/files/DA97AA9CE973B308383168CF1A54FE54.jpg?v=1757160195", "inventory_quantity": 193, "available": true, "text": "Product: EELHOE Niacin Vitamin C Whitening Mask (Bag) Hydrating, Moisturizing And Nourishing Skin Daily Skin Care And Beauty Mask Type: Vendor: eprolo Tags: skincare Options: {\"specification\": [\"In bags\"]} Variant: In bags SKU: EE-A05-0619-02 Price: 24.12 Inventory: 193 Available: True Status: active Body: Our niacin and Vitamin C whitening mask (bagged) is carefully formulated with collagen, niacinamide and ascorbic acid. Designed specifically to provide the necessary nutrients for the skin. The usage method is extremely convenient: Thoroughly clean the facial skin, take out the mask, apply it to the facial skin, let it stand for 15-20 minutes to allow the essence to be fully absorbed, then remove the mask and wash it with clean water. And it can significantly enhance the skin's luster. U"}, {"type": "product", "id": 7890237095999, "title": "EELHOE  Niacin Vitamin C Whitening Mask (Bag) Hydrating, Moisturizing And Nourishing Skin Daily Skin Care And Beauty Mask", "handle": "eelhoe-niacin-vitamin-c-whitening-mask-bag-hydrating-moisturizing-and-nourishing-skin-daily-skin-care-and-beauty-mask", "tags": "skincare", "url": "https://shop.aloha.id.vn/products/eelhoe-niacin-vitamin-c-whitening-mask-bag-hydrating-moisturizing-and-nourishing-skin-daily-skin-care-and-beauty-mask", "price": "24.12", "product_type": "", "vendor": "eprolo", "status": "active", "sku": "EE-A05-0619-02", "variant": "In bags", "image": "https://cdn.shopify.com/s/files/1/0623/5340/8063/files/DA97AA9CE973B308383168CF1A54FE54.jpg?v=1757160195", "inventory_quantity": 193, "available": true, "text": "RL: https://shop.aloha.id.vn/products/eelhoe-niacin-vitamin-c-whitening-mask-bag-hydrating-moisturizing-and-nourishing-skin-daily-skin-care-and-beauty-mask"}, {"type": "product", "id": 7890236506175, "title": "EELHOE All Day Light Sunscreen Mist, Hydrating Emulsion Isolation Skin Care Moisturizing Repair Spray", "handle": "eelhoe-all-day-light-sunscreen-mist-hydrating-emulsion-isolation-skin-care-moisturizing-repair-spray", "tags": "skincare", "url": "https://shop.aloha.id.vn/products/eelhoe-all-day-light-sunscreen-mist-hydrating-emulsion-isolation-skin-care-moisturizing-repair-spray", "price": "31.12", "product_type": "", "vendor": "eprolo", "status": "active", "sku": "EEA05-A128-100-WH1", "variant": "default title", "image": "https://cdn.shopify.com/s/files/1/0623/5340/8063/files/A3CF84507023E99C03D22707E0F74AE2.jpg?v=1757160065", "inventory_quantity": 801, "available": true, "text": "Product: EELHOE All Day Light Sunscreen Mist, Hydrating Emulsion Isolation Skin Care Moisturizing Repair Spray Type: Vendor: eprolo Tags: skincare Options: {\"color\": [\"default title\"]} Variant: default title SKU: EEA05-A128-100-WH1 Price: 31.12 Inventory: 801 Available: True Status: active Body: Our All Day Light Sunscreen Mist contains Pearl Extract, Ceramide Eos, Centella Asiatica Extract. It provides effective sun protection and deep moisture, provides powerful antioxidant protection and reduces free radical damage. Its use method is very simple: clean the skin completely dry, take appropriate amount of this product evenly spray on the face skin, gently pat, speed up absorption. It locks in moisture and keeps skin moisturized and smooth throughout the day. URL: https://shop.aloha.id.vn/"}, {"type": "product", "id": 7890236506175, "title": "EELHOE All Day Light Sunscreen Mist, Hydrating Emulsion Isolation Skin Care Moisturizing Repair Spray", "handle": "eelhoe-all-day-light-sunscreen-mist-hydrating-emulsion-isolation-skin-care-moisturizing-repair-spray", "tags": "skincare", "url": "https://shop.aloha.id.vn/products/eelhoe-all-day-light-sunscreen-mist-hydrating-emulsion-isolation-skin-care-moisturizing-repair-spray", "price": "31.12", "product_type": "", "vendor": "eprolo", "status": "active", "sku": "EEA05-A128-100-WH1", "variant": "default title", "image": "https://cdn.shopify.com/s/files/1/0623/5340/8063/files/A3CF84507023E99C03D22707E0F74AE2.jpg?v=1757160065", "inventory_quantity": 801, "available": true, "text": "products/eelhoe-all-day-light-sunscreen-mist-hydrating-emulsion-isolation-skin-care-moisturizing-repair-spray"}, {"type": "product", "id": 7890236538943, "title": "EELHOE Cherry Crystal Lip Mask Hydrates And Moisturizes Lips, Removes Dead Skin Without Greasy And Reduces Lip Lines", "handle": "eelhoe-cherry-crystal-lip-mask-hydrates-and-moisturizes-lips-removes-dead-skin-without-greasy-and-reduces-lip-lines", "tags": "skincare", "url": "https://shop.aloha.id.vn/products/eelhoe-cherry-crystal-lip-mask-hydrates-and-moisturizes-lips-removes-dead-skin-without-greasy-and-reduces-lip-lines", "price": "24.10", "product_type": "", "vendor": "eprolo", "status": "active", "sku": "E标ycsjcm825rx01-5pack/盒", "variant": "default title", "image": "https://cdn.shopify.com/s/files/1/0623/5340/8063/files/882D91276EEF4FE52C6E7BD7CA0001D7.jpg?v=1757160083", "inventory_quantity": 495, "available": true, "text": "Product: EELHOE Cherry Crystal Lip Mask Hydrates And Moisturizes Lips, Removes Dead Skin Without Greasy And Reduces Lip Lines Type: Vendor: eprolo Tags: skincare Options: {\"color\": [\"default title\"]} Variant: default title SKU: E标ycsjcm825rx01-5pack/盒 Price: 24.10 Inventory: 495 Available: True Status: active Body: Our cherry crystal lip mask contains cherry extract, glycerin, and water. It helps to moisturize and soften lip lines. Its use is very simple: after cleaning, remove the lip mask and stick it on the lips, 10-15 minutes later, remove the lip mask and massage the lips with your fingers to fully absorb the essence. Moisturize and tender lips after use, help moisturize dry and cracked lips and lip lines, and the skin on lips is tender and delicate. URL: https://shop.aloha.id.vn/prod"}, {"type": "product", "id": 7890236538943, "title": "EELHOE Cherry Crystal Lip Mask Hydrates And Moisturizes Lips, Removes Dead Skin Without Greasy And Reduces Lip Lines", "handle": "eelhoe-cherry-crystal-lip-mask-hydrates-and-moisturizes-lips-removes-dead-skin-without-greasy-and-reduces-lip-lines", "tags": "skincare", "url": "https://shop.aloha.id.vn/products/eelhoe-cherry-crystal-lip-mask-hydrates-and-moisturizes-lips-removes-dead-skin-without-greasy-and-reduces-lip-lines", "price": "24.10", "product_type": "", "vendor": "eprolo", "status": "active", "sku": "E标ycsjcm825rx01-5pack/盒", "variant": "default title", "image": "https://cdn.shopify.com/s/files/1/0623/5340/8063/files/882D91276EEF4FE52C6E7BD7CA0001D7.jpg?v=1757160083", "inventory_quantity": 495, "available": true, "text": "ucts/eelhoe-cherry-crystal-lip-mask-hydrates-and-moisturizes-lips-removes-dead-skin-without-greasy-and-reduces-lip-lines"}, {"type": "product", "id": 7890222874687, "title": "EELHOE Collagen B5 Moisturizing Mask (Box Set) Three-In-One Mask For Hydrating, Moisturizing, Nourishing And Protecting Facial Skin", "handle": "eelhoe-collagen-b5-moisturizing-mask-box-set-three-in-one-mask-for-hydrating-moisturizing-nourishing-and-protecting-facial-skin", "tags": "skincare", "url": "https://shop.aloha.id.vn/products/eelhoe-collagen-b5-moisturizing-mask-box-set-three-in-one-mask-for-hydrating-moisturizing-nourishing-and-protecting-facial-skin", "price": "24.10", "product_type": "", "vendor": "eprolo", "status": "active", "sku": "EE-A05-0619-07", "variant": "default title", "image": "https://cdn.shopify.com/s/files/1/0623/5340/8063/files/101D5AA593E6E5A1B424B35024596E10.jpg?v=1757155560", "inventory_quantity": 79, "available": true, "text": "Product: EELHOE Collagen B5 Moisturizing Mask (Box Set) Three-In-One Mask For Hydrating, Moisturizing, Nourishing And Protecting Facial Skin Type: Vendor: eprolo Tags: skincare Options: {\"color\": [\"default title\"]} Variant: default title SKU: EE-A05-0619-07 Price: 24.10 Inventory: 79 Available: True Status: active Body: Our Collagen B5 Moisturizing Mask (box set) is carefully formulated with green tea extract and licorice root. Designed specifically to promote the repair of the skin barrier, enhance resistance and protect the skin from external damage. The usage method is extremely convenient: thoroughly clean your facial skin, take out the mask, apply it to your facial skin, let it sit for 15 to 20 minutes to allow the essence to be fully absorbed, then remove the mask and wash it off wit"}, {"type": "product", "id": 7890222874687, "title": "EELHOE Collagen B5 Moisturizing Mask (Box Set) Three-In-One Mask For Hydrating, Moisturizing, Nourishing And Protecting Facial Skin", "handle": "eelhoe-collagen-b5-moisturizing-mask-box-set-three-in-one-mask-for-hydrating-moisturizing-nourishing-and-protecting-facial-skin", "tags": "skincare", "url": "https://shop.aloha.id.vn/products/eelhoe-collagen-b5-moisturizing-mask-box-set-three-in-one-mask-for-hydrating-moisturizing-nourishing-and-protecting-facial-skin", "price": "24.10", "product_type": "", "vendor": "eprolo", "status": "active", "sku": "EE-A05-0619-07", "variant": "default title", "image": "https://cdn.shopify.com/s/files/1/0623/5340/8063/files/101D5AA593E6E5A1B424B35024596E10.jpg?v=1757155560", "inventory_quantity": 79, "available": true, "text": "h clean water. And it can enhance skin elasticity, firm the skin and reduce fine lines. URL: https://shop.aloha.id.vn/products/eelhoe-collagen-b5-moisturizing-mask-box-set-three-in-one-mask-for-hydrating-moisturizing-nourishing-and-protecting-facial-skin"}, {"type": "product", "id": 7889477075007, "title": "EELHOE Dark Spots Anti-Aging Serum Lighten Dark Spots And Moisturize Skin Anti-Wrinkle Serum", "handle": "eelhoe-dark-spots-anti-aging-serum-lighten-dark-spots-and-moisturize-skin-anti-wrinkle-serum", "tags": "skincare", "url": "https://shop.aloha.id.vn/products/eelhoe-dark-spots-anti-aging-serum-lighten-dark-spots-and-moisturize-skin-anti-wrinkle-serum", "price": "24.10", "product_type": "", "vendor": "eprolo", "status": "active", "sku": "EE012211302-30ml", "variant": "default title", "image": "https://cdn.shopify.com/s/files/1/0623/5340/8063/files/E97F924589F37DC5FC202ABCC599B82A.jpg?v=1757045309", "inventory_quantity": 493, "available": true, "text": "Product: EELHOE Dark Spots Anti-Aging Serum Lighten Dark Spots And Moisturize Skin Anti-Wrinkle Serum Type: Vendor: eprolo Tags: skincare Options: {\"color\": [\"default title\"]} Variant: default title SKU: EE012211302-30ml Price: 24.10 Inventory: 493 Available: True Status: active Body: Our anti-aging serum for dark spots contains green tea extract and vitamin C. It can effectively fight pigmentation spots, acne and so on. It deeply moisturizes the skin and helps reduce dry skin caused by dehydration. Form a barrier to prevent the loss of water contained in the skin and protect the skin from external dust and bacteria entering the pores. The way to use it is simple: After cleaning, apply an appropriate amount of the product to the center of the palm. Apply a thin layer of serum to your facia"}, {"type": "product", "id": 7889477075007, "title": "EELHOE Dark Spots Anti-Aging Serum Lighten Dark Spots And Moisturize Skin Anti-Wrinkle Serum", "handle": "eelhoe-dark-spots-anti-aging-serum-lighten-dark-spots-and-moisturize-skin-anti-wrinkle-serum", "tags": "skincare", "url": "https://shop.aloha.id.vn/products/eelhoe-dark-spots-anti-aging-serum-lighten-dark-spots-and-moisturize-skin-anti-wrinkle-serum", "price": "24.10", "product_type": "", "vendor": "eprolo", "status": "active", "sku": "EE012211302-30ml", "variant": "default title", "image": "https://cdn.shopify.com/s/files/1/0623/5340/8063/files/E97F924589F37DC5FC202ABCC599B82A.jpg?v=1757045309", "inventory_quantity": 493, "available": true, "text": "l skin and pat each area of your face fully to aid absorption. And can tighten the skin, make the skin more elastic, and prevent skin sagging. URL: https://shop.aloha.id.vn/products/eelhoe-dark-spots-anti-aging-serum-lighten-dark-spots-and-moisturize-skin-anti-wrinkle-serum"}, {"type": "product", "id": 7890222776383, "title": "EELHOE Kojic Acid Whitening Facial Essence, Facial Firming And Nourishing Skin Care Moisturizes Skin And Lightens Fine Lines And Spots", "handle": "eelhoe-kojic-acid-whitening-facial-essence-facial-firming-and-nourishing-skin-care-moisturizes-skin-and-lightens-fine-lines-and-spots", "tags": "skincare", "url": "https://shop.aloha.id.vn/products/eelhoe-kojic-acid-whitening-facial-essence-facial-firming-and-nourishing-skin-care-moisturizes-skin-and-lightens-fine-lines-and-spots", "price": "24.10", "product_type": "", "vendor": "eprolo", "status": "active", "sku": "EE012211211-30ml", "variant": "default title", "image": "https://cdn.shopify.com/s/files/1/0623/5340/8063/files/9DBC36F4E5E4E7A412A3B40FEFA58371.jpg?v=1757155543", "inventory_quantity": 495, "available": true, "text": "Product: EELHOE Kojic Acid Whitening Facial Essence, Facial Firming And Nourishing Skin Care Moisturizes Skin And Lightens Fine Lines And Spots Type: Vendor: eprolo Tags: skincare Options: {\"color\": [\"default title\"]} Variant: default title SKU: EE012211211-30ml Price: 24.10 Inventory: 495 Available: True Status: active Body: Our Kojic acid whitening facial essence is carefully formulated with kojic acid and sodium hyaluronate. Specifically designed to bid farewell to dry skin, remove freckles, quickly replenish moisture, regulate skin tone, penetrate deep into the skin, moisturize and hydrate pores, and refine pores. The usage method is extremely convenient: Wash your face, take 2-3 drops of this product in the palm of your hand, apply an appropriate amount evenly to your face and neck, a"}, {"type": "product", "id": 7890222776383, "title": "EELHOE Kojic Acid Whitening Facial Essence, Facial Firming And Nourishing Skin Care Moisturizes Skin And Lightens Fine Lines And Spots", "handle": "eelhoe-kojic-acid-whitening-facial-essence-facial-firming-and-nourishing-skin-care-moisturizes-skin-and-lightens-fine-lines-and-spots", "tags": "skincare", "url": "https://shop.aloha.id.vn/products/eelhoe-kojic-acid-whitening-facial-essence-facial-firming-and-nourishing-skin-care-moisturizes-skin-and-lightens-fine-lines-and-spots", "price": "24.10", "product_type": "", "vendor": "eprolo", "status": "active", "sku": "EE012211211-30ml", "variant": "default title", "image": "https://cdn.shopify.com/s/files/1/0623/5340/8063/files/9DBC36F4E5E4E7A412A3B40FEFA58371.jpg?v=1757155543", "inventory_quantity": 495, "available": true, "text": "nd then massage with your fingertips until fully absorbed. Subsequent skin care operations can continue. It is recommended to use it once in the morning and once in the evening. And it can whiten and fade spots. URL: https://shop.aloha.id.vn/products/eelhoe-kojic-acid-whitening-facial-essence-facial-firming-and-nourishing-skin-care-moisturizes-skin-and-lightens-fine-lines-and-spots"}, {"type": "product", "id": 7890221432895, "title": "EELHOE Physical Sunscreen, Hydrating Sunblock Facial Skin Care Moisturizing And Nourishing Sunscreen", "handle": "eelhoe-physical-sunscreen-hydrating-sunblock-facial-skin-care-moisturizing-and-nourishing-sunscreen", "tags": "skincare", "url": "https://shop.aloha.id.vn/products/eelhoe-physical-sunscreen-hydrating-sunblock-facial-skin-care-moisturizing-and-nourishing-sunscreen", "price": "31.12", "product_type": "", "vendor": "eprolo", "status": "active", "sku": "EEA05-A125-30-WH1", "variant": "default title", "image": "https://cdn.shopify.com/s/files/1/0623/5340/8063/files/BCAA565CA22FD8F83C839BAB4759BD62.jpg?v=1757155104", "inventory_quantity": 802, "available": true, "text": "Product: EELHOE Physical Sunscreen, Hydrating Sunblock Facial Skin Care Moisturizing And Nourishing Sunscreen Type: Vendor: eprolo Tags: skincare Options: {\"color\": [\"default title\"]} Variant: default title SKU: EEA05-A125-30-WH1 Price: 31.12 Inventory: 802 Available: True Status: active Body: Our Clear sunscreen contains glycerol stearate and tocopherol (vitamin E). It can effectively resist ultraviolet radiation, reduce sun damage, help reduce fine lines and wrinkles caused by sun exposure, strengthen the skin barrier, and enhance its self-repairing ability. Light formula, quickly absorbed by the skin, comfortable to use. Its usage is very simple: Clean and dry the facial skin, apply an appropriate amount of sunscreen evenly to the face, and wait for 20 minutes before going out. It can p"}, {"type": "product", "id": 7890221432895, "title": "EELHOE Physical Sunscreen, Hydrating Sunblock Facial Skin Care Moisturizing And Nourishing Sunscreen", "handle": "eelhoe-physical-sunscreen-hydrating-sunblock-facial-skin-care-moisturizing-and-nourishing-sunscreen", "tags": "skincare", "url": "https://shop.aloha.id.vn/products/eelhoe-physical-sunscreen-hydrating-sunblock-facial-skin-care-moisturizing-and-nourishing-sunscreen", "price": "31.12", "product_type": "", "vendor": "eprolo", "status": "active", "sku": "EEA05-A125-30-WH1", "variant": "default title", "image": "https://cdn.shopify.com/s/files/1/0623/5340/8063/files/BCAA565CA22FD8F83C839BAB4759BD62.jpg?v=1757155104", "inventory_quantity": 802, "available": true, "text": "enetrate and moisturize the skin, making it soft and moist, and restoring its elasticity and luster. It can prevent fine lines and wrinkles, make the skin younger and smoother, reduce skin redness and sunburn after sun exposure, and provide comprehensive protection for the skin. URL: https://shop.aloha.id.vn/products/eelhoe-physical-sunscreen-hydrating-sunblock-facial-skin-care-moisturizing-and-nourishing-sunscreen"}, {"type": "product", "id": 7890221531199, "title": "EELHOE Propolis Nicotinamide Photosensitive Essence, Reduces Acne Marks Moisturizes Brightens And Whitens Facial Essence", "handle": "eelhoe-propolis-nicotinamide-photosensitive-essence-reduces-acne-marks-moisturizes-brightens-and-whitens-facial-essence", "tags": "skincare", "url": "https://shop.aloha.id.vn/products/eelhoe-propolis-nicotinamide-photosensitive-essence-reduces-acne-marks-moisturizes-brightens-and-whitens-facial-essence", "price": "31.12", "product_type": "", "vendor": "eprolo", "status": "active", "sku": "EEA03-A010-30-WH1", "variant": "default title", "image": "https://cdn.shopify.com/s/files/1/0623/5340/8063/files/3003E2C7AD481B9EF65BDFA6A72C1700.jpg?v=1757155122", "inventory_quantity": 1204, "available": true, "text": "Product: EELHOE Propolis Nicotinamide Photosensitive Essence, Reduces Acne Marks Moisturizes Brightens And Whitens Facial Essence Type: Vendor: eprolo Tags: skincare Options: {\"color\": [\"default title\"]} Variant: default title SKU: EEA03-A010-30-WH1 Price: 31.12 Inventory: 1204 Available: True Status: active Body: Our propolis Nicosol Light Essence, formulated with glycerin, hydroxyethyl cellulose, etc., is especially suitable for acne skin and dehydrated dry skin. Its use is very simple, after cleansing and toning, take 2-3 drops of essence evenly apply to the face, gently massage with fingertips until absorbed. It is suggested that we do this once in the morning and once in the evening for best results. Light texture non-stick hands, easy to be absorbed by the skin, restore skin cleanlin"}, {"type": "product", "id": 7890221531199, "title": "EELHOE Propolis Nicotinamide Photosensitive Essence, Reduces Acne Marks Moisturizes Brightens And Whitens Facial Essence", "handle": "eelhoe-propolis-nicotinamide-photosensitive-essence-reduces-acne-marks-moisturizes-brightens-and-whitens-facial-essence", "tags": "skincare", "url": "https://shop.aloha.id.vn/products/eelhoe-propolis-nicotinamide-photosensitive-essence-reduces-acne-marks-moisturizes-brightens-and-whitens-facial-essence", "price": "31.12", "product_type": "", "vendor": "eprolo", "status": "active", "sku": "EEA03-A010-30-WH1", "variant": "default title", "image": "https://cdn.shopify.com/s/files/1/0623/5340/8063/files/3003E2C7AD481B9EF65BDFA6A72C1700.jpg?v=1757155122", "inventory_quantity": 1204, "available": true, "text": "ess, reduce skin problems. URL: https://shop.aloha.id.vn/products/eelhoe-propolis-nicotinamide-photosensitive-essence-reduces-acne-marks-moisturizes-brightens-and-whitens-facial-essence"}, {"type": "product", "id": 7890223071295, "title": "EELHOE Retinol Firming Cream Hydrating Moisturizing And Brightening Facial Skin Refreshing Non-Sticky Care Cream", "handle": "eelhoe-retinol-firming-cream-hydrating-moisturizing-and-brightening-facial-skin-refreshing-non-sticky-care-cream", "tags": "skincare", "url": "https://shop.aloha.id.vn/products/eelhoe-retinol-firming-cream-hydrating-moisturizing-and-brightening-facial-skin-refreshing-non-sticky-care-cream", "price": "24.10", "product_type": "", "vendor": "eprolo", "status": "active", "sku": "EE-A05-0730-01", "variant": "default title", "image": "https://cdn.shopify.com/s/files/1/0623/5340/8063/files/6D37C526CBB13B2787DD0513869BC17C.jpg?v=1757155588", "inventory_quantity": 559, "available": true, "text": "Product: EELHOE Retinol Firming Cream Hydrating Moisturizing And Brightening Facial Skin Refreshing Non-Sticky Care Cream Type: Vendor: eprolo Tags: skincare Options: {\"color\": [\"default title\"]} Variant: default title SKU: EE-A05-0730-01 Price: 24.10 Inventory: 559 Available: True Status: active Body: Our retinol firming cream contains Asiaticum extract, hyaluronic acid. It can delay aging and show a youthful state. The way to use it is simple: clean your face and keep it dry. Apply appropriate amount to face evenly. Massage gently until absorbed. And can improve skin texture and restore healthy skin quality. URL: https://shop.aloha.id.vn/products/eelhoe-retinol-firming-cream-hydrating-moisturizing-and-brightening-facial-skin-refreshing-non-sticky-care-cream"}, {"type": "product", "id": 7889128587327, "title": "Eelhope Kojic Acid Turmeric Cleansing Pad Gently Cleanses Facial Skin Pores Refreshing Cleansing Skincare", "handle": "eelhope-kojic-acid-turmeric-cleansing-pad-gently-cleanses-facial-skin-pores-refreshing-cleansing-skincare", "tags": "skincarre", "url": "https://shop.aloha.id.vn/products/eelhope-kojic-acid-turmeric-cleansing-pad-gently-cleanses-facial-skin-pores-refreshing-cleansing-skincare", "price": "24.10", "product_type": "", "vendor": "eprolo", "status": "active", "sku": "EH-A05-0012-01", "variant": "default title", "image": "https://cdn.shopify.com/s/files/1/0623/5340/8063/files/C4C3889EEF8902F3364F7C2C3E956312.jpg?v=1757001839", "inventory_quantity": 189, "available": true, "text": "Product: Eelhope Kojic Acid Turmeric Cleansing Pad Gently Cleanses Facial Skin Pores Refreshing Cleansing Skincare Type: Vendor: eprolo Tags: skincarre Options: {\"color\": [\"default title\"]} Variant: default title SKU: EH-A05-0012-01 Price: 24.10 Inventory: 189 Available: True Status: active Body: Our kojic acid turmeric cleaning cotton tablets contain turmeric extract, kojic acid, chamomile extract. It keeps your skin fresh anytime, anywhere. It also cleans and locks in moisture, leaving skin clean and not dry. Its use is very simple: 1. Clean and moisturize the skin; 2. Massage the skin in a circular motion with warm water; 3. Leave for 10 minutes and rinse thoroughly. Deeply nourishes the skin, moisturizes the skin for a long time, restores the skin to full moisture and rejuvenates the s"}, {"type": "product", "id": 7889128587327, "title": "Eelhope Kojic Acid Turmeric Cleansing Pad Gently Cleanses Facial Skin Pores Refreshing Cleansing Skincare", "handle": "eelhope-kojic-acid-turmeric-cleansing-pad-gently-cleanses-facial-skin-pores-refreshing-cleansing-skincare", "tags": "skincarre", "url": "https://shop.aloha.id.vn/products/eelhope-kojic-acid-turmeric-cleansing-pad-gently-cleanses-facial-skin-pores-refreshing-cleansing-skincare", "price": "24.10", "product_type": "", "vendor": "eprolo", "status": "active", "sku": "EH-A05-0012-01", "variant": "default title", "image": "https://cdn.shopify.com/s/files/1/0623/5340/8063/files/C4C3889EEF8902F3364F7C2C3E956312.jpg?v=1757001839", "inventory_quantity": 189, "available": true, "text": "kin. URL: https://shop.aloha.id.vn/products/eelhope-kojic-acid-turmeric-cleansing-pad-gently-cleanses-facial-skin-pores-refreshing-cleansing-skincare"}, {"type": "product", "id": 7890227822655, "title": "Eelhope Protective Moisturizer Moisturizes And Brightens The Skin And Protects Against Outdoor Uv Rays", "handle": "eelhope-protective-moisturizer-moisturizes-and-brightens-the-skin-and-protects-against-outdoor-uv-rays", "tags": "skincare", "url": "https://shop.aloha.id.vn/products/eelhope-protective-moisturizer-moisturizes-and-brightens-the-skin-and-protects-against-outdoor-uv-rays", "price": "24.10", "product_type": "", "vendor": "eprolo", "status": "active", "sku": "EH-A05-0028-01", "variant": "default title", "image": "https://cdn.shopify.com/s/files/1/0623/5340/8063/files/DA569A3765023C13BA001DFDE9AA913A.jpg?v=1757156552", "inventory_quantity": 100, "available": true, "text": "Product: Eelhope Protective Moisturizer Moisturizes And Brightens The Skin And Protects Against Outdoor Uv Rays Type: Vendor: eprolo Tags: skincare Options: {\"color\": [\"default title\"]} Variant: default title SKU: EH-A05-0028-01 Price: 24.10 Inventory: 100 Available: True Status: active Body: Our protective moisturizing cream contains ethyl hexyl methoxycinnamate and oxicillin. It can brighten the overall skin tone and make the skin more radiant. Its usage method is very simple: Clean your face and keep it dry. Take an appropriate amount of this product and apply it evenly to the face. Gently massage until absorbed. And it can block ultraviolet rays, helping to prevent tanning and light aging. URL: https://shop.aloha.id.vn/products/eelhope-protective-moisturizer-moisturizes-and-brightens-t"}, {"type": "product", "id": 7890227822655, "title": "Eelhope Protective Moisturizer Moisturizes And Brightens The Skin And Protects Against Outdoor Uv Rays", "handle": "eelhope-protective-moisturizer-moisturizes-and-brightens-the-skin-and-protects-against-outdoor-uv-rays", "tags": "skincare", "url": "https://shop.aloha.id.vn/products/eelhope-protective-moisturizer-moisturizes-and-brightens-the-skin-and-protects-against-outdoor-uv-rays", "price": "24.10", "product_type": "", "vendor": "eprolo", "status": "active", "sku": "EH-A05-0028-01", "variant": "default title", "image": "https://cdn.shopify.com/s/files/1/0623/5340/8063/files/DA569A3765023C13BA001DFDE9AA913A.jpg?v=1757156552", "inventory_quantity": 100, "available": true, "text": "he-skin-and-protects-against-outdoor-uv-rays"}, {"type": "product", "id": 7890249187391, "title": "Eye Drops, Eye Moisturizing Drops Relieve Dryness Soothing Moisturizing Maintenance Eye Health Care Solution", "handle": "eye-drops-eye-moisturizing-drops-relieve-dryness-soothing-moisturizing-maintenance-eye-health-care-solution", "tags": "Docteat Herbal Body Care", "url": "https://shop.aloha.id.vn/products/eye-drops-eye-moisturizing-drops-relieve-dryness-soothing-moisturizing-maintenance-eye-health-care-solution", "price": "22.78", "product_type": "", "vendor": "eprolo", "status": "active", "sku": "XIB03-A025-10-WH1", "variant": "default title", "image": "https://cdn.shopify.com/s/files/1/0623/5340/8063/files/392FA94D53E56693C2E257E61A20F375.jpg?v=1757165383", "inventory_quantity": 197, "available": true, "text": "Product: Eye Drops, Eye Moisturizing Drops Relieve Dryness Soothing Moisturizing Maintenance Eye Health Care Solution Type: Vendor: eprolo Tags: Docteat Herbal Body Care Options: {\"color\": [\"default title\"]} Variant: default title SKU: XIB03-A025-10-WH1 Price: 22.78 Inventory: 197 Available: True Status: active Body: Our Eye Drops contain Retinyl Palmitate, Ascorbic Acid, Calendula Officinalis Flower Extract. It can deeply moisturize, improve the water content of the eye skin, quickly relieve dry eyes, provide lasting comfort, rich in antioxidants, care for eye health. Its use method is very simple: wash your hands before using the eye drops, tilt your head back or lie flat as far as possible, pull down the lower eyelid to separate it from the eyeball, drop the eye drops into the conjuncti"}, {"type": "product", "id": 7890249187391, "title": "Eye Drops, Eye Moisturizing Drops Relieve Dryness Soothing Moisturizing Maintenance Eye Health Care Solution", "handle": "eye-drops-eye-moisturizing-drops-relieve-dryness-soothing-moisturizing-maintenance-eye-health-care-solution", "tags": "Docteat Herbal Body Care", "url": "https://shop.aloha.id.vn/products/eye-drops-eye-moisturizing-drops-relieve-dryness-soothing-moisturizing-maintenance-eye-health-care-solution", "price": "22.78", "product_type": "", "vendor": "eprolo", "status": "active", "sku": "XIB03-A025-10-WH1", "variant": "default title", "image": "https://cdn.shopify.com/s/files/1/0623/5340/8063/files/392FA94D53E56693C2E257E61A20F375.jpg?v=1757165383", "inventory_quantity": 197, "available": true, "text": "va of the lower fornix, close your eyes for at least five minutes, or gently massage the upper and lower tear glands of the inner corner of the eye with your fingers, and finally wipe away the water and tears from your eyes with a tissue or towel. Suitable for daily use, giving maximum care to the eyes. Improves the overall health of the skin around the eyes. Increase the brightness of the eyes. URL: https://shop.aloha.id.vn/products/eye-drops-eye-moisturizing-drops-relieve-dryness-soothing-moisturizing-maintenance-eye-health-care-solution"}, {"type": "product", "id": 7889466720319, "title": "Face Brightening Serum, Lighten Dark Spots Moisturizing And Repairing Fine Lines Brightening Serum", "handle": "face-brightening-serum-lighten-dark-spots-moisturizing-and-repairing-fine-lines-brightening-serum", "tags": "skincare", "url": "https://shop.aloha.id.vn/products/face-brightening-serum-lighten-dark-spots-moisturizing-and-repairing-fine-lines-brightening-serum", "price": "22.78", "product_type": "", "vendor": "eprolo", "status": "active", "sku": "OUA03-A041-30-BK1", "variant": "default title", "image": "https://cdn.shopify.com/s/files/1/0623/5340/8063/files/873B9EF565E3F8C5981504DE395B14B0.jpg?v=1757040374", "inventory_quantity": 100, "available": true, "text": "Product: Face Brightening Serum, Lighten Dark Spots Moisturizing And Repairing Fine Lines Brightening Serum Type: Vendor: eprolo Tags: skincare Options: {\"color\": [\"default title\"]} Variant: default title SKU: OUA03-A041-30-BK1 Price: 22.78 Inventory: 100 Available: True Status: active Body: Our face lightening serum contains hyaluronic acid, carbomer and glycerin. It inhibits reduced melanin production and prevents the formation of new spots. Break down the stain. Prevent spots from the source, forming a water-locking barrier on the skin surface to prevent dark spots from the source. Its application method is very simple: first, apply the cream on the clean and dry skin, apply an appropriate amount of essential oil on the face, gently massage until the skin is completely absorbed, moistur"}, {"type": "product", "id": 7889466720319, "title": "Face Brightening Serum, Lighten Dark Spots Moisturizing And Repairing Fine Lines Brightening Serum", "handle": "face-brightening-serum-lighten-dark-spots-moisturizing-and-repairing-fine-lines-brightening-serum", "tags": "skincare", "url": "https://shop.aloha.id.vn/products/face-brightening-serum-lighten-dark-spots-moisturizing-and-repairing-fine-lines-brightening-serum", "price": "22.78", "product_type": "", "vendor": "eprolo", "status": "active", "sku": "OUA03-A041-30-BK1", "variant": "default title", "image": "https://cdn.shopify.com/s/files/1/0623/5340/8063/files/873B9EF565E3F8C5981504DE395B14B0.jpg?v=1757040374", "inventory_quantity": 100, "available": true, "text": "ize and nourish the skin after use, make the skin smooth and bright, eliminate dark spots, and make the skin more white. URL: https://shop.aloha.id.vn/products/face-brightening-serum-lighten-dark-spots-moisturizing-and-repairing-fine-lines-brightening-serum"}, {"type": "product", "id": 7889137336383, "title": "Face Essence Gently Moisturizes Facial Skin With Hydrating And Moisturizing Daily Skincare And Beauty Serum", "handle": "face-essence-gently-moisturizes-facial-skin-with-hydrating-and-moisturizing-daily-skincare-and-beauty-serum", "tags": "skincare", "url": "https://shop.aloha.id.vn/products/face-essence-gently-moisturizes-facial-skin-with-hydrating-and-moisturizing-daily-skincare-and-beauty-serum", "price": "22.92", "product_type": "", "vendor": "eprolo", "status": "active", "sku": "HO-A05-0471-01", "variant": "default title", "image": "https://cdn.shopify.com/s/files/1/0623/5340/8063/files/13E0953DBFD63579F82D41E9A13ED312.jpg?v=1757002266", "inventory_quantity": 116, "available": true, "text": "Product: Face Essence Gently Moisturizes Facial Skin With Hydrating And Moisturizing Daily Skincare And Beauty Serum Type: Vendor: eprolo Tags: skincare Options: {\"color\": [\"default title\"]} Variant: default title SKU: HO-A05-0471-01 Price: 22.92 Inventory: 116 Available: True Status: active Body: Our facial serum contains glycerin, carbomer. It can effectively nourish the skin, enhance the overall glow, help to balance the complexion and make the skin brighter. The way to use it is simple: clean the face and keep the skin dry. Take appropriate amount of serum, evenly apply on face, gently massage to promote absorption. And citrus extracts provide powerful antioxidants that protect against free radical damage. URL: https://shop.aloha.id.vn/products/face-essence-gently-moisturizes-facial-sk"}, {"type": "product", "id": 7889137336383, "title": "Face Essence Gently Moisturizes Facial Skin With Hydrating And Moisturizing Daily Skincare And Beauty Serum", "handle": "face-essence-gently-moisturizes-facial-skin-with-hydrating-and-moisturizing-daily-skincare-and-beauty-serum", "tags": "skincare", "url": "https://shop.aloha.id.vn/products/face-essence-gently-moisturizes-facial-skin-with-hydrating-and-moisturizing-daily-skincare-and-beauty-serum", "price": "22.92", "product_type": "", "vendor": "eprolo", "status": "active", "sku": "HO-A05-0471-01", "variant": "default title", "image": "https://cdn.shopify.com/s/files/1/0623/5340/8063/files/13E0953DBFD63579F82D41E9A13ED312.jpg?v=1757002266", "inventory_quantity": 116, "available": true, "text": "in-with-hydrating-and-moisturizing-daily-skincare-and-beauty-serum"}, {"type": "product", "id": 7889478680639, "title": "Face Serum, Anti-wrinkle Moisturizing Firming And Anti-aging Essence", "handle": "face-serum-anti-wrinkle-moisturizing-firming-and-anti-aging-essence", "tags": "skincare", "url": "https://shop.aloha.id.vn/products/face-serum-anti-wrinkle-moisturizing-firming-and-anti-aging-essence", "price": "22.78", "product_type": "", "vendor": "eprolo", "status": "active", "sku": "OUA02-A040-30-WH1", "variant": "default title", "image": "https://cdn.shopify.com/s/files/1/0623/5340/8063/files/34283D0B16FA57DE6117DE23D717A3C2.jpg?v=1757045897", "inventory_quantity": 100, "available": true, "text": "Product: Face Serum, Anti-wrinkle Moisturizing Firming And Anti-aging Essence Type: Vendor: eprolo Tags: skincare Options: {\"color\": [\"default title\"]} Variant: default title SKU: OUA02-A040-30-WH1 Price: 22.78 Inventory: 100 Available: True Status: active Body: Our Face Serum contain oligopeptide-10, green tea extract, horehound extract. It can anti aging, replenish moisture, moisturize and nourish skin, fade wrinkles, increase skin elasticity. Its usage is simple: After cleansing and toning, take an appropriate amount of essence and apply it evenly on the facial skin, massage gently with your hands in circular motions to absorb it. Reduces wrinkles, anti-aging, tightens skin, and makes you look younger and more radiant. URL: https://shop.aloha.id.vn/products/face-serum-anti-wrinkle-moist"}, {"type": "product", "id": 7889478680639, "title": "Face Serum, Anti-wrinkle Moisturizing Firming And Anti-aging Essence", "handle": "face-serum-anti-wrinkle-moisturizing-firming-and-anti-aging-essence", "tags": "skincare", "url": "https://shop.aloha.id.vn/products/face-serum-anti-wrinkle-moisturizing-firming-and-anti-aging-essence", "price": "22.78", "product_type": "", "vendor": "eprolo", "status": "active", "sku": "OUA02-A040-30-WH1", "variant": "default title", "image": "https://cdn.shopify.com/s/files/1/0623/5340/8063/files/34283D0B16FA57DE6117DE23D717A3C2.jpg?v=1757045897", "inventory_quantity": 100, "available": true, "text": "urizing-firming-and-anti-aging-essence"}, {"type": "product", "id": 7889142054975, "title": "Facial Firming Serum Moisturizes And Moisturizes Facial Skin Gently And Nourishes Daily Skincare", "handle": "facial-firming-serum-moisturizes-and-moisturizes-facial-skin-gently-and-nourishes-daily-skincare", "tags": "skincare", "url": "https://shop.aloha.id.vn/products/facial-firming-serum-moisturizes-and-moisturizes-facial-skin-gently-and-nourishes-daily-skincare", "price": "22.78", "product_type": "", "vendor": "eprolo", "status": "active", "sku": "OU-A05-0403-01", "variant": "default title", "image": "https://cdn.shopify.com/s/files/1/0623/5340/8063/files/78126CB55087472B438EAE987DFF6E05.jpg?v=1757002376", "inventory_quantity": 149, "available": true, "text": "Product: Facial Firming Serum Moisturizes And Moisturizes Facial Skin Gently And Nourishes Daily Skincare Type: Vendor: eprolo Tags: skincare Options: {\"color\": [\"default title\"]} Variant: default title SKU: OU-A05-0403-01 Price: 22.78 Inventory: 149 Available: True Status: active Body: Our face serum contains vitamin E (tocopherol) and vitamin C (ascorbic acid). It can promote collagen production, significantly reduce fine lines, and restore elasticity. Its application method is very simple: clean the facial skin, keep the skin dry, apply appropriate amount of this product evenly on the facial skin, gently massage in circles to promote absorption. It also locks in moisture and provides long-lasting moisture, leaving skin softer and smoother. URL: https://shop.aloha.id.vn/products/facial-f"}, {"type": "product", "id": 7889142054975, "title": "Facial Firming Serum Moisturizes And Moisturizes Facial Skin Gently And Nourishes Daily Skincare", "handle": "facial-firming-serum-moisturizes-and-moisturizes-facial-skin-gently-and-nourishes-daily-skincare", "tags": "skincare", "url": "https://shop.aloha.id.vn/products/facial-firming-serum-moisturizes-and-moisturizes-facial-skin-gently-and-nourishes-daily-skincare", "price": "22.78", "product_type": "", "vendor": "eprolo", "status": "active", "sku": "OU-A05-0403-01", "variant": "default title", "image": "https://cdn.shopify.com/s/files/1/0623/5340/8063/files/78126CB55087472B438EAE987DFF6E05.jpg?v=1757002376", "inventory_quantity": 149, "available": true, "text": "irming-serum-moisturizes-and-moisturizes-facial-skin-gently-and-nourishes-daily-skincare"}, {"type": "product", "id": 7890250203199, "title": "Googeer Body Care Tea Relieves Eye Fatigue Body Discomfort Body Shaping Health Care Individually Packaged Tea Bag", "handle": "googeer-body-care-tea-relieves-eye-fatigue-body-discomfort-body-shaping-health-care-individually-packaged-tea-bag", "tags": "", "url": "https://shop.aloha.id.vn/products/googeer-body-care-tea-relieves-eye-fatigue-body-discomfort-body-shaping-health-care-individually-packaged-tea-bag", "price": "21.82", "product_type": "", "vendor": "eprolo", "status": "active", "sku": "GOA08-A005-6-YE1", "variant": "default title", "image": "https://cdn.shopify.com/s/files/1/0623/5340/8063/files/7C89DB457960D49B959F5754726D21D4.jpg?v=1757165483", "inventory_quantity": 561, "available": true, "text": "Product: Googeer Body Care Tea Relieves Eye Fatigue Body Discomfort Body Shaping Health Care Individually Packaged Tea Bag Type: Vendor: eprolo Tags: Options: {\"color\": [\"default title\"]} Variant: default title SKU: GOA08-A005-6-YE1 Price: 21.82 Inventory: 561 Available: True Status: active Body: Our body care tea contains orange peel, bergamot and honeysuckle. It can reduce the burden on the liver and support liver health. The way to use it is simple: 1. Take out a tea bag and put it in a water cup; 2. Eliminate waste in the body and reduce the burden on the liver; 3. Maintain a healthier and more comfortable environment both internally and externally. Body care tea helps protect liver damage and ensure normal; Eliminate waste from the body and reduce the burden on the liver. URL: https:/"}, {"type": "product", "id": 7890250203199, "title": "Googeer Body Care Tea Relieves Eye Fatigue Body Discomfort Body Shaping Health Care Individually Packaged Tea Bag", "handle": "googeer-body-care-tea-relieves-eye-fatigue-body-discomfort-body-shaping-health-care-individually-packaged-tea-bag", "tags": "", "url": "https://shop.aloha.id.vn/products/googeer-body-care-tea-relieves-eye-fatigue-body-discomfort-body-shaping-health-care-individually-packaged-tea-bag", "price": "21.82", "product_type": "", "vendor": "eprolo", "status": "active", "sku": "GOA08-A005-6-YE1", "variant": "default title", "image": "https://cdn.shopify.com/s/files/1/0623/5340/8063/files/7C89DB457960D49B959F5754726D21D4.jpg?v=1757165483", "inventory_quantity": 561, "available": true, "text": "/shop.aloha.id.vn/products/googeer-body-care-tea-relieves-eye-fatigue-body-discomfort-body-shaping-health-care-individually-packaged-tea-bag"}, {"type": "product", "id": 7890248728639, "title": "Googeer Cardio Pure Black Seed Oil, Body Maintenance Balance Blood Lipids Sugar Soothing Body Care Oral Drops", "handle": "googeer-cardio-pure-black-seed-oil-body-maintenance-balance-blood-lipids-sugar-soothing-body-care-oral-drops", "tags": "Docteat Herbal Body Care Drops", "url": "https://shop.aloha.id.vn/products/googeer-cardio-pure-black-seed-oil-body-maintenance-balance-blood-lipids-sugar-soothing-body-care-oral-drops", "price": "31.12", "product_type": "", "vendor": "eprolo", "status": "active", "sku": "GOA06-A004-30-MK1", "variant": "default title", "image": "https://cdn.shopify.com/s/files/1/0623/5340/8063/files/3AF3389D0F76AF33E54DEB562AF36B83.jpg?v=1757165103", "inventory_quantity": 681, "available": true, "text": "Product: Googeer Cardio Pure Black Seed Oil, Body Maintenance Balance Blood Lipids Sugar Soothing Body Care Oral Drops Type: Vendor: eprolo Tags: Docteat Herbal Body Care Drops Options: {\"color\": [\"default title\"]} Variant: default title SKU: GOA06-A004-30-MK1 Price: 31.12 Inventory: 681 Available: True Status: active Body: Our black seed oil care drops contain black seed oil. It can improve cardiovascular health. The way to use it is very simple: shake well before eating, take 1-2 drops each time, 1-2 times a day. And can regulate cholesterol levels. URL: https://shop.aloha.id.vn/products/googeer-cardio-pure-black-seed-oil-body-maintenance-balance-blood-lipids-sugar-soothing-body-care-oral-drops"}, {"type": "product", "id": 7890250268735, "title": "Googeer Dense Hair Dietary Supplement Drops Nourishes Roots, Prevents Breakouts And Strengthens Hair Care Supplements", "handle": "googeer-dense-hair-dietary-supplement-drops-nourishes-roots-prevents-breakouts-and-strengthens-hair-care-supplements", "tags": "", "url": "https://shop.aloha.id.vn/products/googeer-dense-hair-dietary-supplement-drops-nourishes-roots-prevents-breakouts-and-strengthens-hair-care-supplements", "price": "21.82", "product_type": "", "vendor": "eprolo", "status": "active", "sku": "GOB01-A001-30-GN1", "variant": "default title", "image": "https://cdn.shopify.com/s/files/1/0623/5340/8063/files/39BA17412338CE6B3A89DA69D4274757.jpg?v=1757165491", "inventory_quantity": 965, "available": true, "text": "Product: Googeer Dense Hair Dietary Supplement Drops Nourishes Roots, Prevents Breakouts And Strengthens Hair Care Supplements Type: Vendor: eprolo Tags: Options: {\"color\": [\"default title\"]} Variant: default title SKU: GOB01-A001-30-GN1 Price: 21.82 Inventory: 965 Available: True Status: active Body: Our dense hair dietary supplement drops contain vitamin B2, ginger extract, collagen. It can help strengthen weak hair, improve hair health and thickness, and make hair noticeably thicker and fuller. Promote hair follicle regeneration, reduce scalp inflammation, improve hair elasticity and strength, improve hair quality, increase hair and scalp softness, and make hair look smoother and shiny. Its use is very simple: Method one: pour into the cup and dilute; Method 2: Directly drop into the in"}, {"type": "product", "id": 7890250268735, "title": "Googeer Dense Hair Dietary Supplement Drops Nourishes Roots, Prevents Breakouts And Strengthens Hair Care Supplements", "handle": "googeer-dense-hair-dietary-supplement-drops-nourishes-roots-prevents-breakouts-and-strengthens-hair-care-supplements", "tags": "", "url": "https://shop.aloha.id.vn/products/googeer-dense-hair-dietary-supplement-drops-nourishes-roots-prevents-breakouts-and-strengthens-hair-care-supplements", "price": "21.82", "product_type": "", "vendor": "eprolo", "status": "active", "sku": "GOB01-A001-30-GN1", "variant": "default title", "image": "https://cdn.shopify.com/s/files/1/0623/5340/8063/files/39BA17412338CE6B3A89DA69D4274757.jpg?v=1757165491", "inventory_quantity": 965, "available": true, "text": "let; Shake well before serving, 1-2 drops at a time. Dense Hair dietary supplement drops exfoliate and remove dead skin cells, promoting stronger, healthier hair that is easy to use and suitable for current daily life. URL: https://shop.aloha.id.vn/products/googeer-dense-hair-dietary-supplement-drops-nourishes-roots-prevents-breakouts-and-strengthens-hair-care-supplements"}, {"type": "product", "id": 7890249023551, "title": "Googeer Dietary Supplement Capsule, Dietary Supplement For Body Treatment", "handle": "googeer-dietary-supplement-capsule-dietary-supplement-for-body-treatment", "tags": "Docteat Herbal Body Care", "url": "https://shop.aloha.id.vn/products/googeer-dietary-supplement-capsule-dietary-supplement-for-body-treatment", "price": "24.10", "product_type": "", "vendor": "eprolo", "status": "active", "sku": "GO-I02-0178-01", "variant": "default title", "image": "https://cdn.shopify.com/s/files/1/0623/5340/8063/files/7D3EBB3C9455F88C7CC2FC9FA5DFDFFC.jpg?v=1757165326", "inventory_quantity": 139, "available": true, "text": "Product: Googeer Dietary Supplement Capsule, Dietary Supplement For Body Treatment Type: Vendor: eprolo Tags: Docteat Herbal Body Care Options: {\"color\": [\"default title\"]} Variant: default title SKU: GO-I02-0178-01 Price: 24.10 Inventory: 139 Available: True Status: active Body: Our dietary supplement capsules contain sodium and food colorants. It provides a full vitamin C supplement. Suitable for people who use electronic products a lot. Its use is very simple: 2 times a day, 1 to 2 capsules each time. And the use of high-quality ingredients to ensure safety, improve physical vitality, promote healthy living. URL: https://shop.aloha.id.vn/products/googeer-dietary-supplement-capsule-dietary-supplement-for-body-treatment"}, {"type": "product", "id": 7890248990783, "title": "Googeer Energy Supplement, Energy Supplement Body Care Enhancement Supplement", "handle": "googeer-energy-supplement-energy-supplement-body-care-enhancement-supplement", "tags": "Food Supplements", "url": "https://shop.aloha.id.vn/products/googeer-energy-supplement-energy-supplement-body-care-enhancement-supplement", "price": "24.10", "product_type": "", "vendor": "eprolo", "status": "active", "sku": "GOH02-A028-30-BK1", "variant": "default title", "image": "https://cdn.shopify.com/s/files/1/0623/5340/8063/files/B3DC33634DED9E40779C77B4B1245752.jpg?v=1757165291", "inventory_quantity": 325, "available": true, "text": "Product: Googeer Energy Supplement, Energy Supplement Body Care Enhancement Supplement Type: Vendor: eprolo Tags: Food Supplements Options: {\"color\": [\"default title\"]} Variant: default title SKU: GOH02-A028-30-BK1 Price: 24.10 Inventory: 325 Available: True Status: active Body: Our energy supplement contains ginseng extract, damiana leaf extract and saw palmetto extract. It can relieve stress and anxiety, enhance relaxation and positive emotions, make people feel more confident and happy, and engage more in intimate experiences. Its usage is very simple: Shake well before consumption. Take 1-2 drops each time, 1-2 times a day. And it can improve the length and hardness of men's private parts and enhance the quality of nightlife. URL: https://shop.aloha.id.vn/products/googeer-energy-supple"}, {"type": "product", "id": 7890248990783, "title": "Googeer Energy Supplement, Energy Supplement Body Care Enhancement Supplement", "handle": "googeer-energy-supplement-energy-supplement-body-care-enhancement-supplement", "tags": "Food Supplements", "url": "https://shop.aloha.id.vn/products/googeer-energy-supplement-energy-supplement-body-care-enhancement-supplement", "price": "24.10", "product_type": "", "vendor": "eprolo", "status": "active", "sku": "GOH02-A028-30-BK1", "variant": "default title", "image": "https://cdn.shopify.com/s/files/1/0623/5340/8063/files/B3DC33634DED9E40779C77B4B1245752.jpg?v=1757165291", "inventory_quantity": 325, "available": true, "text": "ment-energy-supplement-body-care-enhancement-supplement"}, {"type": "product", "id": 7890250104895, "title": "Googeer Herbal Prostate Health Tea Prostate Health Body Treatment", "handle": "googeer-herbal-prostate-health-tea-prostate-health-body-treatment", "tags": "", "url": "https://shop.aloha.id.vn/products/googeer-herbal-prostate-health-tea-prostate-health-body-treatment", "price": "24.10", "product_type": "", "vendor": "eprolo", "status": "active", "sku": "GO-I02-0204-01", "variant": "default title", "image": "https://cdn.shopify.com/s/files/1/0623/5340/8063/files/A1EAF32FC446775A6B9FD88ED4AA3D77.jpg?v=1757165424", "inventory_quantity": 457, "available": true, "text": "Product: Googeer Herbal Prostate Health Tea Prostate Health Body Treatment Type: Vendor: eprolo Tags: Options: {\"color\": [\"default title\"]} Variant: default title SKU: GO-I02-0204-01 Price: 24.10 Inventory: 457 Available: True Status: active Body: Our herbal Prostate Health tea contains astragalus and green tea. It can promote circulation and improve physical health. Its use is very simple: put a tea bag in a cup, add about 200 ml of boiling water, soak for 3-4 minutes. It can also maintain prostate health and improve discomfort. URL: https://shop.aloha.id.vn/products/googeer-herbal-prostate-health-tea-prostate-health-body-treatment"}, {"type": "product", "id": 7890248859711, "title": "Googeer Intestinal Digestion Capsules, Dietary Supplements For Body Treatments", "handle": "googeer-intestinal-digestion-capsules-dietary-supplements-for-body-treatments", "tags": "Food Supplements", "url": "https://shop.aloha.id.vn/products/googeer-intestinal-digestion-capsules-dietary-supplements-for-body-treatments", "price": "24.10", "product_type": "", "vendor": "eprolo", "status": "active", "sku": "GO-B04-0005-01", "variant": "default title", "image": "https://cdn.shopify.com/s/files/1/0623/5340/8063/files/EF423DAF58CC80D38C0FB4A4A5C77F23.jpg?v=1757165220", "inventory_quantity": 141, "available": true, "text": "Product: Googeer Intestinal Digestion Capsules, Dietary Supplements For Body Treatments Type: Vendor: eprolo Tags: Food Supplements Options: {\"color\": [\"default title\"]} Variant: default title SKU: GO-B04-0005-01 Price: 24.10 Inventory: 141 Available: True Status: active Body: Our intestinal digestion capsules contain sodium and food colorants. It can help food break down and improve nutrient absorption. Its use is very simple: 2 times a day, 1 to 2 capsules each time. And rich in vitamins, can strengthen the resistance. URL: https://shop.aloha.id.vn/products/googeer-intestinal-digestion-capsules-dietary-supplements-for-body-treatments"}, {"type": "product", "id": 7890250235967, "title": "Googeer Lung Clearing Drops, Dietary Supplements Lower Body Treatments", "handle": "googeer-lung-clearing-drops-dietary-supplements-lower-body-treatments", "tags": "", "url": "https://shop.aloha.id.vn/products/googeer-lung-clearing-drops-dietary-supplements-lower-body-treatments", "price": "21.82", "product_type": "", "vendor": "eprolo", "status": "active", "sku": "GOB07-A028-30-BK1", "variant": "default title", "image": "https://cdn.shopify.com/s/files/1/0623/5340/8063/files/B37FEE25D55A4D8CA9E4C88BCCB2B042.jpg?v=1757165488", "inventory_quantity": 552, "available": true, "text": "Product: Googeer Lung Clearing Drops, Dietary Supplements Lower Body Treatments Type: Vendor: eprolo Tags: Options: {\"color\": [\"default title\"]} Variant: default title SKU: GOB07-A028-30-BK1 Price: 21.82 Inventory: 552 Available: True Status: active Body: Our lung cleansing drops contain potassium sorbate and mint leaf extract. It can be quickly absorbed and effectively supplemented with nutrients. Its use is simple: shake well before consumption, take 1-2 drops at a time, 1-2 times a day. And pure plant extraction, safe and reliable. Drop form, easy to absorb and carry. URL: https://shop.aloha.id.vn/products/googeer-lung-clearing-drops-dietary-supplements-lower-body-treatments"}, {"type": "product", "id": 7890250137663, "title": "Googeer Nourishing Scalp Growth Supplement Capsule Hair Treatment", "handle": "googeer-nourishing-scalp-growth-supplement-capsule-hair-treatment", "tags": "", "url": "https://shop.aloha.id.vn/products/googeer-nourishing-scalp-growth-supplement-capsule-hair-treatment", "price": "24.10", "product_type": "", "vendor": "eprolo", "status": "active", "sku": "GO-I02-0213-01", "variant": "default title", "image": "https://cdn.shopify.com/s/files/1/0623/5340/8063/files/7C7C972DA454411163FDDB1540F2E401.jpg?v=1757165474", "inventory_quantity": 193, "available": true, "text": "Product: Googeer Nourishing Scalp Growth Supplement Capsule Hair Treatment Type: Vendor: eprolo Tags: Options: {\"color\": [\"default title\"]} Variant: default title SKU: GO-I02-0213-01 Price: 24.10 Inventory: 193 Available: True Status: active Body: Our Scalp growth supplement capsules contain vitamin C, sodium, food coloring agent. It can provide nutritional support to the scalp and improve the overall condition of the hair. Its use is simple: take 1 to 2 capsules twice a day. And can effectively protect the roots of hair, reduce daily hair loss problems. URL: https://shop.aloha.id.vn/products/googeer-nourishing-scalp-growth-supplement-capsule-hair-treatment"}, {"type": "product", "id": 7890248532031, "title": "Googeer Testosterone Enhancing Drops, Food Supplements And Body Care Body Supplements", "handle": "googeer-testosterone-enhancing-drops-food-supplements-and-body-care-body-supplements", "tags": "Food Supplements", "url": "https://shop.aloha.id.vn/products/googeer-testosterone-enhancing-drops-food-supplements-and-body-care-body-supplements", "price": "24.12", "product_type": "", "vendor": "eprolo", "status": "active", "sku": "GO-I02-0201-01", "variant": "default title", "image": "https://cdn.shopify.com/s/files/1/0623/5340/8063/files/E9D132769F255A961E8048CA40E72ED4.jpg?v=1757164924", "inventory_quantity": 191, "available": true, "text": "Product: Googeer Testosterone Enhancing Drops, Food Supplements And Body Care Body Supplements Type: Vendor: eprolo Tags: Food Supplements Options: {\"color\": [\"default title\"]} Variant: default title SKU: GO-I02-0201-01 Price: 24.12 Inventory: 191 Available: True Status: active Body: Our testosterone enhancement drops contain extracts of Hibiscus and ginseng. It can provide the body with continuous energy and keep it full of vitality. Its usage is very simple: Shake well before consumption. Take 1-2 drops each time, 1-2 times a day. And it is absorbed quickly, takes effect rapidly, and helps adapt to a fast-paced life. URL: https://shop.aloha.id.vn/products/googeer-testosterone-enhancing-drops-food-supplements-and-body-care-body-supplements"}, {"type": "product", "id": 7890249252927, "title": "Hair Regrowth Ampoules, Nourish The Scalp To Promote Germinal Nourish Hair Follicle Health Care Essence", "handle": "hair-regrowth-ampoules-nourish-the-scalp-to-promote-germinal-nourish-hair-follicle-health-care-essence", "tags": "", "url": "https://shop.aloha.id.vn/products/hair-regrowth-ampoules-nourish-the-scalp-to-promote-germinal-nourish-hair-follicle-health-care-essence", "price": "22.78", "product_type": "", "vendor": "eprolo", "status": "active", "sku": "HGA03-A105-14-WH1", "variant": "default title", "image": "https://cdn.shopify.com/s/files/1/0623/5340/8063/files/00B825183C65AA1945B45753B7D6E408.jpg?v=1757165401", "inventory_quantity": 95, "available": true, "text": "Product: Hair Regrowth Ampoules, Nourish The Scalp To Promote Germinal Nourish Hair Follicle Health Care Essence Type: Vendor: eprolo Tags: Options: {\"color\": [\"default title\"]} Variant: default title SKU: HGA03-A105-14-WH1 Price: 22.78 Inventory: 95 Available: True Status: active Body: Our Hair Regrowth Ampoules contains Coffea Arabica (Coffee) Seed Extract, Citrus Medica Limonum (Lemon) Fruit Extract, Citrus Aurantium Dulcis (Orange) Peel Oil. It can deeply nourish, significantly accelerate hair growth, strengthen hair follicles, reduce hair loss, keep hair thick, improve hair quality, and increase hair shine. Its application method is very simple: clean dry hair, flick the top of the ampere, break it off, take a proper amount of serum, evenly apply to the scalp and hair, gently massage "}, {"type": "product", "id": 7890249252927, "title": "Hair Regrowth Ampoules, Nourish The Scalp To Promote Germinal Nourish Hair Follicle Health Care Essence", "handle": "hair-regrowth-ampoules-nourish-the-scalp-to-promote-germinal-nourish-hair-follicle-health-care-essence", "tags": "", "url": "https://shop.aloha.id.vn/products/hair-regrowth-ampoules-nourish-the-scalp-to-promote-germinal-nourish-hair-follicle-health-care-essence", "price": "22.78", "product_type": "", "vendor": "eprolo", "status": "active", "sku": "HGA03-A105-14-WH1", "variant": "default title", "image": "https://cdn.shopify.com/s/files/1/0623/5340/8063/files/00B825183C65AA1945B45753B7D6E408.jpg?v=1757165401", "inventory_quantity": 95, "available": true, "text": "until absorbed. It protects the scalp from foreign aggression. Regulate scalp oil secretion to avoid excessive oil and blockage. URL: https://shop.aloha.id.vn/products/hair-regrowth-ampoules-nourish-the-scalp-to-promote-germinal-nourish-hair-follicle-health-care-essence"}, {"type": "product", "id": 7890249318463, "title": "Herbal Sleep Patch, Care For Sleep, Relax And Relieve Body Pressure Body Health Care Point Patch", "handle": "herbal-sleep-patch-care-for-sleep-relax-and-relieve-body-pressure-body-health-care-point-patch", "tags": "", "url": "https://shop.aloha.id.vn/products/herbal-sleep-patch-care-for-sleep-relax-and-relieve-body-pressure-body-health-care-point-patch", "price": "22.78", "product_type": "", "vendor": "eprolo", "status": "active", "sku": "SOA06-A065-10-VT1", "variant": "default title", "image": "https://cdn.shopify.com/s/files/1/0623/5340/8063/files/63B5A68294156291B8AD2F91230AAE80.jpg?v=1757165416", "inventory_quantity": 100, "available": true, "text": "Product: Herbal Sleep Patch, Care For Sleep, Relax And Relieve Body Pressure Body Health Care Point Patch Type: Vendor: eprolo Tags: Options: {\"color\": [\"default title\"]} Variant: default title SKU: SOA06-A065-10-VT1 Price: 22.78 Inventory: 100 Available: True Status: active Body: Our Herbal Sleep Patch contain jasmine, lavender and hops. It can relieve fatigue and anxiety from work and study during the day, relax the body and mind, and make the spirit more peaceful. A variety of herbal ingredients work together to create a safe sleeping environment through skin absorption and odor influence. Its use method is very simple: clean and dry the skin before going to bed, open the package to remove the patch, peel off the back film after the patch on the skin, gently press, wake up to peel off t"}, {"type": "product", "id": 7890249318463, "title": "Herbal Sleep Patch, Care For Sleep, Relax And Relieve Body Pressure Body Health Care Point Patch", "handle": "herbal-sleep-patch-care-for-sleep-relax-and-relieve-body-pressure-body-health-care-point-patch", "tags": "", "url": "https://shop.aloha.id.vn/products/herbal-sleep-patch-care-for-sleep-relax-and-relieve-body-pressure-body-health-care-point-patch", "price": "22.78", "product_type": "", "vendor": "eprolo", "status": "active", "sku": "SOA06-A065-10-VT1", "variant": "default title", "image": "https://cdn.shopify.com/s/files/1/0623/5340/8063/files/63B5A68294156291B8AD2F91230AAE80.jpg?v=1757165416", "inventory_quantity": 100, "available": true, "text": "he patch can be. Reduce the time to fall asleep, enhance deep sleep, reduce insomnia, dreaminess and other conditions, and improve sleep quality. URL: https://shop.aloha.id.vn/products/herbal-sleep-patch-care-for-sleep-relax-and-relieve-body-pressure-body-health-care-point-patch"}, {"type": "product", "id": 7890248958015, "title": "Hoegoa Leave-In Dry Hair Spray Supplement Is Effective At Cleaning And Keeping Hair Fresh And Repaired", "handle": "hoegoa-leave-in-dry-hair-spray-supplement-is-effective-at-cleaning-and-keeping-hair-fresh-and-repaired", "tags": "", "url": "https://shop.aloha.id.vn/products/hoegoa-leave-in-dry-hair-spray-supplement-is-effective-at-cleaning-and-keeping-hair-fresh-and-repaired", "price": "24.10", "product_type": "", "vendor": "eprolo", "status": "active", "sku": "HG-A03-0288-01", "variant": "default title", "image": "https://cdn.shopify.com/s/files/1/0623/5340/8063/files/D30873D3850473B1A7DAEFC44DBCA311.jpg?v=1757165263", "inventory_quantity": 187, "available": true, "text": "Product: Hoegoa Leave-In Dry Hair Spray Supplement Is Effective At Cleaning And Keeping Hair Fresh And Repaired Type: Vendor: eprolo Tags: Options: {\"color\": [\"default title\"]} Variant: default title SKU: HG-A03-0288-01 Price: 24.10 Inventory: 187 Available: True Status: active Body: Our organic dry powder (supplement) contains modified corn starch and aluminum amyloctenyl succinate. It can quickly remove oil and restore fresh hair. Its use is very simple: just add this product to the bottle, evenly spray the right amount of hair roots, comb out. It also instantly increases the volume of the roots of the hair, creating a thickening effect. URL: https://shop.aloha.id.vn/products/hoegoa-leave-in-dry-hair-spray-supplement-is-effective-at-cleaning-and-keeping-hair-fresh-and-repaired"}, {"type": "product", "id": 7889465475135, "title": "Hoygi Brightening Face Serum, Dilute Spots Blain To Imprint Carry Bright Color Of Skin Filling Water Moist Firming Essence", "handle": "hoygi-brightening-face-serum-dilute-spots-blain-to-imprint-carry-bright-color-of-skin-filling-water-moist-firming-essence", "tags": "skincare", "url": "https://shop.aloha.id.vn/products/hoygi-brightening-face-serum-dilute-spots-blain-to-imprint-carry-bright-color-of-skin-filling-water-moist-firming-essence", "price": "24.10", "product_type": "", "vendor": "eprolo", "status": "active", "sku": "HOA05-A095-30-WH1", "variant": "default title", "image": "https://cdn.shopify.com/s/files/1/0623/5340/8063/files/EB215B695008B1B0EF06E6EBD43B4DAB.jpg?v=1757039818", "inventory_quantity": 100, "available": true, "text": "Product: Hoygi Brightening Face Serum, Dilute Spots Blain To Imprint Carry Bright Color Of Skin Filling Water Moist Firming Essence Type: Vendor: eprolo Tags: skincare Options: {\"color\": [\"default title\"]} Variant: default title SKU: HOA05-A095-30-WH1 Price: 24.10 Inventory: 100 Available: True Status: active Body: Our whitening serum contains hydroxyethyl cellulose, hyaluronic acid and collagen. It can deeply hydrate and moisturize, help promote skin cell renewal, even skin tone, prevent regrowth of dark spots, make skin tone more even, and give you beautiful skin. Its application method is very simple: dry your face, take the appropriate amount of essence evenly apply to the face skin, gently massage until absorbed. It can effectively reduce and reduce dark spots and dark spots, making t"}, {"type": "product", "id": 7889465475135, "title": "Hoygi Brightening Face Serum, Dilute Spots Blain To Imprint Carry Bright Color Of Skin Filling Water Moist Firming Essence", "handle": "hoygi-brightening-face-serum-dilute-spots-blain-to-imprint-carry-bright-color-of-skin-filling-water-moist-firming-essence", "tags": "skincare", "url": "https://shop.aloha.id.vn/products/hoygi-brightening-face-serum-dilute-spots-blain-to-imprint-carry-bright-color-of-skin-filling-water-moist-firming-essence", "price": "24.10", "product_type": "", "vendor": "eprolo", "status": "active", "sku": "HOA05-A095-30-WH1", "variant": "default title", "image": "https://cdn.shopify.com/s/files/1/0623/5340/8063/files/EB215B695008B1B0EF06E6EBD43B4DAB.jpg?v=1757039818", "inventory_quantity": 100, "available": true, "text": "he skin brighter. URL: https://shop.aloha.id.vn/products/hoygi-brightening-face-serum-dilute-spots-blain-to-imprint-carry-bright-color-of-skin-filling-water-moist-firming-essence"}, {"type": "product", "id": 7890221367359, "title": "Hoygi Facial Exfoliating Essence Gentle Care Facial Skin Brightening Hydrating Moisturizing Essence", "handle": "hoygi-facial-exfoliating-essence-gentle-care-facial-skin-brightening-hydrating-moisturizing-essence", "tags": "skincare", "url": "https://shop.aloha.id.vn/products/hoygi-facial-exfoliating-essence-gentle-care-facial-skin-brightening-hydrating-moisturizing-essence", "price": "31.12", "product_type": "", "vendor": "eprolo", "status": "active", "sku": "HO-A05-0477-01", "variant": "default title", "image": "https://cdn.shopify.com/s/files/1/0623/5340/8063/files/0E7E3613E1D221E361ADD1F94411B343.jpg?v=1757155065", "inventory_quantity": 509, "available": true, "text": "Product: Hoygi Facial Exfoliating Essence Gentle Care Facial Skin Brightening Hydrating Moisturizing Essence Type: Vendor: eprolo Tags: skincare Options: {\"color\": [\"default title\"]} Variant: default title SKU: HO-A05-0477-01 Price: 31.12 Inventory: 509 Available: True Status: active Body: Our facial exfoliating essence contains glycolic acid, hyaluron gel, aloe vera extract. It is a gentle formula that protects the skin without irritation. Helps skin lock in moisture and retain moisture. The way to use it is simple: clean your face. Take an appropriate amount of serum and evenly apply it to your face. Apply gentle pressure to the skin with your fingers to help it absorb better. It can also promote natural skin renewal and make skin glow. URL: https://shop.aloha.id.vn/products/hoygi-facial"}, {"type": "product", "id": 7890221367359, "title": "Hoygi Facial Exfoliating Essence Gentle Care Facial Skin Brightening Hydrating Moisturizing Essence", "handle": "hoygi-facial-exfoliating-essence-gentle-care-facial-skin-brightening-hydrating-moisturizing-essence", "tags": "skincare", "url": "https://shop.aloha.id.vn/products/hoygi-facial-exfoliating-essence-gentle-care-facial-skin-brightening-hydrating-moisturizing-essence", "price": "31.12", "product_type": "", "vendor": "eprolo", "status": "active", "sku": "HO-A05-0477-01", "variant": "default title", "image": "https://cdn.shopify.com/s/files/1/0623/5340/8063/files/0E7E3613E1D221E361ADD1F94411B343.jpg?v=1757155065", "inventory_quantity": 509, "available": true, "text": "-exfoliating-essence-gentle-care-facial-skin-brightening-hydrating-moisturizing-essence"}, {"type": "product", "id": 7889477140543, "title": "Hoygi Facial Firming Serum, Gently Nourishes And Pamper Facial Skin With Moisturizing, Delicate And Hydrating Radiance", "handle": "hoygi-facial-firming-serum-gently-nourishes-and-pamper-facial-skin-with-moisturizing-delicate-and-hydrating-radiance", "tags": "skincare", "url": "https://shop.aloha.id.vn/products/hoygi-facial-firming-serum-gently-nourishes-and-pamper-facial-skin-with-moisturizing-delicate-and-hydrating-radiance", "price": "24.10", "product_type": "", "vendor": "eprolo", "status": "active", "sku": "HO-A05-0862-01", "variant": "default title", "image": "https://cdn.shopify.com/s/files/1/0623/5340/8063/files/00F4AD35D4B1CB3EFB5D0A5511B83DB4.jpg?v=1757045326", "inventory_quantity": 387, "available": true, "text": "Product: Hoygi Facial Firming Serum, Gently Nourishes And Pamper Facial Skin With Moisturizing, Delicate And Hydrating Radiance Type: Vendor: eprolo Tags: skincare Options: {\"color\": [\"default title\"]} Variant: default title SKU: HO-A05-0862-01 Price: 24.10 Inventory: 387 Available: True Status: active Body: Our facial serum is carefully formulated with hyaluronic acid and tocopherol (Vitamin E). Designed to nourish skin texture and improve roughness and discomfort. Easy to use: clean your skin and keep it dry. Apply appropriate amount of this product to face evenly. Massage gently until absorbed. It also moisturizes and locks in moisture, enhancing moisture and fineness. URL: https://shop.aloha.id.vn/products/hoygi-facial-firming-serum-gently-nourishes-and-pamper-facial-skin-with-moisturi"}, {"type": "product", "id": 7889477140543, "title": "Hoygi Facial Firming Serum, Gently Nourishes And Pamper Facial Skin With Moisturizing, Delicate And Hydrating Radiance", "handle": "hoygi-facial-firming-serum-gently-nourishes-and-pamper-facial-skin-with-moisturizing-delicate-and-hydrating-radiance", "tags": "skincare", "url": "https://shop.aloha.id.vn/products/hoygi-facial-firming-serum-gently-nourishes-and-pamper-facial-skin-with-moisturizing-delicate-and-hydrating-radiance", "price": "24.10", "product_type": "", "vendor": "eprolo", "status": "active", "sku": "HO-A05-0862-01", "variant": "default title", "image": "https://cdn.shopify.com/s/files/1/0623/5340/8063/files/00F4AD35D4B1CB3EFB5D0A5511B83DB4.jpg?v=1757045326", "inventory_quantity": 387, "available": true, "text": "zing-delicate-and-hydrating-radiance"}, {"type": "product", "id": 7890222678079, "title": "Hoygi Honey Rice Moisturizing Mask Facial Cleansing Mud Mask Hydrating And Hydrating Soft Skin Mask", "handle": "hoygi-honey-rice-moisturizing-mask-facial-cleansing-mud-mask-hydrating-and-hydrating-soft-skin-mask", "tags": "skincare", "url": "https://shop.aloha.id.vn/products/hoygi-honey-rice-moisturizing-mask-facial-cleansing-mud-mask-hydrating-and-hydrating-soft-skin-mask", "price": "24.10", "product_type": "", "vendor": "eprolo", "status": "active", "sku": "HO-A05-0323-01", "variant": "default title", "image": "https://cdn.shopify.com/s/files/1/0623/5340/8063/files/12990C102E65B0925662E4358470034C.jpg?v=1757155526", "inventory_quantity": 99, "available": true, "text": "Product: Hoygi Honey Rice Moisturizing Mask Facial Cleansing Mud Mask Hydrating And Hydrating Soft Skin Mask Type: Vendor: eprolo Tags: skincare Options: {\"color\": [\"default title\"]} Variant: default title SKU: HO-A05-0323-01 Price: 24.10 Inventory: 99 Available: True Status: active Body: Our Honey Rice Moisturizing mask contains glycerin, mineral oil, glycerin stearate. It can provide cleansing, antioxidant, moisturizing, firming and soothing care at the same time. Helps absorb sebum, clean pores and prevent clogged pores. Its use method is very simple: 1. After cleansing, apply appropriate amount of this product evenly on the face. 2. Wait 15-20 minutes and rinse with water. Moisturize deeply to keep skin moist and plump. Suitable for all skin types, especially sensitive skin. URL: https"}, {"type": "product", "id": 7890222678079, "title": "Hoygi Honey Rice Moisturizing Mask Facial Cleansing Mud Mask Hydrating And Hydrating Soft Skin Mask", "handle": "hoygi-honey-rice-moisturizing-mask-facial-cleansing-mud-mask-hydrating-and-hydrating-soft-skin-mask", "tags": "skincare", "url": "https://shop.aloha.id.vn/products/hoygi-honey-rice-moisturizing-mask-facial-cleansing-mud-mask-hydrating-and-hydrating-soft-skin-mask", "price": "24.10", "product_type": "", "vendor": "eprolo", "status": "active", "sku": "HO-A05-0323-01", "variant": "default title", "image": "https://cdn.shopify.com/s/files/1/0623/5340/8063/files/12990C102E65B0925662E4358470034C.jpg?v=1757155526", "inventory_quantity": 99, "available": true, "text": "://shop.aloha.id.vn/products/hoygi-honey-rice-moisturizing-mask-facial-cleansing-mud-mask-hydrating-and-hydrating-soft-skin-mask"}, {"type": "product", "id": 7890229559359, "title": "Hoygi Hyaluronic Acid Moisturizer, Gentle Hydrating, Nourishing And Brightening Facial Skin Gloss Care Cream", "handle": "hoygi-hyaluronic-acid-moisturizer-gentle-hydrating-nourishing-and-brightening-facial-skin-gloss-care-cream", "tags": "skincare", "url": "https://shop.aloha.id.vn/products/hoygi-hyaluronic-acid-moisturizer-gentle-hydrating-nourishing-and-brightening-facial-skin-gloss-care-cream", "price": "24.12", "product_type": "", "vendor": "eprolo", "status": "active", "sku": "HO-A05-0780-01", "variant": "default title", "image": "https://cdn.shopify.com/s/files/1/0623/5340/8063/files/907254331CC0C00502EC649A1E249D82.jpg?v=1757157116", "inventory_quantity": 368, "available": true, "text": "Product: Hoygi Hyaluronic Acid Moisturizer, Gentle Hydrating, Nourishing And Brightening Facial Skin Gloss Care Cream Type: Vendor: eprolo Tags: skincare Options: {\"color\": [\"default title\"]} Variant: default title SKU: HO-A05-0780-01 Price: 24.12 Inventory: 368 Available: True Status: active Body: Our hyaluronic acid moisturizer contains glycerin, glycerin stearate. It can help moisturize dry skin and lock in moisture for a long time leaving skin smooth and delicate. Nourish the skin, reduce the impact of the external environment on the skin, improve the rough state. The way to use it is simple: clean the skin. Apply appropriate amount of this product to face evenly. Massage gently to promote absorption. It can also help reduce the roughness of the skin and make the skin smoother. URL: ht"}, {"type": "product", "id": 7890229559359, "title": "Hoygi Hyaluronic Acid Moisturizer, Gentle Hydrating, Nourishing And Brightening Facial Skin Gloss Care Cream", "handle": "hoygi-hyaluronic-acid-moisturizer-gentle-hydrating-nourishing-and-brightening-facial-skin-gloss-care-cream", "tags": "skincare", "url": "https://shop.aloha.id.vn/products/hoygi-hyaluronic-acid-moisturizer-gentle-hydrating-nourishing-and-brightening-facial-skin-gloss-care-cream", "price": "24.12", "product_type": "", "vendor": "eprolo", "status": "active", "sku": "HO-A05-0780-01", "variant": "default title", "image": "https://cdn.shopify.com/s/files/1/0623/5340/8063/files/907254331CC0C00502EC649A1E249D82.jpg?v=1757157116", "inventory_quantity": 368, "available": true, "text": "tps://shop.aloha.id.vn/products/hoygi-hyaluronic-acid-moisturizer-gentle-hydrating-nourishing-and-brightening-facial-skin-gloss-care-cream"}, {"type": "product", "id": 7890236932159, "title": "Hoygi Moisturizing Neck Cream, Gentle Ingredients Moisturize And Nourish Neck Skin Daily Massage Beauty Neck Care Cream", "handle": "hoygi-moisturizing-neck-cream-gentle-ingredients-moisturize-and-nourish-neck-skin-daily-massage-beauty-neck-care-cream", "tags": "skincare", "url": "https://shop.aloha.id.vn/products/hoygi-moisturizing-neck-cream-gentle-ingredients-moisturize-and-nourish-neck-skin-daily-massage-beauty-neck-care-cream", "price": "24.10", "product_type": "", "vendor": "eprolo", "status": "active", "sku": "HO-A06-0108-03", "variant": "default title", "image": "https://cdn.shopify.com/s/files/1/0623/5340/8063/files/0C5D781F061B3BB7C64B54C7EFE83E7A.jpg?v=1757160179", "inventory_quantity": 394, "available": true, "text": "Product: Hoygi Moisturizing Neck Cream, Gentle Ingredients Moisturize And Nourish Neck Skin Daily Massage Beauty Neck Care Cream Type: Vendor: eprolo Tags: skincare Options: {\"color\": [\"default title\"]} Variant: default title SKU: HO-A06-0108-03 Price: 24.10 Inventory: 394 Available: True Status: active Body: Our moisturizing neck cream is carefully blended with glycerin, mineral oil and glycerin stearate. Designed to improve dull neck and restore luster. Easy to use: clean your skin and keep it dry. Apply appropriate amount of this product to neck skin and gently massage for 2-3 minutes to promote absorption. Helps to tighten the skin and create smooth curves. Soothes dry lines and leaves skin soft and supple. Rich texture, gentle touch neck skin, feel more smooth. URL: https://shop.aloha"}, {"type": "product", "id": 7890236932159, "title": "Hoygi Moisturizing Neck Cream, Gentle Ingredients Moisturize And Nourish Neck Skin Daily Massage Beauty Neck Care Cream", "handle": "hoygi-moisturizing-neck-cream-gentle-ingredients-moisturize-and-nourish-neck-skin-daily-massage-beauty-neck-care-cream", "tags": "skincare", "url": "https://shop.aloha.id.vn/products/hoygi-moisturizing-neck-cream-gentle-ingredients-moisturize-and-nourish-neck-skin-daily-massage-beauty-neck-care-cream", "price": "24.10", "product_type": "", "vendor": "eprolo", "status": "active", "sku": "HO-A06-0108-03", "variant": "default title", "image": "https://cdn.shopify.com/s/files/1/0623/5340/8063/files/0C5D781F061B3BB7C64B54C7EFE83E7A.jpg?v=1757160179", "inventory_quantity": 394, "available": true, "text": ".id.vn/products/hoygi-moisturizing-neck-cream-gentle-ingredients-moisturize-and-nourish-neck-skin-daily-massage-beauty-neck-care-cream"}, {"type": "product", "id": 7889479368767, "title": "HOYGI Niacinamide Brightening Serum, Lightening Spots And Fine Lines Brightening Skin Hydrating Moisturizing Facial Treatment", "handle": "hoygi-niacinamide-brightening-serum-lightening-spots-and-fine-lines-brightening-skin-hydrating-moisturizing-facial-treatment", "tags": "skincare", "url": "https://shop.aloha.id.vn/products/hoygi-niacinamide-brightening-serum-lightening-spots-and-fine-lines-brightening-skin-hydrating-moisturizing-facial-treatment", "price": "22.78", "product_type": "", "vendor": "eprolo", "status": "active", "sku": "HOA02-A085-30-YE1", "variant": "default title", "image": "https://cdn.shopify.com/s/files/1/0623/5340/8063/files/0CF45D018C7BEA7FDFC5AB98C5055FED.jpg?v=1757045997", "inventory_quantity": 100, "available": true, "text": "Product: HOYGI Niacinamide Brightening Serum, Lightening Spots And Fine Lines Brightening Skin Hydrating Moisturizing Facial Treatment Type: Vendor: eprolo Tags: skincare Options: {\"color\": [\"default title\"]} Variant: default title SKU: HOA02-A085-30-YE1 Price: 22.78 Inventory: 100 Available: True Status: active Body: Our Niacinamide Brightening Serum contains nicotinamide, glutathione and hyaluronic acid. It can effectively improve dull skin tone and uneven skin tone, deeply hydrating and moisturizing, and make skin glow. Its use method is very simple: after cleansing and toning, press 1-2 pumps of essence evenly apply to the face skin, and gently massage with your hand until absorbed. It can effectively reduce facial blemishes, lighten fine spots, refine pores, improve dry skin, and repl"}, {"type": "product", "id": 7889479368767, "title": "HOYGI Niacinamide Brightening Serum, Lightening Spots And Fine Lines Brightening Skin Hydrating Moisturizing Facial Treatment", "handle": "hoygi-niacinamide-brightening-serum-lightening-spots-and-fine-lines-brightening-skin-hydrating-moisturizing-facial-treatment", "tags": "skincare", "url": "https://shop.aloha.id.vn/products/hoygi-niacinamide-brightening-serum-lightening-spots-and-fine-lines-brightening-skin-hydrating-moisturizing-facial-treatment", "price": "22.78", "product_type": "", "vendor": "eprolo", "status": "active", "sku": "HOA02-A085-30-YE1", "variant": "default title", "image": "https://cdn.shopify.com/s/files/1/0623/5340/8063/files/0CF45D018C7BEA7FDFC5AB98C5055FED.jpg?v=1757045997", "inventory_quantity": 100, "available": true, "text": "enish moisture for skin. URL: https://shop.aloha.id.vn/products/hoygi-niacinamide-brightening-serum-lightening-spots-and-fine-lines-brightening-skin-hydrating-moisturizing-facial-treatment"}, {"type": "product", "id": 7890223005759, "title": "Hoygi Nicotinamide Arbutin Moisturizing Mask (Bag) Facial Skin Hydrating, Moisturizing, Firming And Nourishing Essence Mask", "handle": "hoygi-nicotinamide-arbutin-moisturizing-mask-bag-facial-skin-hydrating-moisturizing-firming-and-nourishing-essence-mask", "tags": "skincare", "url": "https://shop.aloha.id.vn/products/hoygi-nicotinamide-arbutin-moisturizing-mask-bag-facial-skin-hydrating-moisturizing-firming-and-nourishing-essence-mask", "price": "24.10", "product_type": "", "vendor": "eprolo", "status": "active", "sku": "HO-A05-0374-01", "variant": "default title", "image": "https://cdn.shopify.com/s/files/1/0623/5340/8063/files/A9C10DE54F7C926AAC84329958F260CB.jpg?v=1757155573", "inventory_quantity": 251, "available": true, "text": "Product: Hoygi Nicotinamide Arbutin Moisturizing Mask (Bag) Facial Skin Hydrating, Moisturizing, Firming And Nourishing Essence Mask Type: Vendor: eprolo Tags: skincare Options: {\"color\": [\"default title\"]} Variant: default title SKU: HO-A05-0374-01 Price: 24.10 Inventory: 251 Available: True Status: active Body: Our nicotinamide arbutin Moisturizing mask (bag) contains nicotinamide and collagen. It can improve skin tone, brighten the skin and create a uniform and bright complexion. Its usage is very simple: Take out the mask, apply it to your facial skin and leave it on for 15 to 20 minutes to allow the essence to be fully absorbed. Then remove the mask and wash it off with clean water. And it can easily improve the skin condition. URL: https://shop.aloha.id.vn/products/hoygi-nicotinamide"}, {"type": "product", "id": 7890223005759, "title": "Hoygi Nicotinamide Arbutin Moisturizing Mask (Bag) Facial Skin Hydrating, Moisturizing, Firming And Nourishing Essence Mask", "handle": "hoygi-nicotinamide-arbutin-moisturizing-mask-bag-facial-skin-hydrating-moisturizing-firming-and-nourishing-essence-mask", "tags": "skincare", "url": "https://shop.aloha.id.vn/products/hoygi-nicotinamide-arbutin-moisturizing-mask-bag-facial-skin-hydrating-moisturizing-firming-and-nourishing-essence-mask", "price": "24.10", "product_type": "", "vendor": "eprolo", "status": "active", "sku": "HO-A05-0374-01", "variant": "default title", "image": "https://cdn.shopify.com/s/files/1/0623/5340/8063/files/A9C10DE54F7C926AAC84329958F260CB.jpg?v=1757155573", "inventory_quantity": 251, "available": true, "text": "-arbutin-moisturizing-mask-bag-facial-skin-hydrating-moisturizing-firming-and-nourishing-essence-mask"}, {"type": "product", "id": 7889465901119, "title": "Hoygi Nicotinamide Moisturizing And Firming Serum, Gently Moisturizes Facial Skin With Moisture, Elasticity And Delicate", "handle": "hoygi-nicotinamide-moisturizing-and-firming-serum-gently-moisturizes-facial-skin-with-moisture-elasticity-and-delicate", "tags": "skincare", "url": "https://shop.aloha.id.vn/products/hoygi-nicotinamide-moisturizing-and-firming-serum-gently-moisturizes-facial-skin-with-moisture-elasticity-and-delicate", "price": "24.10", "product_type": "", "vendor": "eprolo", "status": "active", "sku": "HO-A05-0848-01", "variant": "default title", "image": "https://cdn.shopify.com/s/files/1/0623/5340/8063/files/9BF5B1B298597EBE17A86CDC4211BE41.jpg?v=1757040046", "inventory_quantity": 45, "available": true, "text": "Product: Hoygi Nicotinamide Moisturizing And Firming Serum, Gently Moisturizes Facial Skin With Moisture, Elasticity And Delicate Type: Vendor: eprolo Tags: skincare Options: {\"color\": [\"default title\"]} Variant: default title SKU: HO-A05-0848-01 Price: 24.10 Inventory: 45 Available: True Status: active Body: Our nicotinamide moisturizing and firming serum is carefully blended with glycerin and hydroxyethyl cellulose. Designed to moisturize skin and improve skin smoothness. Easy to use: clean your skin and keep it dry. Apply appropriate amount of the product evenly on the face and gently massage until absorbed. And the texture is light, the skin feels moisturized and comfortable after use, the skin feels refreshed after use, and brings a healthy luster. URL: https://shop.aloha.id.vn/produc"}, {"type": "product", "id": 7889465901119, "title": "Hoygi Nicotinamide Moisturizing And Firming Serum, Gently Moisturizes Facial Skin With Moisture, Elasticity And Delicate", "handle": "hoygi-nicotinamide-moisturizing-and-firming-serum-gently-moisturizes-facial-skin-with-moisture-elasticity-and-delicate", "tags": "skincare", "url": "https://shop.aloha.id.vn/products/hoygi-nicotinamide-moisturizing-and-firming-serum-gently-moisturizes-facial-skin-with-moisture-elasticity-and-delicate", "price": "24.10", "product_type": "", "vendor": "eprolo", "status": "active", "sku": "HO-A05-0848-01", "variant": "default title", "image": "https://cdn.shopify.com/s/files/1/0623/5340/8063/files/9BF5B1B298597EBE17A86CDC4211BE41.jpg?v=1757040046", "inventory_quantity": 45, "available": true, "text": "ts/hoygi-nicotinamide-moisturizing-and-firming-serum-gently-moisturizes-facial-skin-with-moisture-elasticity-and-delicate"}, {"type": "product", "id": 7889162764351, "title": "Hoygi Nicotinamide Serum Brightening Skin, Moisturizing And Hydrating Face Serum", "handle": "hoygi-nicotinamide-serum-brightening-skin-moisturizing-and-hydrating-face-serum", "tags": "skincare", "url": "https://shop.aloha.id.vn/products/hoygi-nicotinamide-serum-brightening-skin-moisturizing-and-hydrating-face-serum", "price": "24.10", "product_type": "", "vendor": "eprolo", "status": "active", "sku": "HO-A05-0343-01", "variant": "default title", "image": "https://cdn.shopify.com/s/files/1/0623/5340/8063/files/457100F2D4F54D853F7DF9EDDD13EB98.jpg?v=1757003409", "inventory_quantity": 185, "available": true, "text": "Product: Hoygi Nicotinamide Serum Brightening Skin, Moisturizing And Hydrating Face Serum Type: Vendor: eprolo Tags: skincare Options: {\"color\": [\"default title\"]} Variant: default title SKU: HO-A05-0343-01 Price: 24.10 Inventory: 185 Available: True Status: active Body: Our nicotinamide essence is carefully formulated with nicotinamide, acetylglucosamine and glycerin. Specially designed to balance skin oil and reduce acne. The usage method is extremely convenient: 1. Thoroughly clean the skin and dry it; 2. Apply an appropriate amount of this product evenly to the facial skin. 3. Gently massage to promote absorption. And it can keep the skin moist throughout the day, avoiding dryness and peeling. URL: https://shop.aloha.id.vn/products/hoygi-nicotinamide-serum-brightening-skin-moisturizing"}, {"type": "product", "id": 7889162764351, "title": "Hoygi Nicotinamide Serum Brightening Skin, Moisturizing And Hydrating Face Serum", "handle": "hoygi-nicotinamide-serum-brightening-skin-moisturizing-and-hydrating-face-serum", "tags": "skincare", "url": "https://shop.aloha.id.vn/products/hoygi-nicotinamide-serum-brightening-skin-moisturizing-and-hydrating-face-serum", "price": "24.10", "product_type": "", "vendor": "eprolo", "status": "active", "sku": "HO-A05-0343-01", "variant": "default title", "image": "https://cdn.shopify.com/s/files/1/0623/5340/8063/files/457100F2D4F54D853F7DF9EDDD13EB98.jpg?v=1757003409", "inventory_quantity": 185, "available": true, "text": "-and-hydrating-face-serum"}, {"type": "product", "id": 7890228346943, "title": "Hoygi Retinol Facial Moisturizer Collagen Retinol Essence Hydrating And Moisturizing Skin Care Cream", "handle": "hoygi-retinol-facial-moisturizer-collagen-retinol-essence-hydrating-and-moisturizing-skin-care-cream", "tags": "skincare", "url": "https://shop.aloha.id.vn/products/hoygi-retinol-facial-moisturizer-collagen-retinol-essence-hydrating-and-moisturizing-skin-care-cream", "price": "24.10", "product_type": "", "vendor": "eprolo", "status": "active", "sku": "HOA05-A146-50-BU1", "variant": "default title", "image": "https://cdn.shopify.com/s/files/1/0623/5340/8063/files/DAD6CA6D412A2F4FD2F016243A739F00.jpg?v=1757156615", "inventory_quantity": 8, "available": true, "text": "Product: Hoygi Retinol Facial Moisturizer Collagen Retinol Essence Hydrating And Moisturizing Skin Care Cream Type: Vendor: eprolo Tags: skincare Options: {\"color\": [\"default title\"]} Variant: default title SKU: HOA05-A146-50-BU1 Price: 24.10 Inventory: 8 Available: True Status: active Body: Our retinol facial moisturizer contains collagen, retinol, and niacinamide. It can resist aging and wrinkle, effectively reduce fine lines and wrinkles, smooth the skin, restore smooth texture; Use mild ingredients, suitable for everyone! Skin types that can brighten, invigorate and rejuvenate your skin. Makes you look more radiant. Its application method is very simple: 1. Thoroughly clean the skin, dry it first; 2. Apply appropriate amount of the product evenly on the face; 3. Gently massage until co"}, {"type": "product", "id": 7890228346943, "title": "Hoygi Retinol Facial Moisturizer Collagen Retinol Essence Hydrating And Moisturizing Skin Care Cream", "handle": "hoygi-retinol-facial-moisturizer-collagen-retinol-essence-hydrating-and-moisturizing-skin-care-cream", "tags": "skincare", "url": "https://shop.aloha.id.vn/products/hoygi-retinol-facial-moisturizer-collagen-retinol-essence-hydrating-and-moisturizing-skin-care-cream", "price": "24.10", "product_type": "", "vendor": "eprolo", "status": "active", "sku": "HOA05-A146-50-BU1", "variant": "default title", "image": "https://cdn.shopify.com/s/files/1/0623/5340/8063/files/DAD6CA6D412A2F4FD2F016243A739F00.jpg?v=1757156615", "inventory_quantity": 8, "available": true, "text": "mpletely absorbed. Retinol facial moisturizer is rich in collagen, which deeply nourishes the skin and enhances elasticity and firmness. Hyaluronic acid provides long-lasting moisture, keeping skin moist and plump. URL: https://shop.aloha.id.vn/products/hoygi-retinol-facial-moisturizer-collagen-retinol-essence-hydrating-and-moisturizing-skin-care-cream"}, {"type": "product", "id": 7889465802815, "title": "Hoygi Snail Mucin Serum Hydrating, Moisturizing, Clear, Radiant, Radiant And Rough Essence", "handle": "hoygi-snail-mucin-serum-hydrating-moisturizing-clear-radiant-radiant-and-rough-essence", "tags": "skincare", "url": "https://shop.aloha.id.vn/products/hoygi-snail-mucin-serum-hydrating-moisturizing-clear-radiant-radiant-and-rough-essence", "price": "24.10", "product_type": "", "vendor": "eprolo", "status": "active", "sku": "HO-A05-0398-01", "variant": "default title", "image": "https://cdn.shopify.com/s/files/1/0623/5340/8063/files/372CA49438191E462EB008207596EE81.jpg?v=1757040023", "inventory_quantity": 239, "available": true, "text": "Product: Hoygi Snail Mucin Serum Hydrating, Moisturizing, Clear, Radiant, Radiant And Rough Essence Type: Vendor: eprolo Tags: skincare Options: {\"color\": [\"default title\"]} Variant: default title SKU: HO-A05-0398-01 Price: 24.10 Inventory: 239 Available: True Status: active Body: Our snail mucin serum contains snail secretion filtrate, hyaluronic acid, vitamin C(ascorbic acid). It traps moisture. Long-lasting moisturizing leaves skin softer and smoother. Promotes collagen production, significantly reduces fine lines, and stores elasticity. Its use method is very simple: 1. After cleansing, apply appropriate amount of this product evenly on the face. 2. Gently massage the eye socket to promote absorption. Enhances skin barrier function to protect delicate skin. Even out skin tone, brighten"}, {"type": "product", "id": 7889465802815, "title": "Hoygi Snail Mucin Serum Hydrating, Moisturizing, Clear, Radiant, Radiant And Rough Essence", "handle": "hoygi-snail-mucin-serum-hydrating-moisturizing-clear-radiant-radiant-and-rough-essence", "tags": "skincare", "url": "https://shop.aloha.id.vn/products/hoygi-snail-mucin-serum-hydrating-moisturizing-clear-radiant-radiant-and-rough-essence", "price": "24.10", "product_type": "", "vendor": "eprolo", "status": "active", "sku": "HO-A05-0398-01", "variant": "default title", "image": "https://cdn.shopify.com/s/files/1/0623/5340/8063/files/372CA49438191E462EB008207596EE81.jpg?v=1757040023", "inventory_quantity": 239, "available": true, "text": " skin tone and make skin glow. URL: https://shop.aloha.id.vn/products/hoygi-snail-mucin-serum-hydrating-moisturizing-clear-radiant-radiant-and-rough-essence"}, {"type": "product", "id": 7890236375103, "title": "Hoygi UV Clear Sun Sunscreen, Summer Outdoor Anti-Exposure UV Moisturizes Skin Evenly Bright And Not Greasy", "handle": "hoygi-uv-clear-sun-sunscreen-summer-outdoor-anti-exposure-uv-moisturizes-skin-evenly-bright-and-not-greasy", "tags": "skincare", "url": "https://shop.aloha.id.vn/products/hoygi-uv-clear-sun-sunscreen-summer-outdoor-anti-exposure-uv-moisturizes-skin-evenly-bright-and-not-greasy", "price": "24.10", "product_type": "", "vendor": "eprolo", "status": "active", "sku": "HOA05-A078-50-BU1", "variant": "default title", "image": "https://cdn.shopify.com/s/files/1/0623/5340/8063/files/54905389F6E971EA8DABC23EF9D56129.jpg?v=1757160046", "inventory_quantity": 100, "available": true, "text": "Product: Hoygi UV Clear Sun Sunscreen, Summer Outdoor Anti-Exposure UV Moisturizes Skin Evenly Bright And Not Greasy Type: Vendor: eprolo Tags: skincare Options: {\"color\": [\"default title\"]} Variant: default title SKU: HOA05-A078-50-BU1 Price: 24.10 Inventory: 100 Available: True Status: active Body: Our UV Clear Sun Sunscreen contains Glycerin, Hyaluronic Acid, Titanium Dioxide. It provides sun protection, protects the skin from UV rays, brightens the skin and makes it look more even and bright. Its use method is very simple: after cleansing and toning, take appropriate amount of sunscreen on the palm, sunscreen evenly applied on the face can be, it is recommended to apply it 15-20 minutes before going out, the effect will be better. Contains moisturizing ingredients to provide adequate m"}, {"type": "product", "id": 7890236375103, "title": "Hoygi UV Clear Sun Sunscreen, Summer Outdoor Anti-Exposure UV Moisturizes Skin Evenly Bright And Not Greasy", "handle": "hoygi-uv-clear-sun-sunscreen-summer-outdoor-anti-exposure-uv-moisturizes-skin-evenly-bright-and-not-greasy", "tags": "skincare", "url": "https://shop.aloha.id.vn/products/hoygi-uv-clear-sun-sunscreen-summer-outdoor-anti-exposure-uv-moisturizes-skin-evenly-bright-and-not-greasy", "price": "24.10", "product_type": "", "vendor": "eprolo", "status": "active", "sku": "HOA05-A078-50-BU1", "variant": "default title", "image": "https://cdn.shopify.com/s/files/1/0623/5340/8063/files/54905389F6E971EA8DABC23EF9D56129.jpg?v=1757160046", "inventory_quantity": 100, "available": true, "text": "oisture and nutrients to the skin while protecting it from sun damage. URL: https://shop.aloha.id.vn/products/hoygi-uv-clear-sun-sunscreen-summer-outdoor-anti-exposure-uv-moisturizes-skin-evenly-bright-and-not-greasy"}, {"type": "product", "id": 7890221596735, "title": "Hoygi Vitamin C Brightening Cleanser, Moisturizes And Soothes Facial Skin With A Clean, Hydrating, Non-Tightening Cleanser", "handle": "hoygi-vitamin-c-brightening-cleanser-moisturizes-and-soothes-facial-skin-with-a-clean-hydrating-non-tightening-cleanser", "tags": "skincare", "url": "https://shop.aloha.id.vn/products/hoygi-vitamin-c-brightening-cleanser-moisturizes-and-soothes-facial-skin-with-a-clean-hydrating-non-tightening-cleanser", "price": "24.12", "product_type": "", "vendor": "eprolo", "status": "active", "sku": "HO-A05-0742-01", "variant": "default title", "image": "https://cdn.shopify.com/s/files/1/0623/5340/8063/files/44A68F973C8D976BAFB28A3917A575C6.jpg?v=1757155137", "inventory_quantity": 234, "available": true, "text": "Product: Hoygi Vitamin C Brightening Cleanser, Moisturizes And Soothes Facial Skin With A Clean, Hydrating, Non-Tightening Cleanser Type: Vendor: eprolo Tags: skincare Options: {\"color\": [\"default title\"]} Variant: default title SKU: HO-A05-0742-01 Price: 24.12 Inventory: 234 Available: True Status: active Body: Our Vitamin C Brightening cleanser contains lemon fruit extract and vitamin C. It keeps your skin fresh and bright every day. Its use is simple: clean your hands with warm water and wet your face. Take proper amount of cleanser and rub with a little water until foaming. Use your fingertips to spread the foam evenly over your face. Rinse with water. And can easily remove facial oil stains. URL: https://shop.aloha.id.vn/products/hoygi-vitamin-c-brightening-cleanser-moisturizes-and-so"}, {"type": "product", "id": 7890221596735, "title": "Hoygi Vitamin C Brightening Cleanser, Moisturizes And Soothes Facial Skin With A Clean, Hydrating, Non-Tightening Cleanser", "handle": "hoygi-vitamin-c-brightening-cleanser-moisturizes-and-soothes-facial-skin-with-a-clean-hydrating-non-tightening-cleanser", "tags": "skincare", "url": "https://shop.aloha.id.vn/products/hoygi-vitamin-c-brightening-cleanser-moisturizes-and-soothes-facial-skin-with-a-clean-hydrating-non-tightening-cleanser", "price": "24.12", "product_type": "", "vendor": "eprolo", "status": "active", "sku": "HO-A05-0742-01", "variant": "default title", "image": "https://cdn.shopify.com/s/files/1/0623/5340/8063/files/44A68F973C8D976BAFB28A3917A575C6.jpg?v=1757155137", "inventory_quantity": 234, "available": true, "text": "othes-facial-skin-with-a-clean-hydrating-non-tightening-cleanser"}, {"type": "product", "id": 7890228183103, "title": "Hoygi Vitamin C Facial Moisturizer Gently Moisturizes And Nourifies The Skin Hydrating And Moisturizing Tender And Smooth Moisturizing Cream", "handle": "hoygi-vitamin-c-facial-moisturizer-gently-moisturizes-and-nourifies-the-skin-hydrating-and-moisturizing-tender-and-smooth-moisturizing-cream", "tags": "skincare", "url": "https://shop.aloha.id.vn/products/hoygi-vitamin-c-facial-moisturizer-gently-moisturizes-and-nourifies-the-skin-hydrating-and-moisturizing-tender-and-smooth-moisturizing-cream", "price": "24.10", "product_type": "", "vendor": "eprolo", "status": "active", "sku": "HO-A05-0375-01", "variant": "default title", "image": "https://cdn.shopify.com/s/files/1/0623/5340/8063/files/9646DC5359536D7F8BB468201E7DA318.jpg?v=1757156592", "inventory_quantity": 320, "available": true, "text": "Product: Hoygi Vitamin C Facial Moisturizer Gently Moisturizes And Nourifies The Skin Hydrating And Moisturizing Tender And Smooth Moisturizing Cream Type: Vendor: eprolo Tags: skincare Options: {\"color\": [\"default title\"]} Variant: default title SKU: HO-A05-0375-01 Price: 24.10 Inventory: 320 Available: True Status: active Body: Our Vitamin C facial moisturizer contains sea buckthorn extract, ascorbic acid (vitamin C), and niacinamide. It can effectively lighten the complexion and make the skin glow. Reduce dark spots and pigmentation, even out skin tone, and improve uneven skin tone. Its application method is simple: 1. Thoroughly clean and dry the skin; 2. Apply appropriate amount of the product evenly on the face; 3. Massage gently to promote full absorption. Antioxidant ingredients re"}, {"type": "product", "id": 7890228183103, "title": "Hoygi Vitamin C Facial Moisturizer Gently Moisturizes And Nourifies The Skin Hydrating And Moisturizing Tender And Smooth Moisturizing Cream", "handle": "hoygi-vitamin-c-facial-moisturizer-gently-moisturizes-and-nourifies-the-skin-hydrating-and-moisturizing-tender-and-smooth-moisturizing-cream", "tags": "skincare", "url": "https://shop.aloha.id.vn/products/hoygi-vitamin-c-facial-moisturizer-gently-moisturizes-and-nourifies-the-skin-hydrating-and-moisturizing-tender-and-smooth-moisturizing-cream", "price": "24.10", "product_type": "", "vendor": "eprolo", "status": "active", "sku": "HO-A05-0375-01", "variant": "default title", "image": "https://cdn.shopify.com/s/files/1/0623/5340/8063/files/9646DC5359536D7F8BB468201E7DA318.jpg?v=1757156592", "inventory_quantity": 320, "available": true, "text": "duce fine lines and wrinkles and keep skin looking young. URL: https://shop.aloha.id.vn/products/hoygi-vitamin-c-facial-moisturizer-gently-moisturizes-and-nourifies-the-skin-hydrating-and-moisturizing-tender-and-smooth-moisturizing-cream"}, {"type": "product", "id": 7890229329983, "title": "Jaysuing Collagen Moisturizer, Gently Moisturizes Tender, Smooth Skin Even Facial Tone Moisturizer", "handle": "jaysuing-collagen-moisturizer-gently-moisturizes-tender-smooth-skin-even-facial-tone-moisturizer", "tags": "skincare", "url": "https://shop.aloha.id.vn/products/jaysuing-collagen-moisturizer-gently-moisturizes-tender-smooth-skin-even-facial-tone-moisturizer", "price": "24.10", "product_type": "", "vendor": "eprolo", "status": "active", "sku": "JA-A05-0352-01", "variant": "default title", "image": "https://cdn.shopify.com/s/files/1/0623/5340/8063/files/3C25FF9831722C118B764F11EE07BE63.jpg?v=1757157079", "inventory_quantity": 76, "available": true, "text": "Product: Jaysuing Collagen Moisturizer, Gently Moisturizes Tender, Smooth Skin Even Facial Tone Moisturizer Type: Vendor: eprolo Tags: skincare Options: {\"color\": [\"default title\"]} Variant: default title SKU: JA-A05-0352-01 Price: 24.10 Inventory: 76 Available: True Status: active Body: Our collagen moisturizer is carefully blended with glycerin, mineral oil and glycerin stearate. Designed to create the delicate contours of the face and maintain moisture in the skin. The method of use is very convenient: after cleaning and conditioning, take appropriate amount of cream, evenly apply to the face skin, gently massage to make it absorb. And can create a delicate skin feeling. URL: https://shop.aloha.id.vn/products/jaysuing-collagen-moisturizer-gently-moisturizes-tender-smooth-skin-even-facia"}, {"type": "product", "id": 7890229329983, "title": "Jaysuing Collagen Moisturizer, Gently Moisturizes Tender, Smooth Skin Even Facial Tone Moisturizer", "handle": "jaysuing-collagen-moisturizer-gently-moisturizes-tender-smooth-skin-even-facial-tone-moisturizer", "tags": "skincare", "url": "https://shop.aloha.id.vn/products/jaysuing-collagen-moisturizer-gently-moisturizes-tender-smooth-skin-even-facial-tone-moisturizer", "price": "24.10", "product_type": "", "vendor": "eprolo", "status": "active", "sku": "JA-A05-0352-01", "variant": "default title", "image": "https://cdn.shopify.com/s/files/1/0623/5340/8063/files/3C25FF9831722C118B764F11EE07BE63.jpg?v=1757157079", "inventory_quantity": 76, "available": true, "text": "l-tone-moisturizer"}, {"type": "product", "id": 7889143955519, "title": "Kojic Acid Soap Cleanser Cleansing Soap Dilute Cleansing Cleanser Pore-Clearing Exfoliating Skincare Soap", "handle": "kojic-acid-soap-cleanser-cleansing-soap-dilute-cleansing-cleanser-pore-clearing-exfoliating-skincare-soap", "tags": "skincare", "url": "https://shop.aloha.id.vn/products/kojic-acid-soap-cleanser-cleansing-soap-dilute-cleansing-cleanser-pore-clearing-exfoliating-skincare-soap", "price": "22.92", "product_type": "", "vendor": "eprolo", "status": "active", "sku": "E标qsz704zx01-100g盒装", "variant": "default title", "image": "https://cdn.shopify.com/s/files/1/0623/5340/8063/files/3335036F87EB5C73BF8114F79594931B.jpg?v=1757002395", "inventory_quantity": 284, "available": true, "text": "Product: Kojic Acid Soap Cleanser Cleansing Soap Dilute Cleansing Cleanser Pore-Clearing Exfoliating Skincare Soap Type: Vendor: eprolo Tags: skincare Options: {\"color\": [\"default title\"]} Variant: default title SKU: E标qsz704zx01-100g盒装 Price: 22.92 Inventory: 284 Available: True Status: active Body: Our kojic acid soap contains glycerin, tocopherol (vitamin E). It helps to improve the skin texture, fade the traces of acne, reduce the skin dark spots, even the skin tone. Its use is simple: wet your face with water, lather kojic soap, lather it on your face, and then wash it in circles for smoother, smoother skin. Improve after use to reduce stain formation, double protect whitening and dull skin, reduce existing spots. URL: https://shop.aloha.id.vn/products/kojic-acid-soap-cleanser-cleansi"}, {"type": "product", "id": 7889143955519, "title": "Kojic Acid Soap Cleanser Cleansing Soap Dilute Cleansing Cleanser Pore-Clearing Exfoliating Skincare Soap", "handle": "kojic-acid-soap-cleanser-cleansing-soap-dilute-cleansing-cleanser-pore-clearing-exfoliating-skincare-soap", "tags": "skincare", "url": "https://shop.aloha.id.vn/products/kojic-acid-soap-cleanser-cleansing-soap-dilute-cleansing-cleanser-pore-clearing-exfoliating-skincare-soap", "price": "22.92", "product_type": "", "vendor": "eprolo", "status": "active", "sku": "E标qsz704zx01-100g盒装", "variant": "default title", "image": "https://cdn.shopify.com/s/files/1/0623/5340/8063/files/3335036F87EB5C73BF8114F79594931B.jpg?v=1757002395", "inventory_quantity": 284, "available": true, "text": "ng-soap-dilute-cleansing-cleanser-pore-clearing-exfoliating-skincare-soap"}, {"type": "product", "id": 7890236276799, "title": "Korean Beauty of Joseon Korean Beauty Series Toner Sunscreen Cream", "handle": "korean-beauty-of-joseon-korean-beauty-series-toner-sunscreen-cream", "tags": "skincare", "url": "https://shop.aloha.id.vn/products/korean-beauty-of-joseon-korean-beauty-series-toner-sunscreen-cream", "price": "17.76", "product_type": "", "vendor": "eprolo", "status": "active", "sku": "F82128E1312547E983A2B2306FCFA7A3", "variant": "North Korea Sunscreen", "image": "https://cdn.shopify.com/s/files/1/0623/5340/8063/files/A2EEF9C4F8F721B392193AD84350D37A.jpg?v=1757160021", "inventory_quantity": 122651, "available": true, "text": "Product: Korean Beauty of Joseon Korean Beauty Series Toner Sunscreen Cream Type: Vendor: eprolo Tags: skincare Options: {\"Product Specifications\": [\"North Korea Sunscreen\", \"New Version of North Korean Sunscreen\", \"North Korea Sunscreen Stick\", \"North Korea Sunscreen Spray Essence\", \"North Korean Red Bean Jelly\", \"North Korean Green Essence\", \"Korean Cream\", \"North Korean Mud Mask\", \"North Korean Eye Cream\", \"Korean Ginseng Water\", \"North Korean Green Plum Water\", \"North Korean Green Tea\", \"North Korean Propolis\", \"Korean Ginseng Rice\", \"North Korean sugar water\", \"North Korean Makeup Remover Oil\", \"Korean Rice Bran Toner\", \"North Korean Facial Cleanser\"]} Variant: North Korea Sunscreen SKU: F82128E1312547E983A2B2306FCFA7A3 Price: 17.76 Inventory: 122651 Available: True Status: active Bod"}, {"type": "product", "id": 7890236276799, "title": "Korean Beauty of Joseon Korean Beauty Series Toner Sunscreen Cream", "handle": "korean-beauty-of-joseon-korean-beauty-series-toner-sunscreen-cream", "tags": "skincare", "url": "https://shop.aloha.id.vn/products/korean-beauty-of-joseon-korean-beauty-series-toner-sunscreen-cream", "price": "17.76", "product_type": "", "vendor": "eprolo", "status": "active", "sku": "F82128E1312547E983A2B2306FCFA7A3", "variant": "North Korea Sunscreen", "image": "https://cdn.shopify.com/s/files/1/0623/5340/8063/files/A2EEF9C4F8F721B392193AD84350D37A.jpg?v=1757160021", "inventory_quantity": 122651, "available": true, "text": "y: Applicable Population: Women, Men, General, Ordinary People Suitable Skin Type: Neutral, General, Oily, Dry, Sensitive, Combination Production License Number: 234235252 Shelf Life: 3 Years Net Content: 150ml/g, 30ml/g, 50ml/g, 100ml/g, 300ml/g, 200ml/g Place of Origin: Guangzhou Cosmetic Efficacy: Oil Control, Exfoliation, Pore Minimizing, Other Effects, Hydration, Brightening, Blackhead Removal, Moisturizing, Deep Cleaning, Skin Soothing, Softening Skin URL: https://shop.aloha.id.vn/products/korean-beauty-of-joseon-korean-beauty-series-toner-sunscreen-cream"}, {"type": "product", "id": 7890236276799, "title": "Korean Beauty of Joseon Korean Beauty Series Toner Sunscreen Cream", "handle": "korean-beauty-of-joseon-korean-beauty-series-toner-sunscreen-cream", "tags": "skincare", "url": "https://shop.aloha.id.vn/products/korean-beauty-of-joseon-korean-beauty-series-toner-sunscreen-cream", "price": "18.40", "product_type": "", "vendor": "eprolo", "status": "active", "sku": "01565E5224444BF78AF4B6B54AE0E16C", "variant": "New Version of North Korean Sunscreen", "image": "https://cdn.shopify.com/s/files/1/0623/5340/8063/files/A2EEF9C4F8F721B392193AD84350D37A.jpg?v=1757160021", "inventory_quantity": 123032, "available": true, "text": "Product: Korean Beauty of Joseon Korean Beauty Series Toner Sunscreen Cream Type: Vendor: eprolo Tags: skincare Options: {\"Product Specifications\": [\"North Korea Sunscreen\", \"New Version of North Korean Sunscreen\", \"North Korea Sunscreen Stick\", \"North Korea Sunscreen Spray Essence\", \"North Korean Red Bean Jelly\", \"North Korean Green Essence\", \"Korean Cream\", \"North Korean Mud Mask\", \"North Korean Eye Cream\", \"Korean Ginseng Water\", \"North Korean Green Plum Water\", \"North Korean Green Tea\", \"North Korean Propolis\", \"Korean Ginseng Rice\", \"North Korean sugar water\", \"North Korean Makeup Remover Oil\", \"Korean Rice Bran Toner\", \"North Korean Facial Cleanser\"]} Variant: New Version of North Korean Sunscreen SKU: 01565E5224444BF78AF4B6B54AE0E16C Price: 18.40 Inventory: 123032 Available: True St"}, {"type": "product", "id": 7890236276799, "title": "Korean Beauty of Joseon Korean Beauty Series Toner Sunscreen Cream", "handle": "korean-beauty-of-joseon-korean-beauty-series-toner-sunscreen-cream", "tags": "skincare", "url": "https://shop.aloha.id.vn/products/korean-beauty-of-joseon-korean-beauty-series-toner-sunscreen-cream", "price": "18.40", "product_type": "", "vendor": "eprolo", "status": "active", "sku": "01565E5224444BF78AF4B6B54AE0E16C", "variant": "New Version of North Korean Sunscreen", "image": "https://cdn.shopify.com/s/files/1/0623/5340/8063/files/A2EEF9C4F8F721B392193AD84350D37A.jpg?v=1757160021", "inventory_quantity": 123032, "available": true, "text": "atus: active Body: Applicable Population: Women, Men, General, Ordinary People Suitable Skin Type: Neutral, General, Oily, Dry, Sensitive, Combination Production License Number: 234235252 Shelf Life: 3 Years Net Content: 150ml/g, 30ml/g, 50ml/g, 100ml/g, 300ml/g, 200ml/g Place of Origin: Guangzhou Cosmetic Efficacy: Oil Control, Exfoliation, Pore Minimizing, Other Effects, Hydration, Brightening, Blackhead Removal, Moisturizing, Deep Cleaning, Skin Soothing, Softening Skin URL: https://shop.aloha.id.vn/products/korean-beauty-of-joseon-korean-beauty-series-toner-sunscreen-cream"}, {"type": "product", "id": 7890236276799, "title": "Korean Beauty of Joseon Korean Beauty Series Toner Sunscreen Cream", "handle": "korean-beauty-of-joseon-korean-beauty-series-toner-sunscreen-cream", "tags": "skincare", "url": "https://shop.aloha.id.vn/products/korean-beauty-of-joseon-korean-beauty-series-toner-sunscreen-cream", "price": "18.76", "product_type": "", "vendor": "eprolo", "status": "active", "sku": "74E4F243A3E942A7B074EF9A9577061C", "variant": "North Korea Sunscreen Stick", "image": "https://cdn.shopify.com/s/files/1/0623/5340/8063/files/A2EEF9C4F8F721B392193AD84350D37A.jpg?v=1757160021", "inventory_quantity": 123100, "available": true, "text": "Product: Korean Beauty of Joseon Korean Beauty Series Toner Sunscreen Cream Type: Vendor: eprolo Tags: skincare Options: {\"Product Specifications\": [\"North Korea Sunscreen\", \"New Version of North Korean Sunscreen\", \"North Korea Sunscreen Stick\", \"North Korea Sunscreen Spray Essence\", \"North Korean Red Bean Jelly\", \"North Korean Green Essence\", \"Korean Cream\", \"North Korean Mud Mask\", \"North Korean Eye Cream\", \"Korean Ginseng Water\", \"North Korean Green Plum Water\", \"North Korean Green Tea\", \"North Korean Propolis\", \"Korean Ginseng Rice\", \"North Korean sugar water\", \"North Korean Makeup Remover Oil\", \"Korean Rice Bran Toner\", \"North Korean Facial Cleanser\"]} Variant: North Korea Sunscreen Stick SKU: 74E4F243A3E942A7B074EF9A9577061C Price: 18.76 Inventory: 123100 Available: True Status: acti"}, {"type": "product", "id": 7890236276799, "title": "Korean Beauty of Joseon Korean Beauty Series Toner Sunscreen Cream", "handle": "korean-beauty-of-joseon-korean-beauty-series-toner-sunscreen-cream", "tags": "skincare", "url": "https://shop.aloha.id.vn/products/korean-beauty-of-joseon-korean-beauty-series-toner-sunscreen-cream", "price": "18.76", "product_type": "", "vendor": "eprolo", "status": "active", "sku": "74E4F243A3E942A7B074EF9A9577061C", "variant": "North Korea Sunscreen Stick", "image": "https://cdn.shopify.com/s/files/1/0623/5340/8063/files/A2EEF9C4F8F721B392193AD84350D37A.jpg?v=1757160021", "inventory_quantity": 123100, "available": true, "text": "ve Body: Applicable Population: Women, Men, General, Ordinary People Suitable Skin Type: Neutral, General, Oily, Dry, Sensitive, Combination Production License Number: 234235252 Shelf Life: 3 Years Net Content: 150ml/g, 30ml/g, 50ml/g, 100ml/g, 300ml/g, 200ml/g Place of Origin: Guangzhou Cosmetic Efficacy: Oil Control, Exfoliation, Pore Minimizing, Other Effects, Hydration, Brightening, Blackhead Removal, Moisturizing, Deep Cleaning, Skin Soothing, Softening Skin URL: https://shop.aloha.id.vn/products/korean-beauty-of-joseon-korean-beauty-series-toner-sunscreen-cream"}, {"type": "product", "id": 7890236276799, "title": "Korean Beauty of Joseon Korean Beauty Series Toner Sunscreen Cream", "handle": "korean-beauty-of-joseon-korean-beauty-series-toner-sunscreen-cream", "tags": "skincare", "url": "https://shop.aloha.id.vn/products/korean-beauty-of-joseon-korean-beauty-series-toner-sunscreen-cream", "price": "19.76", "product_type": "", "vendor": "eprolo", "status": "active", "sku": "9F5873CCD5564CE6A36F38504997B47A", "variant": "North Korea Sunscreen Spray Essence", "image": "https://cdn.shopify.com/s/files/1/0623/5340/8063/files/A2EEF9C4F8F721B392193AD84350D37A.jpg?v=1757160021", "inventory_quantity": 123103, "available": true, "text": "Product: Korean Beauty of Joseon Korean Beauty Series Toner Sunscreen Cream Type: Vendor: eprolo Tags: skincare Options: {\"Product Specifications\": [\"North Korea Sunscreen\", \"New Version of North Korean Sunscreen\", \"North Korea Sunscreen Stick\", \"North Korea Sunscreen Spray Essence\", \"North Korean Red Bean Jelly\", \"North Korean Green Essence\", \"Korean Cream\", \"North Korean Mud Mask\", \"North Korean Eye Cream\", \"Korean Ginseng Water\", \"North Korean Green Plum Water\", \"North Korean Green Tea\", \"North Korean Propolis\", \"Korean Ginseng Rice\", \"North Korean sugar water\", \"North Korean Makeup Remover Oil\", \"Korean Rice Bran Toner\", \"North Korean Facial Cleanser\"]} Variant: North Korea Sunscreen Spray Essence SKU: 9F5873CCD5564CE6A36F38504997B47A Price: 19.76 Inventory: 123103 Available: True Stat"}, {"type": "product", "id": 7890236276799, "title": "Korean Beauty of Joseon Korean Beauty Series Toner Sunscreen Cream", "handle": "korean-beauty-of-joseon-korean-beauty-series-toner-sunscreen-cream", "tags": "skincare", "url": "https://shop.aloha.id.vn/products/korean-beauty-of-joseon-korean-beauty-series-toner-sunscreen-cream", "price": "19.76", "product_type": "", "vendor": "eprolo", "status": "active", "sku": "9F5873CCD5564CE6A36F38504997B47A", "variant": "North Korea Sunscreen Spray Essence", "image": "https://cdn.shopify.com/s/files/1/0623/5340/8063/files/A2EEF9C4F8F721B392193AD84350D37A.jpg?v=1757160021", "inventory_quantity": 123103, "available": true, "text": "us: active Body: Applicable Population: Women, Men, General, Ordinary People Suitable Skin Type: Neutral, General, Oily, Dry, Sensitive, Combination Production License Number: 234235252 Shelf Life: 3 Years Net Content: 150ml/g, 30ml/g, 50ml/g, 100ml/g, 300ml/g, 200ml/g Place of Origin: Guangzhou Cosmetic Efficacy: Oil Control, Exfoliation, Pore Minimizing, Other Effects, Hydration, Brightening, Blackhead Removal, Moisturizing, Deep Cleaning, Skin Soothing, Softening Skin URL: https://shop.aloha.id.vn/products/korean-beauty-of-joseon-korean-beauty-series-toner-sunscreen-cream"}, {"type": "product", "id": 7890236276799, "title": "Korean Beauty of Joseon Korean Beauty Series Toner Sunscreen Cream", "handle": "korean-beauty-of-joseon-korean-beauty-series-toner-sunscreen-cream", "tags": "skincare", "url": "https://shop.aloha.id.vn/products/korean-beauty-of-joseon-korean-beauty-series-toner-sunscreen-cream", "price": "18.76", "product_type": "", "vendor": "eprolo", "status": "active", "sku": "5FFBF1FA0C104110A25ECFA04D5987DD", "variant": "North Korean Red Bean Jelly", "image": "https://cdn.shopify.com/s/files/1/0623/5340/8063/files/A2EEF9C4F8F721B392193AD84350D37A.jpg?v=1757160021", "inventory_quantity": 123063, "available": true, "text": "Product: Korean Beauty of Joseon Korean Beauty Series Toner Sunscreen Cream Type: Vendor: eprolo Tags: skincare Options: {\"Product Specifications\": [\"North Korea Sunscreen\", \"New Version of North Korean Sunscreen\", \"North Korea Sunscreen Stick\", \"North Korea Sunscreen Spray Essence\", \"North Korean Red Bean Jelly\", \"North Korean Green Essence\", \"Korean Cream\", \"North Korean Mud Mask\", \"North Korean Eye Cream\", \"Korean Ginseng Water\", \"North Korean Green Plum Water\", \"North Korean Green Tea\", \"North Korean Propolis\", \"Korean Ginseng Rice\", \"North Korean sugar water\", \"North Korean Makeup Remover Oil\", \"Korean Rice Bran Toner\", \"North Korean Facial Cleanser\"]} Variant: North Korean Red Bean Jelly SKU: 5FFBF1FA0C104110A25ECFA04D5987DD Price: 18.76 Inventory: 123063 Available: True Status: acti"}, {"type": "product", "id": 7890236276799, "title": "Korean Beauty of Joseon Korean Beauty Series Toner Sunscreen Cream", "handle": "korean-beauty-of-joseon-korean-beauty-series-toner-sunscreen-cream", "tags": "skincare", "url": "https://shop.aloha.id.vn/products/korean-beauty-of-joseon-korean-beauty-series-toner-sunscreen-cream", "price": "18.76", "product_type": "", "vendor": "eprolo", "status": "active", "sku": "71EFAC1E774A4269A50585332B63DAC9", "variant": "North Korean Green Essence", "image": "https://cdn.shopify.com/s/files/1/0623/5340/8063/files/A2EEF9C4F8F721B392193AD84350D37A.jpg?v=1757160021", "inventory_quantity": 122899, "available": true, "text": "Product: Korean Beauty of Joseon Korean Beauty Series Toner Sunscreen Cream Type: Vendor: eprolo Tags: skincare Options: {\"Product Specifications\": [\"North Korea Sunscreen\", \"New Version of North Korean Sunscreen\", \"North Korea Sunscreen Stick\", \"North Korea Sunscreen Spray Essence\", \"North Korean Red Bean Jelly\", \"North Korean Green Essence\", \"Korean Cream\", \"North Korean Mud Mask\", \"North Korean Eye Cream\", \"Korean Ginseng Water\", \"North Korean Green Plum Water\", \"North Korean Green Tea\", \"North Korean Propolis\", \"Korean Ginseng Rice\", \"North Korean sugar water\", \"North Korean Makeup Remover Oil\", \"Korean Rice Bran Toner\", \"North Korean Facial Cleanser\"]} Variant: North Korean Green Essence SKU: 71EFAC1E774A4269A50585332B63DAC9 Price: 18.76 Inventory: 122899 Available: True Status: activ"}, {"type": "product", "id": 7890236276799, "title": "Korean Beauty of Joseon Korean Beauty Series Toner Sunscreen Cream", "handle": "korean-beauty-of-joseon-korean-beauty-series-toner-sunscreen-cream", "tags": "skincare", "url": "https://shop.aloha.id.vn/products/korean-beauty-of-joseon-korean-beauty-series-toner-sunscreen-cream", "price": "18.76", "product_type": "", "vendor": "eprolo", "status": "active", "sku": "71EFAC1E774A4269A50585332B63DAC9", "variant": "North Korean Green Essence", "image": "https://cdn.shopify.com/s/files/1/0623/5340/8063/files/A2EEF9C4F8F721B392193AD84350D37A.jpg?v=1757160021", "inventory_quantity": 122899, "available": true, "text": "e Body: Applicable Population: Women, Men, General, Ordinary People Suitable Skin Type: Neutral, General, Oily, Dry, Sensitive, Combination Production License Number: 234235252 Shelf Life: 3 Years Net Content: 150ml/g, 30ml/g, 50ml/g, 100ml/g, 300ml/g, 200ml/g Place of Origin: Guangzhou Cosmetic Efficacy: Oil Control, Exfoliation, Pore Minimizing, Other Effects, Hydration, Brightening, Blackhead Removal, Moisturizing, Deep Cleaning, Skin Soothing, Softening Skin URL: https://shop.aloha.id.vn/products/korean-beauty-of-joseon-korean-beauty-series-toner-sunscreen-cream"}, {"type": "product", "id": 7890236276799, "title": "Korean Beauty of Joseon Korean Beauty Series Toner Sunscreen Cream", "handle": "korean-beauty-of-joseon-korean-beauty-series-toner-sunscreen-cream", "tags": "skincare", "url": "https://shop.aloha.id.vn/products/korean-beauty-of-joseon-korean-beauty-series-toner-sunscreen-cream", "price": "18.40", "product_type": "", "vendor": "eprolo", "status": "active", "sku": "BDEFCF4F0A2242A0BEBB3077362B1F49", "variant": "Korean Cream", "image": "https://cdn.shopify.com/s/files/1/0623/5340/8063/files/A2EEF9C4F8F721B392193AD84350D37A.jpg?v=1757160021", "inventory_quantity": 123069, "available": true, "text": "Product: Korean Beauty of Joseon Korean Beauty Series Toner Sunscreen Cream Type: Vendor: eprolo Tags: skincare Options: {\"Product Specifications\": [\"North Korea Sunscreen\", \"New Version of North Korean Sunscreen\", \"North Korea Sunscreen Stick\", \"North Korea Sunscreen Spray Essence\", \"North Korean Red Bean Jelly\", \"North Korean Green Essence\", \"Korean Cream\", \"North Korean Mud Mask\", \"North Korean Eye Cream\", \"Korean Ginseng Water\", \"North Korean Green Plum Water\", \"North Korean Green Tea\", \"North Korean Propolis\", \"Korean Ginseng Rice\", \"North Korean sugar water\", \"North Korean Makeup Remover Oil\", \"Korean Rice Bran Toner\", \"North Korean Facial Cleanser\"]} Variant: Korean Cream SKU: BDEFCF4F0A2242A0BEBB3077362B1F49 Price: 18.40 Inventory: 123069 Available: True Status: active Body: Applic"}, {"type": "product", "id": 7890236276799, "title": "Korean Beauty of Joseon Korean Beauty Series Toner Sunscreen Cream", "handle": "korean-beauty-of-joseon-korean-beauty-series-toner-sunscreen-cream", "tags": "skincare", "url": "https://shop.aloha.id.vn/products/korean-beauty-of-joseon-korean-beauty-series-toner-sunscreen-cream", "price": "18.40", "product_type": "", "vendor": "eprolo", "status": "active", "sku": "BDEFCF4F0A2242A0BEBB3077362B1F49", "variant": "Korean Cream", "image": "https://cdn.shopify.com/s/files/1/0623/5340/8063/files/A2EEF9C4F8F721B392193AD84350D37A.jpg?v=1757160021", "inventory_quantity": 123069, "available": true, "text": "able Population: Women, Men, General, Ordinary People Suitable Skin Type: Neutral, General, Oily, Dry, Sensitive, Combination Production License Number: 234235252 Shelf Life: 3 Years Net Content: 150ml/g, 30ml/g, 50ml/g, 100ml/g, 300ml/g, 200ml/g Place of Origin: Guangzhou Cosmetic Efficacy: Oil Control, Exfoliation, Pore Minimizing, Other Effects, Hydration, Brightening, Blackhead Removal, Moisturizing, Deep Cleaning, Skin Soothing, Softening Skin URL: https://shop.aloha.id.vn/products/korean-beauty-of-joseon-korean-beauty-series-toner-sunscreen-cream"}, {"type": "product", "id": 7890236276799, "title": "Korean Beauty of Joseon Korean Beauty Series Toner Sunscreen Cream", "handle": "korean-beauty-of-joseon-korean-beauty-series-toner-sunscreen-cream", "tags": "skincare", "url": "https://shop.aloha.id.vn/products/korean-beauty-of-joseon-korean-beauty-series-toner-sunscreen-cream", "price": "19.76", "product_type": "", "vendor": "eprolo", "status": "active", "sku": "E4363640A2B141B9A03DE5DF450240E9", "variant": "North Korean Mud Mask", "image": "https://cdn.shopify.com/s/files/1/0623/5340/8063/files/A2EEF9C4F8F721B392193AD84350D37A.jpg?v=1757160021", "inventory_quantity": 123017, "available": true, "text": "Product: Korean Beauty of Joseon Korean Beauty Series Toner Sunscreen Cream Type: Vendor: eprolo Tags: skincare Options: {\"Product Specifications\": [\"North Korea Sunscreen\", \"New Version of North Korean Sunscreen\", \"North Korea Sunscreen Stick\", \"North Korea Sunscreen Spray Essence\", \"North Korean Red Bean Jelly\", \"North Korean Green Essence\", \"Korean Cream\", \"North Korean Mud Mask\", \"North Korean Eye Cream\", \"Korean Ginseng Water\", \"North Korean Green Plum Water\", \"North Korean Green Tea\", \"North Korean Propolis\", \"Korean Ginseng Rice\", \"North Korean sugar water\", \"North Korean Makeup Remover Oil\", \"Korean Rice Bran Toner\", \"North Korean Facial Cleanser\"]} Variant: North Korean Mud Mask SKU: E4363640A2B141B9A03DE5DF450240E9 Price: 19.76 Inventory: 123017 Available: True Status: active Bod"}, {"type": "product", "id": 7890236276799, "title": "Korean Beauty of Joseon Korean Beauty Series Toner Sunscreen Cream", "handle": "korean-beauty-of-joseon-korean-beauty-series-toner-sunscreen-cream", "tags": "skincare", "url": "https://shop.aloha.id.vn/products/korean-beauty-of-joseon-korean-beauty-series-toner-sunscreen-cream", "price": "18.40", "product_type": "", "vendor": "eprolo", "status": "active", "sku": "FC10BAAC645042B58626DE74FC699E71", "variant": "North Korean Eye Cream", "image": "https://cdn.shopify.com/s/files/1/0623/5340/8063/files/A2EEF9C4F8F721B392193AD84350D37A.jpg?v=1757160021", "inventory_quantity": 123071, "available": true, "text": "Product: Korean Beauty of Joseon Korean Beauty Series Toner Sunscreen Cream Type: Vendor: eprolo Tags: skincare Options: {\"Product Specifications\": [\"North Korea Sunscreen\", \"New Version of North Korean Sunscreen\", \"North Korea Sunscreen Stick\", \"North Korea Sunscreen Spray Essence\", \"North Korean Red Bean Jelly\", \"North Korean Green Essence\", \"Korean Cream\", \"North Korean Mud Mask\", \"North Korean Eye Cream\", \"Korean Ginseng Water\", \"North Korean Green Plum Water\", \"North Korean Green Tea\", \"North Korean Propolis\", \"Korean Ginseng Rice\", \"North Korean sugar water\", \"North Korean Makeup Remover Oil\", \"Korean Rice Bran Toner\", \"North Korean Facial Cleanser\"]} Variant: North Korean Eye Cream SKU: FC10BAAC645042B58626DE74FC699E71 Price: 18.40 Inventory: 123071 Available: True Status: active Bo"}, {"type": "product", "id": 7890236276799, "title": "Korean Beauty of Joseon Korean Beauty Series Toner Sunscreen Cream", "handle": "korean-beauty-of-joseon-korean-beauty-series-toner-sunscreen-cream", "tags": "skincare", "url": "https://shop.aloha.id.vn/products/korean-beauty-of-joseon-korean-beauty-series-toner-sunscreen-cream", "price": "18.40", "product_type": "", "vendor": "eprolo", "status": "active", "sku": "FC10BAAC645042B58626DE74FC699E71", "variant": "North Korean Eye Cream", "image": "https://cdn.shopify.com/s/files/1/0623/5340/8063/files/A2EEF9C4F8F721B392193AD84350D37A.jpg?v=1757160021", "inventory_quantity": 123071, "available": true, "text": "dy: Applicable Population: Women, Men, General, Ordinary People Suitable Skin Type: Neutral, General, Oily, Dry, Sensitive, Combination Production License Number: 234235252 Shelf Life: 3 Years Net Content: 150ml/g, 30ml/g, 50ml/g, 100ml/g, 300ml/g, 200ml/g Place of Origin: Guangzhou Cosmetic Efficacy: Oil Control, Exfoliation, Pore Minimizing, Other Effects, Hydration, Brightening, Blackhead Removal, Moisturizing, Deep Cleaning, Skin Soothing, Softening Skin URL: https://shop.aloha.id.vn/products/korean-beauty-of-joseon-korean-beauty-series-toner-sunscreen-cream"}, {"type": "product", "id": 7890236276799, "title": "Korean Beauty of Joseon Korean Beauty Series Toner Sunscreen Cream", "handle": "korean-beauty-of-joseon-korean-beauty-series-toner-sunscreen-cream", "tags": "skincare", "url": "https://shop.aloha.id.vn/products/korean-beauty-of-joseon-korean-beauty-series-toner-sunscreen-cream", "price": "18.76", "product_type": "", "vendor": "eprolo", "status": "active", "sku": "3753666132444570AF3024E1B260D3AB", "variant": "Korean Ginseng Water", "image": "https://cdn.shopify.com/s/files/1/0623/5340/8063/files/A2EEF9C4F8F721B392193AD84350D37A.jpg?v=1757160021", "inventory_quantity": 123008, "available": true, "text": "Product: Korean Beauty of Joseon Korean Beauty Series Toner Sunscreen Cream Type: Vendor: eprolo Tags: skincare Options: {\"Product Specifications\": [\"North Korea Sunscreen\", \"New Version of North Korean Sunscreen\", \"North Korea Sunscreen Stick\", \"North Korea Sunscreen Spray Essence\", \"North Korean Red Bean Jelly\", \"North Korean Green Essence\", \"Korean Cream\", \"North Korean Mud Mask\", \"North Korean Eye Cream\", \"Korean Ginseng Water\", \"North Korean Green Plum Water\", \"North Korean Green Tea\", \"North Korean Propolis\", \"Korean Ginseng Rice\", \"North Korean sugar water\", \"North Korean Makeup Remover Oil\", \"Korean Rice Bran Toner\", \"North Korean Facial Cleanser\"]} Variant: Korean Ginseng Water SKU: 3753666132444570AF3024E1B260D3AB Price: 18.76 Inventory: 123008 Available: True Status: active Body"}, {"type": "product", "id": 7890236276799, "title": "Korean Beauty of Joseon Korean Beauty Series Toner Sunscreen Cream", "handle": "korean-beauty-of-joseon-korean-beauty-series-toner-sunscreen-cream", "tags": "skincare", "url": "https://shop.aloha.id.vn/products/korean-beauty-of-joseon-korean-beauty-series-toner-sunscreen-cream", "price": "18.76", "product_type": "", "vendor": "eprolo", "status": "active", "sku": "3753666132444570AF3024E1B260D3AB", "variant": "Korean Ginseng Water", "image": "https://cdn.shopify.com/s/files/1/0623/5340/8063/files/A2EEF9C4F8F721B392193AD84350D37A.jpg?v=1757160021", "inventory_quantity": 123008, "available": true, "text": ": Applicable Population: Women, Men, General, Ordinary People Suitable Skin Type: Neutral, General, Oily, Dry, Sensitive, Combination Production License Number: 234235252 Shelf Life: 3 Years Net Content: 150ml/g, 30ml/g, 50ml/g, 100ml/g, 300ml/g, 200ml/g Place of Origin: Guangzhou Cosmetic Efficacy: Oil Control, Exfoliation, Pore Minimizing, Other Effects, Hydration, Brightening, Blackhead Removal, Moisturizing, Deep Cleaning, Skin Soothing, Softening Skin URL: https://shop.aloha.id.vn/products/korean-beauty-of-joseon-korean-beauty-series-toner-sunscreen-cream"}, {"type": "product", "id": 7890236276799, "title": "Korean Beauty of Joseon Korean Beauty Series Toner Sunscreen Cream", "handle": "korean-beauty-of-joseon-korean-beauty-series-toner-sunscreen-cream", "tags": "skincare", "url": "https://shop.aloha.id.vn/products/korean-beauty-of-joseon-korean-beauty-series-toner-sunscreen-cream", "price": "18.76", "product_type": "", "vendor": "eprolo", "status": "active", "sku": "C52A9E0E54974106975208DA62DAB676", "variant": "North Korean Green Plum Water", "image": "https://cdn.shopify.com/s/files/1/0623/5340/8063/files/A2EEF9C4F8F721B392193AD84350D37A.jpg?v=1757160021", "inventory_quantity": 122984, "available": true, "text": "Product: Korean Beauty of Joseon Korean Beauty Series Toner Sunscreen Cream Type: Vendor: eprolo Tags: skincare Options: {\"Product Specifications\": [\"North Korea Sunscreen\", \"New Version of North Korean Sunscreen\", \"North Korea Sunscreen Stick\", \"North Korea Sunscreen Spray Essence\", \"North Korean Red Bean Jelly\", \"North Korean Green Essence\", \"Korean Cream\", \"North Korean Mud Mask\", \"North Korean Eye Cream\", \"Korean Ginseng Water\", \"North Korean Green Plum Water\", \"North Korean Green Tea\", \"North Korean Propolis\", \"Korean Ginseng Rice\", \"North Korean sugar water\", \"North Korean Makeup Remover Oil\", \"Korean Rice Bran Toner\", \"North Korean Facial Cleanser\"]} Variant: North Korean Green Plum Water SKU: C52A9E0E54974106975208DA62DAB676 Price: 18.76 Inventory: 122984 Available: True Status: ac"}, {"type": "product", "id": 7890236276799, "title": "Korean Beauty of Joseon Korean Beauty Series Toner Sunscreen Cream", "handle": "korean-beauty-of-joseon-korean-beauty-series-toner-sunscreen-cream", "tags": "skincare", "url": "https://shop.aloha.id.vn/products/korean-beauty-of-joseon-korean-beauty-series-toner-sunscreen-cream", "price": "18.76", "product_type": "", "vendor": "eprolo", "status": "active", "sku": "C52A9E0E54974106975208DA62DAB676", "variant": "North Korean Green Plum Water", "image": "https://cdn.shopify.com/s/files/1/0623/5340/8063/files/A2EEF9C4F8F721B392193AD84350D37A.jpg?v=1757160021", "inventory_quantity": 122984, "available": true, "text": "tive Body: Applicable Population: Women, Men, General, Ordinary People Suitable Skin Type: Neutral, General, Oily, Dry, Sensitive, Combination Production License Number: 234235252 Shelf Life: 3 Years Net Content: 150ml/g, 30ml/g, 50ml/g, 100ml/g, 300ml/g, 200ml/g Place of Origin: Guangzhou Cosmetic Efficacy: Oil Control, Exfoliation, Pore Minimizing, Other Effects, Hydration, Brightening, Blackhead Removal, Moisturizing, Deep Cleaning, Skin Soothing, Softening Skin URL: https://shop.aloha.id.vn/products/korean-beauty-of-joseon-korean-beauty-series-toner-sunscreen-cream"}, {"type": "product", "id": 7890236276799, "title": "Korean Beauty of Joseon Korean Beauty Series Toner Sunscreen Cream", "handle": "korean-beauty-of-joseon-korean-beauty-series-toner-sunscreen-cream", "tags": "skincare", "url": "https://shop.aloha.id.vn/products/korean-beauty-of-joseon-korean-beauty-series-toner-sunscreen-cream", "price": "18.08", "product_type": "", "vendor": "eprolo", "status": "active", "sku": "AE9298D3A5CB41BD97ABBA11B6C4D560", "variant": "North Korean Green Tea", "image": "https://cdn.shopify.com/s/files/1/0623/5340/8063/files/A2EEF9C4F8F721B392193AD84350D37A.jpg?v=1757160021", "inventory_quantity": 122160, "available": true, "text": "Product: Korean Beauty of Joseon Korean Beauty Series Toner Sunscreen Cream Type: Vendor: eprolo Tags: skincare Options: {\"Product Specifications\": [\"North Korea Sunscreen\", \"New Version of North Korean Sunscreen\", \"North Korea Sunscreen Stick\", \"North Korea Sunscreen Spray Essence\", \"North Korean Red Bean Jelly\", \"North Korean Green Essence\", \"Korean Cream\", \"North Korean Mud Mask\", \"North Korean Eye Cream\", \"Korean Ginseng Water\", \"North Korean Green Plum Water\", \"North Korean Green Tea\", \"North Korean Propolis\", \"Korean Ginseng Rice\", \"North Korean sugar water\", \"North Korean Makeup Remover Oil\", \"Korean Rice Bran Toner\", \"North Korean Facial Cleanser\"]} Variant: North Korean Green Tea SKU: AE9298D3A5CB41BD97ABBA11B6C4D560 Price: 18.08 Inventory: 122160 Available: True Status: active Bo"}, {"type": "product", "id": 7890236276799, "title": "Korean Beauty of Joseon Korean Beauty Series Toner Sunscreen Cream", "handle": "korean-beauty-of-joseon-korean-beauty-series-toner-sunscreen-cream", "tags": "skincare", "url": "https://shop.aloha.id.vn/products/korean-beauty-of-joseon-korean-beauty-series-toner-sunscreen-cream", "price": "18.08", "product_type": "", "vendor": "eprolo", "status": "active", "sku": "B8E5A19E5FA74AF299E640EA1DAE4B63", "variant": "North Korean Propolis", "image": "https://cdn.shopify.com/s/files/1/0623/5340/8063/files/A2EEF9C4F8F721B392193AD84350D37A.jpg?v=1757160021", "inventory_quantity": 122063, "available": true, "text": "Product: Korean Beauty of Joseon Korean Beauty Series Toner Sunscreen Cream Type: Vendor: eprolo Tags: skincare Options: {\"Product Specifications\": [\"North Korea Sunscreen\", \"New Version of North Korean Sunscreen\", \"North Korea Sunscreen Stick\", \"North Korea Sunscreen Spray Essence\", \"North Korean Red Bean Jelly\", \"North Korean Green Essence\", \"Korean Cream\", \"North Korean Mud Mask\", \"North Korean Eye Cream\", \"Korean Ginseng Water\", \"North Korean Green Plum Water\", \"North Korean Green Tea\", \"North Korean Propolis\", \"Korean Ginseng Rice\", \"North Korean sugar water\", \"North Korean Makeup Remover Oil\", \"Korean Rice Bran Toner\", \"North Korean Facial Cleanser\"]} Variant: North Korean Propolis SKU: B8E5A19E5FA74AF299E640EA1DAE4B63 Price: 18.08 Inventory: 122063 Available: True Status: active Bod"}, {"type": "product", "id": 7890236276799, "title": "Korean Beauty of Joseon Korean Beauty Series Toner Sunscreen Cream", "handle": "korean-beauty-of-joseon-korean-beauty-series-toner-sunscreen-cream", "tags": "skincare", "url": "https://shop.aloha.id.vn/products/korean-beauty-of-joseon-korean-beauty-series-toner-sunscreen-cream", "price": "18.08", "product_type": "", "vendor": "eprolo", "status": "active", "sku": "38AD66FFE2954DBF8B3BAEDF1F68FC76", "variant": "Korean Ginseng Rice", "image": "https://cdn.shopify.com/s/files/1/0623/5340/8063/files/A2EEF9C4F8F721B392193AD84350D37A.jpg?v=1757160021", "inventory_quantity": 123082, "available": true, "text": "Product: Korean Beauty of Joseon Korean Beauty Series Toner Sunscreen Cream Type: Vendor: eprolo Tags: skincare Options: {\"Product Specifications\": [\"North Korea Sunscreen\", \"New Version of North Korean Sunscreen\", \"North Korea Sunscreen Stick\", \"North Korea Sunscreen Spray Essence\", \"North Korean Red Bean Jelly\", \"North Korean Green Essence\", \"Korean Cream\", \"North Korean Mud Mask\", \"North Korean Eye Cream\", \"Korean Ginseng Water\", \"North Korean Green Plum Water\", \"North Korean Green Tea\", \"North Korean Propolis\", \"Korean Ginseng Rice\", \"North Korean sugar water\", \"North Korean Makeup Remover Oil\", \"Korean Rice Bran Toner\", \"North Korean Facial Cleanser\"]} Variant: Korean Ginseng Rice SKU: 38AD66FFE2954DBF8B3BAEDF1F68FC76 Price: 18.08 Inventory: 123082 Available: True Status: active Body:"}, {"type": "product", "id": 7890236276799, "title": "Korean Beauty of Joseon Korean Beauty Series Toner Sunscreen Cream", "handle": "korean-beauty-of-joseon-korean-beauty-series-toner-sunscreen-cream", "tags": "skincare", "url": "https://shop.aloha.id.vn/products/korean-beauty-of-joseon-korean-beauty-series-toner-sunscreen-cream", "price": "18.08", "product_type": "", "vendor": "eprolo", "status": "active", "sku": "38AD66FFE2954DBF8B3BAEDF1F68FC76", "variant": "Korean Ginseng Rice", "image": "https://cdn.shopify.com/s/files/1/0623/5340/8063/files/A2EEF9C4F8F721B392193AD84350D37A.jpg?v=1757160021", "inventory_quantity": 123082, "available": true, "text": " Applicable Population: Women, Men, General, Ordinary People Suitable Skin Type: Neutral, General, Oily, Dry, Sensitive, Combination Production License Number: 234235252 Shelf Life: 3 Years Net Content: 150ml/g, 30ml/g, 50ml/g, 100ml/g, 300ml/g, 200ml/g Place of Origin: Guangzhou Cosmetic Efficacy: Oil Control, Exfoliation, Pore Minimizing, Other Effects, Hydration, Brightening, Blackhead Removal, Moisturizing, Deep Cleaning, Skin Soothing, Softening Skin URL: https://shop.aloha.id.vn/products/korean-beauty-of-joseon-korean-beauty-series-toner-sunscreen-cream"}, {"type": "product", "id": 7890236276799, "title": "Korean Beauty of Joseon Korean Beauty Series Toner Sunscreen Cream", "handle": "korean-beauty-of-joseon-korean-beauty-series-toner-sunscreen-cream", "tags": "skincare", "url": "https://shop.aloha.id.vn/products/korean-beauty-of-joseon-korean-beauty-series-toner-sunscreen-cream", "price": "18.08", "product_type": "", "vendor": "eprolo", "status": "active", "sku": "19655729616243A6A587A93DA8516253", "variant": "North Korean sugar water", "image": "https://cdn.shopify.com/s/files/1/0623/5340/8063/files/A2EEF9C4F8F721B392193AD84350D37A.jpg?v=1757160021", "inventory_quantity": 123112, "available": true, "text": "Product: Korean Beauty of Joseon Korean Beauty Series Toner Sunscreen Cream Type: Vendor: eprolo Tags: skincare Options: {\"Product Specifications\": [\"North Korea Sunscreen\", \"New Version of North Korean Sunscreen\", \"North Korea Sunscreen Stick\", \"North Korea Sunscreen Spray Essence\", \"North Korean Red Bean Jelly\", \"North Korean Green Essence\", \"Korean Cream\", \"North Korean Mud Mask\", \"North Korean Eye Cream\", \"Korean Ginseng Water\", \"North Korean Green Plum Water\", \"North Korean Green Tea\", \"North Korean Propolis\", \"Korean Ginseng Rice\", \"North Korean sugar water\", \"North Korean Makeup Remover Oil\", \"Korean Rice Bran Toner\", \"North Korean Facial Cleanser\"]} Variant: North Korean sugar water SKU: 19655729616243A6A587A93DA8516253 Price: 18.08 Inventory: 123112 Available: True Status: active "}, {"type": "product", "id": 7890236276799, "title": "Korean Beauty of Joseon Korean Beauty Series Toner Sunscreen Cream", "handle": "korean-beauty-of-joseon-korean-beauty-series-toner-sunscreen-cream", "tags": "skincare", "url": "https://shop.aloha.id.vn/products/korean-beauty-of-joseon-korean-beauty-series-toner-sunscreen-cream", "price": "18.08", "product_type": "", "vendor": "eprolo", "status": "active", "sku": "19655729616243A6A587A93DA8516253", "variant": "North Korean sugar water", "image": "https://cdn.shopify.com/s/files/1/0623/5340/8063/files/A2EEF9C4F8F721B392193AD84350D37A.jpg?v=1757160021", "inventory_quantity": 123112, "available": true, "text": "Body: Applicable Population: Women, Men, General, Ordinary People Suitable Skin Type: Neutral, General, Oily, Dry, Sensitive, Combination Production License Number: 234235252 Shelf Life: 3 Years Net Content: 150ml/g, 30ml/g, 50ml/g, 100ml/g, 300ml/g, 200ml/g Place of Origin: Guangzhou Cosmetic Efficacy: Oil Control, Exfoliation, Pore Minimizing, Other Effects, Hydration, Brightening, Blackhead Removal, Moisturizing, Deep Cleaning, Skin Soothing, Softening Skin URL: https://shop.aloha.id.vn/products/korean-beauty-of-joseon-korean-beauty-series-toner-sunscreen-cream"}, {"type": "product", "id": 7890236276799, "title": "Korean Beauty of Joseon Korean Beauty Series Toner Sunscreen Cream", "handle": "korean-beauty-of-joseon-korean-beauty-series-toner-sunscreen-cream", "tags": "skincare", "url": "https://shop.aloha.id.vn/products/korean-beauty-of-joseon-korean-beauty-series-toner-sunscreen-cream", "price": "20.10", "product_type": "", "vendor": "eprolo", "status": "active", "sku": "E4F31C7372E44EEE9FE837D905031328", "variant": "North Korean Makeup Remover Oil", "image": "https://cdn.shopify.com/s/files/1/0623/5340/8063/files/A2EEF9C4F8F721B392193AD84350D37A.jpg?v=1757160021", "inventory_quantity": 123090, "available": true, "text": "Product: Korean Beauty of Joseon Korean Beauty Series Toner Sunscreen Cream Type: Vendor: eprolo Tags: skincare Options: {\"Product Specifications\": [\"North Korea Sunscreen\", \"New Version of North Korean Sunscreen\", \"North Korea Sunscreen Stick\", \"North Korea Sunscreen Spray Essence\", \"North Korean Red Bean Jelly\", \"North Korean Green Essence\", \"Korean Cream\", \"North Korean Mud Mask\", \"North Korean Eye Cream\", \"Korean Ginseng Water\", \"North Korean Green Plum Water\", \"North Korean Green Tea\", \"North Korean Propolis\", \"Korean Ginseng Rice\", \"North Korean sugar water\", \"North Korean Makeup Remover Oil\", \"Korean Rice Bran Toner\", \"North Korean Facial Cleanser\"]} Variant: North Korean Makeup Remover Oil SKU: E4F31C7372E44EEE9FE837D905031328 Price: 20.10 Inventory: 123090 Available: True Status: "}, {"type": "product", "id": 7890236276799, "title": "Korean Beauty of Joseon Korean Beauty Series Toner Sunscreen Cream", "handle": "korean-beauty-of-joseon-korean-beauty-series-toner-sunscreen-cream", "tags": "skincare", "url": "https://shop.aloha.id.vn/products/korean-beauty-of-joseon-korean-beauty-series-toner-sunscreen-cream", "price": "20.10", "product_type": "", "vendor": "eprolo", "status": "active", "sku": "E4F31C7372E44EEE9FE837D905031328", "variant": "North Korean Makeup Remover Oil", "image": "https://cdn.shopify.com/s/files/1/0623/5340/8063/files/A2EEF9C4F8F721B392193AD84350D37A.jpg?v=1757160021", "inventory_quantity": 123090, "available": true, "text": "active Body: Applicable Population: Women, Men, General, Ordinary People Suitable Skin Type: Neutral, General, Oily, Dry, Sensitive, Combination Production License Number: 234235252 Shelf Life: 3 Years Net Content: 150ml/g, 30ml/g, 50ml/g, 100ml/g, 300ml/g, 200ml/g Place of Origin: Guangzhou Cosmetic Efficacy: Oil Control, Exfoliation, Pore Minimizing, Other Effects, Hydration, Brightening, Blackhead Removal, Moisturizing, Deep Cleaning, Skin Soothing, Softening Skin URL: https://shop.aloha.id.vn/products/korean-beauty-of-joseon-korean-beauty-series-toner-sunscreen-cream"}, {"type": "product", "id": 7890236276799, "title": "Korean Beauty of Joseon Korean Beauty Series Toner Sunscreen Cream", "handle": "korean-beauty-of-joseon-korean-beauty-series-toner-sunscreen-cream", "tags": "skincare", "url": "https://shop.aloha.id.vn/products/korean-beauty-of-joseon-korean-beauty-series-toner-sunscreen-cream", "price": "20.10", "product_type": "", "vendor": "eprolo", "status": "active", "sku": "DCAC388466EF4C91A6F74F00412B6574", "variant": "Korean Rice Bran Toner", "image": "https://cdn.shopify.com/s/files/1/0623/5340/8063/files/A2EEF9C4F8F721B392193AD84350D37A.jpg?v=1757160021", "inventory_quantity": 123098, "available": true, "text": "Product: Korean Beauty of Joseon Korean Beauty Series Toner Sunscreen Cream Type: Vendor: eprolo Tags: skincare Options: {\"Product Specifications\": [\"North Korea Sunscreen\", \"New Version of North Korean Sunscreen\", \"North Korea Sunscreen Stick\", \"North Korea Sunscreen Spray Essence\", \"North Korean Red Bean Jelly\", \"North Korean Green Essence\", \"Korean Cream\", \"North Korean Mud Mask\", \"North Korean Eye Cream\", \"Korean Ginseng Water\", \"North Korean Green Plum Water\", \"North Korean Green Tea\", \"North Korean Propolis\", \"Korean Ginseng Rice\", \"North Korean sugar water\", \"North Korean Makeup Remover Oil\", \"Korean Rice Bran Toner\", \"North Korean Facial Cleanser\"]} Variant: Korean Rice Bran Toner SKU: DCAC388466EF4C91A6F74F00412B6574 Price: 20.10 Inventory: 123098 Available: True Status: active Bo"}, {"type": "product", "id": 7890236276799, "title": "Korean Beauty of Joseon Korean Beauty Series Toner Sunscreen Cream", "handle": "korean-beauty-of-joseon-korean-beauty-series-toner-sunscreen-cream", "tags": "skincare", "url": "https://shop.aloha.id.vn/products/korean-beauty-of-joseon-korean-beauty-series-toner-sunscreen-cream", "price": "18.76", "product_type": "", "vendor": "eprolo", "status": "active", "sku": "84A49D6651044329AFB956C05601CC31", "variant": "North Korean Facial Cleanser", "image": "https://cdn.shopify.com/s/files/1/0623/5340/8063/files/A2EEF9C4F8F721B392193AD84350D37A.jpg?v=1757160021", "inventory_quantity": 122992, "available": true, "text": "Product: Korean Beauty of Joseon Korean Beauty Series Toner Sunscreen Cream Type: Vendor: eprolo Tags: skincare Options: {\"Product Specifications\": [\"North Korea Sunscreen\", \"New Version of North Korean Sunscreen\", \"North Korea Sunscreen Stick\", \"North Korea Sunscreen Spray Essence\", \"North Korean Red Bean Jelly\", \"North Korean Green Essence\", \"Korean Cream\", \"North Korean Mud Mask\", \"North Korean Eye Cream\", \"Korean Ginseng Water\", \"North Korean Green Plum Water\", \"North Korean Green Tea\", \"North Korean Propolis\", \"Korean Ginseng Rice\", \"North Korean sugar water\", \"North Korean Makeup Remover Oil\", \"Korean Rice Bran Toner\", \"North Korean Facial Cleanser\"]} Variant: North Korean Facial Cleanser SKU: 84A49D6651044329AFB956C05601CC31 Price: 18.76 Inventory: 122992 Available: True Status: act"}, {"type": "product", "id": 7890236276799, "title": "Korean Beauty of Joseon Korean Beauty Series Toner Sunscreen Cream", "handle": "korean-beauty-of-joseon-korean-beauty-series-toner-sunscreen-cream", "tags": "skincare", "url": "https://shop.aloha.id.vn/products/korean-beauty-of-joseon-korean-beauty-series-toner-sunscreen-cream", "price": "18.76", "product_type": "", "vendor": "eprolo", "status": "active", "sku": "84A49D6651044329AFB956C05601CC31", "variant": "North Korean Facial Cleanser", "image": "https://cdn.shopify.com/s/files/1/0623/5340/8063/files/A2EEF9C4F8F721B392193AD84350D37A.jpg?v=1757160021", "inventory_quantity": 122992, "available": true, "text": "ive Body: Applicable Population: Women, Men, General, Ordinary People Suitable Skin Type: Neutral, General, Oily, Dry, Sensitive, Combination Production License Number: 234235252 Shelf Life: 3 Years Net Content: 150ml/g, 30ml/g, 50ml/g, 100ml/g, 300ml/g, 200ml/g Place of Origin: Guangzhou Cosmetic Efficacy: Oil Control, Exfoliation, Pore Minimizing, Other Effects, Hydration, Brightening, Blackhead Removal, Moisturizing, Deep Cleaning, Skin Soothing, Softening Skin URL: https://shop.aloha.id.vn/products/korean-beauty-of-joseon-korean-beauty-series-toner-sunscreen-cream"}, {"type": "product", "id": 7890249056319, "title": "Milk Calcium Tablets For Dogs Vitamin Supplements For Pets Oral Care Diet Healthy Nutrition Calcium Tablets", "handle": "milk-calcium-tablets-for-dogs-vitamin-supplements-for-pets-oral-care-diet-healthy-nutrition-calcium-tablets", "tags": "dog", "url": "https://shop.aloha.id.vn/products/milk-calcium-tablets-for-dogs-vitamin-supplements-for-pets-oral-care-diet-healthy-nutrition-calcium-tablets", "price": "22.78", "product_type": "", "vendor": "eprolo", "status": "active", "sku": "YEG02-A022-80-WH1", "variant": "default title", "image": "https://cdn.shopify.com/s/files/1/0623/5340/8063/files/78FD74371F84E856BC66DEC920FE4549.jpg?v=1757165354", "inventory_quantity": 87, "available": true, "text": "Product: Milk Calcium Tablets For Dogs Vitamin Supplements For Pets Oral Care Diet Healthy Nutrition Calcium Tablets Type: Vendor: eprolo Tags: dog Options: {\"color\": [\"default title\"]} Variant: default title SKU: YEG02-A022-80-WH1 Price: 22.78 Inventory: 87 Available: True Status: active Body: Our dog milk calcium tablets contain meat and its products, full fat sheep milk powder, milk calcium. It can help strengthen bones and reduce the risk of fractures. Provides essential minerals to strengthen teeth and reduce oral diseases. Its use method is very simple: 1. Feed directly or mix with daily feed; 2. < 5 kg (weaning to 5 months) : 2-4 pieces/day, 5-10 kg (5-12 months) : 4 to 6 tablets per day, > 10 kg (adult) : 4 to 8 piece/day. It can improve the problem of short stature of puppies and "}, {"type": "product", "id": 7890249056319, "title": "Milk Calcium Tablets For Dogs Vitamin Supplements For Pets Oral Care Diet Healthy Nutrition Calcium Tablets", "handle": "milk-calcium-tablets-for-dogs-vitamin-supplements-for-pets-oral-care-diet-healthy-nutrition-calcium-tablets", "tags": "dog", "url": "https://shop.aloha.id.vn/products/milk-calcium-tablets-for-dogs-vitamin-supplements-for-pets-oral-care-diet-healthy-nutrition-calcium-tablets", "price": "22.78", "product_type": "", "vendor": "eprolo", "status": "active", "sku": "YEG02-A022-80-WH1", "variant": "default title", "image": "https://cdn.shopify.com/s/files/1/0623/5340/8063/files/78FD74371F84E856BC66DEC920FE4549.jpg?v=1757165354", "inventory_quantity": 87, "available": true, "text": "promote the healthy growth of puppies. URL: https://shop.aloha.id.vn/products/milk-calcium-tablets-for-dogs-vitamin-supplements-for-pets-oral-care-diet-healthy-nutrition-calcium-tablets"}, {"type": "product", "id": 7889141432383, "title": "Nicotinamide Brightening Serum, Gently Nourishing, Hydrating And Brightening Facial Skin Moisturizing And Skincare Essence", "handle": "nicotinamide-brightening-serum-gently-nourishing-hydrating-and-brightening-facial-skin-moisturizing-and-skincare-essence", "tags": "skincare", "url": "https://shop.aloha.id.vn/products/nicotinamide-brightening-serum-gently-nourishing-hydrating-and-brightening-facial-skin-moisturizing-and-skincare-essence", "price": "22.78", "product_type": "", "vendor": "eprolo", "status": "active", "sku": "OU-A05-0442-02", "variant": "default title", "image": "https://cdn.shopify.com/s/files/1/0623/5340/8063/files/AD0E54D258629BD4F96CDB373CBB11D0.jpg?v=1757002360", "inventory_quantity": 200, "available": true, "text": "Product: Nicotinamide Brightening Serum, Gently Nourishing, Hydrating And Brightening Facial Skin Moisturizing And Skincare Essence Type: Vendor: eprolo Tags: skincare Options: {\"color\": [\"default title\"]} Variant: default title SKU: OU-A05-0442-02 Price: 22.78 Inventory: 200 Available: True Status: active Body: Our nicotinamide brightening serum contains coffee seed extract, ceramide AP. It can effectively moisturize and brighten the skin tone, helping to restore a healthy glow. Its application method is very simple: clean your face, keep dry, apply an appropriate amount of this product evenly on the face, gently massage in a circular motion until completely absorbed. It also provides deep moisture and helps to improve dry skin problems. URL: https://shop.aloha.id.vn/products/nicotinamide"}, {"type": "product", "id": 7889141432383, "title": "Nicotinamide Brightening Serum, Gently Nourishing, Hydrating And Brightening Facial Skin Moisturizing And Skincare Essence", "handle": "nicotinamide-brightening-serum-gently-nourishing-hydrating-and-brightening-facial-skin-moisturizing-and-skincare-essence", "tags": "skincare", "url": "https://shop.aloha.id.vn/products/nicotinamide-brightening-serum-gently-nourishing-hydrating-and-brightening-facial-skin-moisturizing-and-skincare-essence", "price": "22.78", "product_type": "", "vendor": "eprolo", "status": "active", "sku": "OU-A05-0442-02", "variant": "default title", "image": "https://cdn.shopify.com/s/files/1/0623/5340/8063/files/AD0E54D258629BD4F96CDB373CBB11D0.jpg?v=1757002360", "inventory_quantity": 200, "available": true, "text": "-brightening-serum-gently-nourishing-hydrating-and-brightening-facial-skin-moisturizing-and-skincare-essence"}, {"type": "product", "id": 7890248826943, "title": "North Moon Women's Care Capsules Gently Clean, Nourish And Firm Body Skin Balance Care Capsules", "handle": "north-moon-womens-care-capsules-gently-clean-nourish-and-firm-body-skin-balance-care-capsules", "tags": "Food Supplements", "url": "https://shop.aloha.id.vn/products/north-moon-womens-care-capsules-gently-clean-nourish-and-firm-body-skin-balance-care-capsules", "price": "23.86", "product_type": "", "vendor": "eprolo", "status": "active", "sku": "NO-B13-0010-01", "variant": "default title", "image": "https://cdn.shopify.com/s/files/1/0623/5340/8063/files/7B74C7FC0378A336164573ECCD1EB85B.jpg?v=1757165209", "inventory_quantity": 91, "available": true, "text": "Product: North Moon Women's Care Capsules Gently Clean, Nourish And Firm Body Skin Balance Care Capsules Type: Vendor: eprolo Tags: Food Supplements Options: {\"color\": [\"default title\"]} Variant: default title SKU: NO-B13-0010-01 Price: 23.86 Inventory: 91 Available: True Status: active Body: Our women's care capsules contain soybean oil and snake seed fruit extract. It helps the body get rid of impurities and shape the body. Helps keep private parts healthy and supports protection. The way to use it is simple: clean hands and private parts. Take a capsule and gently place it into your private area and wait for it to dissolve and absorb. It can also promote hormonal balance, help maintain body energy and vitality, and make skin glowing and healthy. Promote the process of removing impuritie"}, {"type": "product", "id": 7890248826943, "title": "North Moon Women's Care Capsules Gently Clean, Nourish And Firm Body Skin Balance Care Capsules", "handle": "north-moon-womens-care-capsules-gently-clean-nourish-and-firm-body-skin-balance-care-capsules", "tags": "Food Supplements", "url": "https://shop.aloha.id.vn/products/north-moon-womens-care-capsules-gently-clean-nourish-and-firm-body-skin-balance-care-capsules", "price": "23.86", "product_type": "", "vendor": "eprolo", "status": "active", "sku": "NO-B13-0010-01", "variant": "default title", "image": "https://cdn.shopify.com/s/files/1/0623/5340/8063/files/7B74C7FC0378A336164573ECCD1EB85B.jpg?v=1757165209", "inventory_quantity": 91, "available": true, "text": "s from the body, reduce the burden, and help keep the body light and comfortable. URL: https://shop.aloha.id.vn/products/north-moon-womens-care-capsules-gently-clean-nourish-and-firm-body-skin-balance-care-capsules"}, {"type": "product", "id": 7889144840255, "title": "OceAura Lemon Herbal Vitamin C Soap Cleanser Body Skin Bath Mild Clean Refreshing Oil Control Skincare Soap", "handle": "oceaura-lemon-herbal-vitamin-c-soap-cleanser-body-skin-bath-mild-clean-refreshing-oil-control-skincare-soap", "tags": "skincare", "url": "https://shop.aloha.id.vn/products/oceaura-lemon-herbal-vitamin-c-soap-cleanser-body-skin-bath-mild-clean-refreshing-oil-control-skincare-soap", "price": "24.12", "product_type": "", "vendor": "eprolo", "status": "active", "sku": "OC-A06-0142-01", "variant": "default title", "image": "https://cdn.shopify.com/s/files/1/0623/5340/8063/files/E88C31B60CECBE08596B2A459A9BD850.jpg?v=1757002411", "inventory_quantity": 123, "available": true, "text": "Product: OceAura Lemon Herbal Vitamin C Soap Cleanser Body Skin Bath Mild Clean Refreshing Oil Control Skincare Soap Type: Vendor: eprolo Tags: skincare Options: {\"color\": [\"default title\"]} Variant: default title SKU: OC-A06-0142-01 Price: 24.12 Inventory: 123 Available: True Status: active Body: Our lemon herbal vitamin C soap is carefully blended from shea butter, lemon oil and tea tree oil. Designed specifically for deeply nourishing the skin and keeping it hydrated and smooth. The usage method is extremely convenient: First, use clean water to create foam with the soap, then apply it to the skin and massage for 1 minute. Finally, rinse it off with clean water. It can effectively remove dirt and oil, keep the skin fresh and clean, and help brighten and even out the skin tone. URL: http"}, {"type": "product", "id": 7889144840255, "title": "OceAura Lemon Herbal Vitamin C Soap Cleanser Body Skin Bath Mild Clean Refreshing Oil Control Skincare Soap", "handle": "oceaura-lemon-herbal-vitamin-c-soap-cleanser-body-skin-bath-mild-clean-refreshing-oil-control-skincare-soap", "tags": "skincare", "url": "https://shop.aloha.id.vn/products/oceaura-lemon-herbal-vitamin-c-soap-cleanser-body-skin-bath-mild-clean-refreshing-oil-control-skincare-soap", "price": "24.12", "product_type": "", "vendor": "eprolo", "status": "active", "sku": "OC-A06-0142-01", "variant": "default title", "image": "https://cdn.shopify.com/s/files/1/0623/5340/8063/files/E88C31B60CECBE08596B2A459A9BD850.jpg?v=1757002411", "inventory_quantity": 123, "available": true, "text": "s://shop.aloha.id.vn/products/oceaura-lemon-herbal-vitamin-c-soap-cleanser-body-skin-bath-mild-clean-refreshing-oil-control-skincare-soap"}, {"type": "product", "id": 7890236899391, "title": "OceAura Propolis Beauty Bath Soap, Gently Nourishes And Cleanses Body Skin With Delicate And Fragrant Bath Soap", "handle": "oceaura-propolis-beauty-bath-soap-gently-nourishes-and-cleanses-body-skin-with-delicate-and-fragrant-bath-soap", "tags": "skincare", "url": "https://shop.aloha.id.vn/products/oceaura-propolis-beauty-bath-soap-gently-nourishes-and-cleanses-body-skin-with-delicate-and-fragrant-bath-soap", "price": "24.12", "product_type": "", "vendor": "eprolo", "status": "active", "sku": "OC-A06-0389-01", "variant": "default title", "image": "https://cdn.shopify.com/s/files/1/0623/5340/8063/files/F93E9803BC88B1BBAD7E359A1145E515.jpg?v=1757160155", "inventory_quantity": 209, "available": true, "text": "Product: OceAura Propolis Beauty Bath Soap, Gently Nourishes And Cleanses Body Skin With Delicate And Fragrant Bath Soap Type: Vendor: eprolo Tags: skincare Options: {\"color\": [\"default title\"]} Variant: default title SKU: OC-A06-0389-01 Price: 24.12 Inventory: 209 Available: True Status: active Body: Our propolis body soap contains coconut oil and stearic acid. It can foam delicate and rich, easily cover the skin, bring cleansing enjoyment. The smell of fresh camel milk will make your bath a pleasant time. Its application is simple: Rub the product between wet palms until a rich foam forms. Apply the foam to your face and body and massage gently to help care for your skin. Rinse well with water. And can be used, the skin feels smoother, more delicate, so that it feels more comfortable. UR"}, {"type": "product", "id": 7890236899391, "title": "OceAura Propolis Beauty Bath Soap, Gently Nourishes And Cleanses Body Skin With Delicate And Fragrant Bath Soap", "handle": "oceaura-propolis-beauty-bath-soap-gently-nourishes-and-cleanses-body-skin-with-delicate-and-fragrant-bath-soap", "tags": "skincare", "url": "https://shop.aloha.id.vn/products/oceaura-propolis-beauty-bath-soap-gently-nourishes-and-cleanses-body-skin-with-delicate-and-fragrant-bath-soap", "price": "24.12", "product_type": "", "vendor": "eprolo", "status": "active", "sku": "OC-A06-0389-01", "variant": "default title", "image": "https://cdn.shopify.com/s/files/1/0623/5340/8063/files/F93E9803BC88B1BBAD7E359A1145E515.jpg?v=1757160155", "inventory_quantity": 209, "available": true, "text": "L: https://shop.aloha.id.vn/products/oceaura-propolis-beauty-bath-soap-gently-nourishes-and-cleanses-body-skin-with-delicate-and-fragrant-bath-soap"}, {"type": "product", "id": 7890228379711, "title": "OceAura Shea Butter Moisturizer Daily Nourishes And Moisturizes Skin With Gentle Ingredients That Easily Absorb Body Lotion", "handle": "oceaura-shea-butter-moisturizer-daily-nourishes-and-moisturizes-skin-with-gentle-ingredients-that-easily-absorb-body-lotion", "tags": "skincare", "url": "https://shop.aloha.id.vn/products/oceaura-shea-butter-moisturizer-daily-nourishes-and-moisturizes-skin-with-gentle-ingredients-that-easily-absorb-body-lotion", "price": "23.86", "product_type": "", "vendor": "eprolo", "status": "active", "sku": "OC-A06-0265-01", "variant": "default title", "image": "https://cdn.shopify.com/s/files/1/0623/5340/8063/files/571A0C16AB4FD348F29359F5D277711A.jpg?v=1757156632", "inventory_quantity": 80, "available": true, "text": "Product: OceAura Shea Butter Moisturizer Daily Nourishes And Moisturizes Skin With Gentle Ingredients That Easily Absorb Body Lotion Type: Vendor: eprolo Tags: skincare Options: {\"color\": [\"default title\"]} Variant: default title SKU: OC-A06-0265-01 Price: 23.86 Inventory: 80 Available: True Status: active Body: Our shea butter moisturizer contains shea butter, Jojoba seed oil, collagen. It can help improve skin moisture, lock in moisture for a long time, and keep skin soft and smooth. Its application method is simple: 1. Thoroughly clean and dry the skin; 2. Apply appropriate amount of the product evenly on the neck, legs, abdomen, arms and other parts of the body; 3. Massage gently to promote better absorption. Gently moisturizes the skin, suitable for daily use all over the body. URL: h"}, {"type": "product", "id": 7890228379711, "title": "OceAura Shea Butter Moisturizer Daily Nourishes And Moisturizes Skin With Gentle Ingredients That Easily Absorb Body Lotion", "handle": "oceaura-shea-butter-moisturizer-daily-nourishes-and-moisturizes-skin-with-gentle-ingredients-that-easily-absorb-body-lotion", "tags": "skincare", "url": "https://shop.aloha.id.vn/products/oceaura-shea-butter-moisturizer-daily-nourishes-and-moisturizes-skin-with-gentle-ingredients-that-easily-absorb-body-lotion", "price": "23.86", "product_type": "", "vendor": "eprolo", "status": "active", "sku": "OC-A06-0265-01", "variant": "default title", "image": "https://cdn.shopify.com/s/files/1/0623/5340/8063/files/571A0C16AB4FD348F29359F5D277711A.jpg?v=1757156632", "inventory_quantity": 80, "available": true, "text": "ttps://shop.aloha.id.vn/products/oceaura-shea-butter-moisturizer-daily-nourishes-and-moisturizes-skin-with-gentle-ingredients-that-easily-absorb-body-lotion"}, {"type": "product", "id": 7890232606783, "title": "OceAura Tallow Honey Moisturizer, Hydrates And Moisturizes Smooth Skin And Facial Dry Care Nourishing Cream", "handle": "oceaura-tallow-honey-moisturizer-hydrates-and-moisturizes-smooth-skin-and-facial-dry-care-nourishing-cream", "tags": "skincare", "url": "https://shop.aloha.id.vn/products/oceaura-tallow-honey-moisturizer-hydrates-and-moisturizes-smooth-skin-and-facial-dry-care-nourishing-cream", "price": "24.12", "product_type": "", "vendor": "eprolo", "status": "active", "sku": "OC-A05-0017-01", "variant": "default title", "image": "https://cdn.shopify.com/s/files/1/0623/5340/8063/files/786AFE970234EDC98A729F8A292338CC.jpg?v=1757158073", "inventory_quantity": 356, "available": true, "text": "Product: OceAura Tallow Honey Moisturizer, Hydrates And Moisturizes Smooth Skin And Facial Dry Care Nourishing Cream Type: Vendor: eprolo Tags: skincare Options: {\"color\": [\"default title\"]} Variant: default title SKU: OC-A05-0017-01 Price: 24.12 Inventory: 356 Available: True Status: active Body: Our tallow honey moisturizer contains glycerin, mineral oil. It keeps moisturizing and leaves skin smooth and delicate. Mild ingredients enhance the use experience. Its use method is very simple: gently massage until completely absorbed, apply appropriate amount of this product evenly on the face and body, gently massage until completely absorbed. And can be suitable for a variety of skin types, worry-free use. Suitable for daily skin care options to meet daily needs. URL: https://shop.aloha.id.v"}, {"type": "product", "id": 7890232606783, "title": "OceAura Tallow Honey Moisturizer, Hydrates And Moisturizes Smooth Skin And Facial Dry Care Nourishing Cream", "handle": "oceaura-tallow-honey-moisturizer-hydrates-and-moisturizes-smooth-skin-and-facial-dry-care-nourishing-cream", "tags": "skincare", "url": "https://shop.aloha.id.vn/products/oceaura-tallow-honey-moisturizer-hydrates-and-moisturizes-smooth-skin-and-facial-dry-care-nourishing-cream", "price": "24.12", "product_type": "", "vendor": "eprolo", "status": "active", "sku": "OC-A05-0017-01", "variant": "default title", "image": "https://cdn.shopify.com/s/files/1/0623/5340/8063/files/786AFE970234EDC98A729F8A292338CC.jpg?v=1757158073", "inventory_quantity": 356, "available": true, "text": "n/products/oceaura-tallow-honey-moisturizer-hydrates-and-moisturizes-smooth-skin-and-facial-dry-care-nourishing-cream"}, {"type": "product", "id": 7889465770047, "title": "OUHOE Copper Peptide Repair Serum Hydrates, Hydrates, Firming And Firming Facial Skin With Blue Copper Peptide Serum", "handle": "ouhoe-copper-peptide-repair-serum-hydrates-hydrates-firming-and-firming-facial-skin-with-blue-copper-peptide-serum", "tags": "skincare", "url": "https://shop.aloha.id.vn/products/ouhoe-copper-peptide-repair-serum-hydrates-hydrates-firming-and-firming-facial-skin-with-blue-copper-peptide-serum", "price": "24.10", "product_type": "", "vendor": "eprolo", "status": "active", "sku": "OU-A05-0368-01", "variant": "default title", "image": "https://cdn.shopify.com/s/files/1/0623/5340/8063/files/3C4321CF59DF5D83B2CC8D0CB5B5F8DC.jpg?v=1757040005", "inventory_quantity": 574, "available": true, "text": "Product: OUHOE Copper Peptide Repair Serum Hydrates, Hydrates, Firming And Firming Facial Skin With Blue Copper Peptide Serum Type: Vendor: eprolo Tags: skincare Options: {\"color\": [\"default title\"]} Variant: default title SKU: OU-A05-0368-01 Price: 24.10 Inventory: 574 Available: True Status: active Body: Our Copper Peptide Repair serum contains tripeptide-1 copper, hyaluronic acid, collagen. It locks in moisture and keeps you hydrated. Enhance skin elasticity, make skin firm and smooth. Its use is very simple: 1. After cleaning and toning; 2. Apply proper amount of serum evenly on the face; 3. Massage in a circular motion until absorbed. Effectively repair damaged skin, strengthen protection. URL: https://shop.aloha.id.vn/products/ouhoe-copper-peptide-repair-serum-hydrates-hydrates-firmi"}, {"type": "product", "id": 7889465770047, "title": "OUHOE Copper Peptide Repair Serum Hydrates, Hydrates, Firming And Firming Facial Skin With Blue Copper Peptide Serum", "handle": "ouhoe-copper-peptide-repair-serum-hydrates-hydrates-firming-and-firming-facial-skin-with-blue-copper-peptide-serum", "tags": "skincare", "url": "https://shop.aloha.id.vn/products/ouhoe-copper-peptide-repair-serum-hydrates-hydrates-firming-and-firming-facial-skin-with-blue-copper-peptide-serum", "price": "24.10", "product_type": "", "vendor": "eprolo", "status": "active", "sku": "OU-A05-0368-01", "variant": "default title", "image": "https://cdn.shopify.com/s/files/1/0623/5340/8063/files/3C4321CF59DF5D83B2CC8D0CB5B5F8DC.jpg?v=1757040005", "inventory_quantity": 574, "available": true, "text": "ng-and-firming-facial-skin-with-blue-copper-peptide-serum"}, {"type": "product", "id": 7890236768319, "title": "OUHOE Facial Skin Care Stick Repair, Tender, Firming, Brightening, Hydrating And Moisturizing Facial Skin Moisturizing And Beauty Stick", "handle": "ouhoe-facial-skin-care-stick-repair-tender-firming-brightening-hydrating-and-moisturizing-facial-skin-moisturizing-and-beauty-stick", "tags": "skincare", "url": "https://shop.aloha.id.vn/products/ouhoe-facial-skin-care-stick-repair-tender-firming-brightening-hydrating-and-moisturizing-facial-skin-moisturizing-and-beauty-stick", "price": "24.12", "product_type": "", "vendor": "eprolo", "status": "active", "sku": "OUA05-A189-30-WH1", "variant": "default title", "image": "https://cdn.shopify.com/s/files/1/0623/5340/8063/files/AFCDBA36E6941982F449A74814C88DC4.jpg?v=1757160134", "inventory_quantity": 194, "available": true, "text": "Product: OUHOE Facial Skin Care Stick Repair, Tender, Firming, Brightening, Hydrating And Moisturizing Facial Skin Moisturizing And Beauty Stick Type: Vendor: eprolo Tags: skincare Options: {\"color\": [\"default title\"]} Variant: default title SKU: OUA05-A189-30-WH1 Price: 24.12 Inventory: 194 Available: True Status: active Body: Our facial skincare bars contain retinol, ascorbic acid (vitamin C), and niacinamide. It can lighten melanin, reduce dark spots, and help even out skin tone. Use aloe vera extract to soothe the skin and make you more comfortable. The way to use it is simple: 1. Clean your face and keep it dry; 2. Apply appropriate amount of the product evenly on the face; 3. Gently massage until fully absorbed. It locks in moisture and makes you look younger. Long-lasting moisturize"}, {"type": "product", "id": 7890236768319, "title": "OUHOE Facial Skin Care Stick Repair, Tender, Firming, Brightening, Hydrating And Moisturizing Facial Skin Moisturizing And Beauty Stick", "handle": "ouhoe-facial-skin-care-stick-repair-tender-firming-brightening-hydrating-and-moisturizing-facial-skin-moisturizing-and-beauty-stick", "tags": "skincare", "url": "https://shop.aloha.id.vn/products/ouhoe-facial-skin-care-stick-repair-tender-firming-brightening-hydrating-and-moisturizing-facial-skin-moisturizing-and-beauty-stick", "price": "24.12", "product_type": "", "vendor": "eprolo", "status": "active", "sku": "OUA05-A189-30-WH1", "variant": "default title", "image": "https://cdn.shopify.com/s/files/1/0623/5340/8063/files/AFCDBA36E6941982F449A74814C88DC4.jpg?v=1757160134", "inventory_quantity": 194, "available": true, "text": "r keeps skin hydrated. URL: https://shop.aloha.id.vn/products/ouhoe-facial-skin-care-stick-repair-tender-firming-brightening-hydrating-and-moisturizing-facial-skin-moisturizing-and-beauty-stick"}, {"type": "product", "id": 7890249154623, "title": "Pet Toothbrush For Dogs, Pet Oral Cleaning Dental Stains Dental Health Care", "handle": "pet-toothbrush-for-dogs-pet-oral-cleaning-dental-stains-dental-health-care", "tags": "dog", "url": "https://shop.aloha.id.vn/products/pet-toothbrush-for-dogs-pet-oral-cleaning-dental-stains-dental-health-care", "price": "22.78", "product_type": "", "vendor": "eprolo", "status": "active", "sku": "YEF01-A029-1-VT1", "variant": "default title", "image": "https://cdn.shopify.com/s/files/1/0623/5340/8063/files/6503CCC65FF08084C6AEBCC145224F3E.jpg?v=1757165368", "inventory_quantity": 269, "available": true, "text": "Product: Pet Toothbrush For Dogs, Pet Oral Cleaning Dental Stains Dental Health Care Type: Vendor: eprolo Tags: dog Options: {\"color\": [\"default title\"]} Variant: default title SKU: YEF01-A029-1-VT1 Price: 22.78 Inventory: 269 Available: True Status: active Body: Our pet tongue brush toothbrush set contains silicone. It can be soft and comfortable, gently scrape the substance on the surface of the tongue coating, and keep the pet's mouth fresh and odorless. No gum damage, clean teeth. The method of its use is very simple: 1. Fix the pet's head and open its mouth. 2. Start by gently brushing your teeth with a toothbrush for 30 seconds. 3. Then gently brush your pet's tongue with a tongue brush. Dense silica bristles have a powerful cleaning power to ensure that no stains remain on tooth sur"}, {"type": "product", "id": 7890249154623, "title": "Pet Toothbrush For Dogs, Pet Oral Cleaning Dental Stains Dental Health Care", "handle": "pet-toothbrush-for-dogs-pet-oral-cleaning-dental-stains-dental-health-care", "tags": "dog", "url": "https://shop.aloha.id.vn/products/pet-toothbrush-for-dogs-pet-oral-cleaning-dental-stains-dental-health-care", "price": "22.78", "product_type": "", "vendor": "eprolo", "status": "active", "sku": "YEF01-A029-1-VT1", "variant": "default title", "image": "https://cdn.shopify.com/s/files/1/0623/5340/8063/files/6503CCC65FF08084C6AEBCC145224F3E.jpg?v=1757165368", "inventory_quantity": 269, "available": true, "text": "faces and gaps. URL: https://shop.aloha.id.vn/products/pet-toothbrush-for-dogs-pet-oral-cleaning-dental-stains-dental-health-care"}, {"type": "product", "id": 7889136910399, "title": "Plant based essential oil for moisturizing skincare soothing deodorizing and refreshing aromatherapy 10ML", "handle": "plant-based-essential-oil-for-moisturizing-skincare-soothing-deodorizing-and-refreshing-aromatherapy-10ml", "tags": "skincare", "url": "https://shop.aloha.id.vn/products/plant-based-essential-oil-for-moisturizing-skincare-soothing-deodorizing-and-refreshing-aromatherapy-10ml", "price": "13.80", "product_type": "", "vendor": "eprolo", "status": "active", "sku": "AC7444E653044A8DA87209ACB61A7987", "variant": "Sweet Orange", "image": "https://cdn.shopify.com/s/files/1/0623/5340/8063/files/A0B08EBAEDAD716F7C73837F72B58ECB.png?v=1757002242", "inventory_quantity": 553, "available": true, "text": "Product: Plant based essential oil for moisturizing skincare soothing deodorizing and refreshing aromatherapy 10ML Type: Vendor: eprolo Tags: skincare Options: {\"aroma\": [\"Sweet Orange\", \"Lavender\", \"tea plant\", \"Mint\", \"Eucalyptus\", \"Lemon lemongrass\", \"rose\", \"rosemary\", \"lemon\", \"Grapefruit\", \"cedar\", \"cinnamon\", \"Silk Cypress\", \"myrrh\", \"Patchouli\", \"frankincense\", \"Bergamot\", \"chamomile\", \"Geranium\", \"Yanlan Grass\", \"Sage\", \"ginger\", \"clove\", \"thyme\", \"sandalwood\", \"Jasmine\", \"vanilla\", \"Yilan\", \"sweet basil\", \"Red Orange\", \"black pepper\", \"Lemongrass\", \"fennel\", \"Cajeput\", \"Juniper berry\", \"1 set of 35 bottles (1 bottle each)\"]} Variant: Sweet Orange SKU: AC7444E653044A8DA87209ACB61A7987 Price: 13.80 Inventory: 553 Available: True Status: active Body: Effect: Soothing the mind Net co"}, {"type": "product", "id": 7889136910399, "title": "Plant based essential oil for moisturizing skincare soothing deodorizing and refreshing aromatherapy 10ML", "handle": "plant-based-essential-oil-for-moisturizing-skincare-soothing-deodorizing-and-refreshing-aromatherapy-10ml", "tags": "skincare", "url": "https://shop.aloha.id.vn/products/plant-based-essential-oil-for-moisturizing-skincare-soothing-deodorizing-and-refreshing-aromatherapy-10ml", "price": "13.80", "product_type": "", "vendor": "eprolo", "status": "active", "sku": "AC7444E653044A8DA87209ACB61A7987", "variant": "Sweet Orange", "image": "https://cdn.shopify.com/s/files/1/0623/5340/8063/files/A0B08EBAEDAD716F7C73837F72B58ECB.png?v=1757002242", "inventory_quantity": 553, "available": true, "text": "ntent: 10ml URL: https://shop.aloha.id.vn/products/plant-based-essential-oil-for-moisturizing-skincare-soothing-deodorizing-and-refreshing-aromatherapy-10ml"}, {"type": "product", "id": 7889136910399, "title": "Plant based essential oil for moisturizing skincare soothing deodorizing and refreshing aromatherapy 10ML", "handle": "plant-based-essential-oil-for-moisturizing-skincare-soothing-deodorizing-and-refreshing-aromatherapy-10ml", "tags": "skincare", "url": "https://shop.aloha.id.vn/products/plant-based-essential-oil-for-moisturizing-skincare-soothing-deodorizing-and-refreshing-aromatherapy-10ml", "price": "16.44", "product_type": "", "vendor": "eprolo", "status": "active", "sku": "40852207FE6D40BFBA247BAC3AFF2958", "variant": "Lavender", "image": "https://cdn.shopify.com/s/files/1/0623/5340/8063/files/A0B08EBAEDAD716F7C73837F72B58ECB.png?v=1757002242", "inventory_quantity": 551, "available": true, "text": "Product: Plant based essential oil for moisturizing skincare soothing deodorizing and refreshing aromatherapy 10ML Type: Vendor: eprolo Tags: skincare Options: {\"aroma\": [\"Sweet Orange\", \"Lavender\", \"tea plant\", \"Mint\", \"Eucalyptus\", \"Lemon lemongrass\", \"rose\", \"rosemary\", \"lemon\", \"Grapefruit\", \"cedar\", \"cinnamon\", \"Silk Cypress\", \"myrrh\", \"Patchouli\", \"frankincense\", \"Bergamot\", \"chamomile\", \"Geranium\", \"Yanlan Grass\", \"Sage\", \"ginger\", \"clove\", \"thyme\", \"sandalwood\", \"Jasmine\", \"vanilla\", \"Yilan\", \"sweet basil\", \"Red Orange\", \"black pepper\", \"Lemongrass\", \"fennel\", \"Cajeput\", \"Juniper berry\", \"1 set of 35 bottles (1 bottle each)\"]} Variant: Lavender SKU: 40852207FE6D40BFBA247BAC3AFF2958 Price: 16.44 Inventory: 551 Available: True Status: active Body: Effect: Soothing the mind Net conten"}, {"type": "product", "id": 7889136910399, "title": "Plant based essential oil for moisturizing skincare soothing deodorizing and refreshing aromatherapy 10ML", "handle": "plant-based-essential-oil-for-moisturizing-skincare-soothing-deodorizing-and-refreshing-aromatherapy-10ml", "tags": "skincare", "url": "https://shop.aloha.id.vn/products/plant-based-essential-oil-for-moisturizing-skincare-soothing-deodorizing-and-refreshing-aromatherapy-10ml", "price": "16.44", "product_type": "", "vendor": "eprolo", "status": "active", "sku": "40852207FE6D40BFBA247BAC3AFF2958", "variant": "Lavender", "image": "https://cdn.shopify.com/s/files/1/0623/5340/8063/files/A0B08EBAEDAD716F7C73837F72B58ECB.png?v=1757002242", "inventory_quantity": 551, "available": true, "text": "t: 10ml URL: https://shop.aloha.id.vn/products/plant-based-essential-oil-for-moisturizing-skincare-soothing-deodorizing-and-refreshing-aromatherapy-10ml"}, {"type": "product", "id": 7889136910399, "title": "Plant based essential oil for moisturizing skincare soothing deodorizing and refreshing aromatherapy 10ML", "handle": "plant-based-essential-oil-for-moisturizing-skincare-soothing-deodorizing-and-refreshing-aromatherapy-10ml", "tags": "skincare", "url": "https://shop.aloha.id.vn/products/plant-based-essential-oil-for-moisturizing-skincare-soothing-deodorizing-and-refreshing-aromatherapy-10ml", "price": "14.46", "product_type": "", "vendor": "eprolo", "status": "active", "sku": "FB40B44714E944E1BDFDA098FC802668", "variant": "tea plant", "image": "https://cdn.shopify.com/s/files/1/0623/5340/8063/files/A0B08EBAEDAD716F7C73837F72B58ECB.png?v=1757002242", "inventory_quantity": 441, "available": true, "text": "Product: Plant based essential oil for moisturizing skincare soothing deodorizing and refreshing aromatherapy 10ML Type: Vendor: eprolo Tags: skincare Options: {\"aroma\": [\"Sweet Orange\", \"Lavender\", \"tea plant\", \"Mint\", \"Eucalyptus\", \"Lemon lemongrass\", \"rose\", \"rosemary\", \"lemon\", \"Grapefruit\", \"cedar\", \"cinnamon\", \"Silk Cypress\", \"myrrh\", \"Patchouli\", \"frankincense\", \"Bergamot\", \"chamomile\", \"Geranium\", \"Yanlan Grass\", \"Sage\", \"ginger\", \"clove\", \"thyme\", \"sandalwood\", \"Jasmine\", \"vanilla\", \"Yilan\", \"sweet basil\", \"Red Orange\", \"black pepper\", \"Lemongrass\", \"fennel\", \"Cajeput\", \"Juniper berry\", \"1 set of 35 bottles (1 bottle each)\"]} Variant: tea plant SKU: FB40B44714E944E1BDFDA098FC802668 Price: 14.46 Inventory: 441 Available: True Status: active Body: Effect: Soothing the mind Net conte"}, {"type": "product", "id": 7889136910399, "title": "Plant based essential oil for moisturizing skincare soothing deodorizing and refreshing aromatherapy 10ML", "handle": "plant-based-essential-oil-for-moisturizing-skincare-soothing-deodorizing-and-refreshing-aromatherapy-10ml", "tags": "skincare", "url": "https://shop.aloha.id.vn/products/plant-based-essential-oil-for-moisturizing-skincare-soothing-deodorizing-and-refreshing-aromatherapy-10ml", "price": "14.46", "product_type": "", "vendor": "eprolo", "status": "active", "sku": "FB40B44714E944E1BDFDA098FC802668", "variant": "tea plant", "image": "https://cdn.shopify.com/s/files/1/0623/5340/8063/files/A0B08EBAEDAD716F7C73837F72B58ECB.png?v=1757002242", "inventory_quantity": 441, "available": true, "text": "nt: 10ml URL: https://shop.aloha.id.vn/products/plant-based-essential-oil-for-moisturizing-skincare-soothing-deodorizing-and-refreshing-aromatherapy-10ml"}, {"type": "product", "id": 7889136910399, "title": "Plant based essential oil for moisturizing skincare soothing deodorizing and refreshing aromatherapy 10ML", "handle": "plant-based-essential-oil-for-moisturizing-skincare-soothing-deodorizing-and-refreshing-aromatherapy-10ml", "tags": "skincare", "url": "https://shop.aloha.id.vn/products/plant-based-essential-oil-for-moisturizing-skincare-soothing-deodorizing-and-refreshing-aromatherapy-10ml", "price": "13.80", "product_type": "", "vendor": "eprolo", "status": "active", "sku": "D7D1F075EE044BBBA188E5B09BC57DF1", "variant": "Mint", "image": "https://cdn.shopify.com/s/files/1/0623/5340/8063/files/A0B08EBAEDAD716F7C73837F72B58ECB.png?v=1757002242", "inventory_quantity": 606, "available": true, "text": "Product: Plant based essential oil for moisturizing skincare soothing deodorizing and refreshing aromatherapy 10ML Type: Vendor: eprolo Tags: skincare Options: {\"aroma\": [\"Sweet Orange\", \"Lavender\", \"tea plant\", \"Mint\", \"Eucalyptus\", \"Lemon lemongrass\", \"rose\", \"rosemary\", \"lemon\", \"Grapefruit\", \"cedar\", \"cinnamon\", \"Silk Cypress\", \"myrrh\", \"Patchouli\", \"frankincense\", \"Bergamot\", \"chamomile\", \"Geranium\", \"Yanlan Grass\", \"Sage\", \"ginger\", \"clove\", \"thyme\", \"sandalwood\", \"Jasmine\", \"vanilla\", \"Yilan\", \"sweet basil\", \"Red Orange\", \"black pepper\", \"Lemongrass\", \"fennel\", \"Cajeput\", \"Juniper berry\", \"1 set of 35 bottles (1 bottle each)\"]} Variant: Mint SKU: D7D1F075EE044BBBA188E5B09BC57DF1 Price: 13.80 Inventory: 606 Available: True Status: active Body: Effect: Soothing the mind Net content: 1"}, {"type": "product", "id": 7889136910399, "title": "Plant based essential oil for moisturizing skincare soothing deodorizing and refreshing aromatherapy 10ML", "handle": "plant-based-essential-oil-for-moisturizing-skincare-soothing-deodorizing-and-refreshing-aromatherapy-10ml", "tags": "skincare", "url": "https://shop.aloha.id.vn/products/plant-based-essential-oil-for-moisturizing-skincare-soothing-deodorizing-and-refreshing-aromatherapy-10ml", "price": "13.80", "product_type": "", "vendor": "eprolo", "status": "active", "sku": "D7D1F075EE044BBBA188E5B09BC57DF1", "variant": "Mint", "image": "https://cdn.shopify.com/s/files/1/0623/5340/8063/files/A0B08EBAEDAD716F7C73837F72B58ECB.png?v=1757002242", "inventory_quantity": 606, "available": true, "text": "0ml URL: https://shop.aloha.id.vn/products/plant-based-essential-oil-for-moisturizing-skincare-soothing-deodorizing-and-refreshing-aromatherapy-10ml"}, {"type": "product", "id": 7889136910399, "title": "Plant based essential oil for moisturizing skincare soothing deodorizing and refreshing aromatherapy 10ML", "handle": "plant-based-essential-oil-for-moisturizing-skincare-soothing-deodorizing-and-refreshing-aromatherapy-10ml", "tags": "skincare", "url": "https://shop.aloha.id.vn/products/plant-based-essential-oil-for-moisturizing-skincare-soothing-deodorizing-and-refreshing-aromatherapy-10ml", "price": "13.80", "product_type": "", "vendor": "eprolo", "status": "active", "sku": "132441A99C4642C4ABE35D3A35BF69C8", "variant": "Eucalyptus", "image": "https://cdn.shopify.com/s/files/1/0623/5340/8063/files/A0B08EBAEDAD716F7C73837F72B58ECB.png?v=1757002242", "inventory_quantity": 417, "available": true, "text": "Product: Plant based essential oil for moisturizing skincare soothing deodorizing and refreshing aromatherapy 10ML Type: Vendor: eprolo Tags: skincare Options: {\"aroma\": [\"Sweet Orange\", \"Lavender\", \"tea plant\", \"Mint\", \"Eucalyptus\", \"Lemon lemongrass\", \"rose\", \"rosemary\", \"lemon\", \"Grapefruit\", \"cedar\", \"cinnamon\", \"Silk Cypress\", \"myrrh\", \"Patchouli\", \"frankincense\", \"Bergamot\", \"chamomile\", \"Geranium\", \"Yanlan Grass\", \"Sage\", \"ginger\", \"clove\", \"thyme\", \"sandalwood\", \"Jasmine\", \"vanilla\", \"Yilan\", \"sweet basil\", \"Red Orange\", \"black pepper\", \"Lemongrass\", \"fennel\", \"Cajeput\", \"Juniper berry\", \"1 set of 35 bottles (1 bottle each)\"]} Variant: Eucalyptus SKU: 132441A99C4642C4ABE35D3A35BF69C8 Price: 13.80 Inventory: 417 Available: True Status: active Body: Effect: Soothing the mind Net cont"}, {"type": "product", "id": 7889136910399, "title": "Plant based essential oil for moisturizing skincare soothing deodorizing and refreshing aromatherapy 10ML", "handle": "plant-based-essential-oil-for-moisturizing-skincare-soothing-deodorizing-and-refreshing-aromatherapy-10ml", "tags": "skincare", "url": "https://shop.aloha.id.vn/products/plant-based-essential-oil-for-moisturizing-skincare-soothing-deodorizing-and-refreshing-aromatherapy-10ml", "price": "13.80", "product_type": "", "vendor": "eprolo", "status": "active", "sku": "132441A99C4642C4ABE35D3A35BF69C8", "variant": "Eucalyptus", "image": "https://cdn.shopify.com/s/files/1/0623/5340/8063/files/A0B08EBAEDAD716F7C73837F72B58ECB.png?v=1757002242", "inventory_quantity": 417, "available": true, "text": "ent: 10ml URL: https://shop.aloha.id.vn/products/plant-based-essential-oil-for-moisturizing-skincare-soothing-deodorizing-and-refreshing-aromatherapy-10ml"}, {"type": "product", "id": 7889136910399, "title": "Plant based essential oil for moisturizing skincare soothing deodorizing and refreshing aromatherapy 10ML", "handle": "plant-based-essential-oil-for-moisturizing-skincare-soothing-deodorizing-and-refreshing-aromatherapy-10ml", "tags": "skincare", "url": "https://shop.aloha.id.vn/products/plant-based-essential-oil-for-moisturizing-skincare-soothing-deodorizing-and-refreshing-aromatherapy-10ml", "price": "14.46", "product_type": "", "vendor": "eprolo", "status": "active", "sku": "70908A2B38954D13A00B68BF53B6E77D", "variant": "Lemon lemongrass", "image": "https://cdn.shopify.com/s/files/1/0623/5340/8063/files/A0B08EBAEDAD716F7C73837F72B58ECB.png?v=1757002242", "inventory_quantity": 373, "available": true, "text": "Product: Plant based essential oil for moisturizing skincare soothing deodorizing and refreshing aromatherapy 10ML Type: Vendor: eprolo Tags: skincare Options: {\"aroma\": [\"Sweet Orange\", \"Lavender\", \"tea plant\", \"Mint\", \"Eucalyptus\", \"Lemon lemongrass\", \"rose\", \"rosemary\", \"lemon\", \"Grapefruit\", \"cedar\", \"cinnamon\", \"Silk Cypress\", \"myrrh\", \"Patchouli\", \"frankincense\", \"Bergamot\", \"chamomile\", \"Geranium\", \"Yanlan Grass\", \"Sage\", \"ginger\", \"clove\", \"thyme\", \"sandalwood\", \"Jasmine\", \"vanilla\", \"Yilan\", \"sweet basil\", \"Red Orange\", \"black pepper\", \"Lemongrass\", \"fennel\", \"Cajeput\", \"Juniper berry\", \"1 set of 35 bottles (1 bottle each)\"]} Variant: Lemon lemongrass SKU: 70908A2B38954D13A00B68BF53B6E77D Price: 14.46 Inventory: 373 Available: True Status: active Body: Effect: Soothing the mind Ne"}, {"type": "product", "id": 7889136910399, "title": "Plant based essential oil for moisturizing skincare soothing deodorizing and refreshing aromatherapy 10ML", "handle": "plant-based-essential-oil-for-moisturizing-skincare-soothing-deodorizing-and-refreshing-aromatherapy-10ml", "tags": "skincare", "url": "https://shop.aloha.id.vn/products/plant-based-essential-oil-for-moisturizing-skincare-soothing-deodorizing-and-refreshing-aromatherapy-10ml", "price": "14.46", "product_type": "", "vendor": "eprolo", "status": "active", "sku": "70908A2B38954D13A00B68BF53B6E77D", "variant": "Lemon lemongrass", "image": "https://cdn.shopify.com/s/files/1/0623/5340/8063/files/A0B08EBAEDAD716F7C73837F72B58ECB.png?v=1757002242", "inventory_quantity": 373, "available": true, "text": "t content: 10ml URL: https://shop.aloha.id.vn/products/plant-based-essential-oil-for-moisturizing-skincare-soothing-deodorizing-and-refreshing-aromatherapy-10ml"}, {"type": "product", "id": 7889136910399, "title": "Plant based essential oil for moisturizing skincare soothing deodorizing and refreshing aromatherapy 10ML", "handle": "plant-based-essential-oil-for-moisturizing-skincare-soothing-deodorizing-and-refreshing-aromatherapy-10ml", "tags": "skincare", "url": "https://shop.aloha.id.vn/products/plant-based-essential-oil-for-moisturizing-skincare-soothing-deodorizing-and-refreshing-aromatherapy-10ml", "price": "19.40", "product_type": "", "vendor": "eprolo", "status": "active", "sku": "EA73698C0FF14ED390F628C979A6AB0F", "variant": "rose", "image": "https://cdn.shopify.com/s/files/1/0623/5340/8063/files/A0B08EBAEDAD716F7C73837F72B58ECB.png?v=1757002242", "inventory_quantity": 649, "available": true, "text": "Product: Plant based essential oil for moisturizing skincare soothing deodorizing and refreshing aromatherapy 10ML Type: Vendor: eprolo Tags: skincare Options: {\"aroma\": [\"Sweet Orange\", \"Lavender\", \"tea plant\", \"Mint\", \"Eucalyptus\", \"Lemon lemongrass\", \"rose\", \"rosemary\", \"lemon\", \"Grapefruit\", \"cedar\", \"cinnamon\", \"Silk Cypress\", \"myrrh\", \"Patchouli\", \"frankincense\", \"Bergamot\", \"chamomile\", \"Geranium\", \"Yanlan Grass\", \"Sage\", \"ginger\", \"clove\", \"thyme\", \"sandalwood\", \"Jasmine\", \"vanilla\", \"Yilan\", \"sweet basil\", \"Red Orange\", \"black pepper\", \"Lemongrass\", \"fennel\", \"Cajeput\", \"Juniper berry\", \"1 set of 35 bottles (1 bottle each)\"]} Variant: rose SKU: EA73698C0FF14ED390F628C979A6AB0F Price: 19.40 Inventory: 649 Available: True Status: active Body: Effect: Soothing the mind Net content: 1"}, {"type": "product", "id": 7889136910399, "title": "Plant based essential oil for moisturizing skincare soothing deodorizing and refreshing aromatherapy 10ML", "handle": "plant-based-essential-oil-for-moisturizing-skincare-soothing-deodorizing-and-refreshing-aromatherapy-10ml", "tags": "skincare", "url": "https://shop.aloha.id.vn/products/plant-based-essential-oil-for-moisturizing-skincare-soothing-deodorizing-and-refreshing-aromatherapy-10ml", "price": "15.12", "product_type": "", "vendor": "eprolo", "status": "active", "sku": "73F399984A2642F3BF3042BBAF89E5FA", "variant": "rosemary", "image": "https://cdn.shopify.com/s/files/1/0623/5340/8063/files/A0B08EBAEDAD716F7C73837F72B58ECB.png?v=1757002242", "inventory_quantity": 499, "available": true, "text": "Product: Plant based essential oil for moisturizing skincare soothing deodorizing and refreshing aromatherapy 10ML Type: Vendor: eprolo Tags: skincare Options: {\"aroma\": [\"Sweet Orange\", \"Lavender\", \"tea plant\", \"Mint\", \"Eucalyptus\", \"Lemon lemongrass\", \"rose\", \"rosemary\", \"lemon\", \"Grapefruit\", \"cedar\", \"cinnamon\", \"Silk Cypress\", \"myrrh\", \"Patchouli\", \"frankincense\", \"Bergamot\", \"chamomile\", \"Geranium\", \"Yanlan Grass\", \"Sage\", \"ginger\", \"clove\", \"thyme\", \"sandalwood\", \"Jasmine\", \"vanilla\", \"Yilan\", \"sweet basil\", \"Red Orange\", \"black pepper\", \"Lemongrass\", \"fennel\", \"Cajeput\", \"Juniper berry\", \"1 set of 35 bottles (1 bottle each)\"]} Variant: rosemary SKU: 73F399984A2642F3BF3042BBAF89E5FA Price: 15.12 Inventory: 499 Available: True Status: active Body: Effect: Soothing the mind Net conten"}, {"type": "product", "id": 7889136910399, "title": "Plant based essential oil for moisturizing skincare soothing deodorizing and refreshing aromatherapy 10ML", "handle": "plant-based-essential-oil-for-moisturizing-skincare-soothing-deodorizing-and-refreshing-aromatherapy-10ml", "tags": "skincare", "url": "https://shop.aloha.id.vn/products/plant-based-essential-oil-for-moisturizing-skincare-soothing-deodorizing-and-refreshing-aromatherapy-10ml", "price": "14.12", "product_type": "", "vendor": "eprolo", "status": "active", "sku": "439932AE04F34B09B62136B8A4E0A573", "variant": "lemon", "image": "https://cdn.shopify.com/s/files/1/0623/5340/8063/files/A0B08EBAEDAD716F7C73837F72B58ECB.png?v=1757002242", "inventory_quantity": 422, "available": true, "text": "Product: Plant based essential oil for moisturizing skincare soothing deodorizing and refreshing aromatherapy 10ML Type: Vendor: eprolo Tags: skincare Options: {\"aroma\": [\"Sweet Orange\", \"Lavender\", \"tea plant\", \"Mint\", \"Eucalyptus\", \"Lemon lemongrass\", \"rose\", \"rosemary\", \"lemon\", \"Grapefruit\", \"cedar\", \"cinnamon\", \"Silk Cypress\", \"myrrh\", \"Patchouli\", \"frankincense\", \"Bergamot\", \"chamomile\", \"Geranium\", \"Yanlan Grass\", \"Sage\", \"ginger\", \"clove\", \"thyme\", \"sandalwood\", \"Jasmine\", \"vanilla\", \"Yilan\", \"sweet basil\", \"Red Orange\", \"black pepper\", \"Lemongrass\", \"fennel\", \"Cajeput\", \"Juniper berry\", \"1 set of 35 bottles (1 bottle each)\"]} Variant: lemon SKU: 439932AE04F34B09B62136B8A4E0A573 Price: 14.12 Inventory: 422 Available: True Status: active Body: Effect: Soothing the mind Net content: "}, {"type": "product", "id": 7889136910399, "title": "Plant based essential oil for moisturizing skincare soothing deodorizing and refreshing aromatherapy 10ML", "handle": "plant-based-essential-oil-for-moisturizing-skincare-soothing-deodorizing-and-refreshing-aromatherapy-10ml", "tags": "skincare", "url": "https://shop.aloha.id.vn/products/plant-based-essential-oil-for-moisturizing-skincare-soothing-deodorizing-and-refreshing-aromatherapy-10ml", "price": "14.12", "product_type": "", "vendor": "eprolo", "status": "active", "sku": "439932AE04F34B09B62136B8A4E0A573", "variant": "lemon", "image": "https://cdn.shopify.com/s/files/1/0623/5340/8063/files/A0B08EBAEDAD716F7C73837F72B58ECB.png?v=1757002242", "inventory_quantity": 422, "available": true, "text": "10ml URL: https://shop.aloha.id.vn/products/plant-based-essential-oil-for-moisturizing-skincare-soothing-deodorizing-and-refreshing-aromatherapy-10ml"}, {"type": "product", "id": 7889136910399, "title": "Plant based essential oil for moisturizing skincare soothing deodorizing and refreshing aromatherapy 10ML", "handle": "plant-based-essential-oil-for-moisturizing-skincare-soothing-deodorizing-and-refreshing-aromatherapy-10ml", "tags": "skincare", "url": "https://shop.aloha.id.vn/products/plant-based-essential-oil-for-moisturizing-skincare-soothing-deodorizing-and-refreshing-aromatherapy-10ml", "price": "14.46", "product_type": "", "vendor": "eprolo", "status": "active", "sku": "88E881029464438BA22B87ECC93B9FD8", "variant": "Grapefruit", "image": "https://cdn.shopify.com/s/files/1/0623/5340/8063/files/A0B08EBAEDAD716F7C73837F72B58ECB.png?v=1757002242", "inventory_quantity": 447, "available": true, "text": "Product: Plant based essential oil for moisturizing skincare soothing deodorizing and refreshing aromatherapy 10ML Type: Vendor: eprolo Tags: skincare Options: {\"aroma\": [\"Sweet Orange\", \"Lavender\", \"tea plant\", \"Mint\", \"Eucalyptus\", \"Lemon lemongrass\", \"rose\", \"rosemary\", \"lemon\", \"Grapefruit\", \"cedar\", \"cinnamon\", \"Silk Cypress\", \"myrrh\", \"Patchouli\", \"frankincense\", \"Bergamot\", \"chamomile\", \"Geranium\", \"Yanlan Grass\", \"Sage\", \"ginger\", \"clove\", \"thyme\", \"sandalwood\", \"Jasmine\", \"vanilla\", \"Yilan\", \"sweet basil\", \"Red Orange\", \"black pepper\", \"Lemongrass\", \"fennel\", \"Cajeput\", \"Juniper berry\", \"1 set of 35 bottles (1 bottle each)\"]} Variant: Grapefruit SKU: 88E881029464438BA22B87ECC93B9FD8 Price: 14.46 Inventory: 447 Available: True Status: active Body: Effect: Soothing the mind Net cont"}, {"type": "product", "id": 7889136910399, "title": "Plant based essential oil for moisturizing skincare soothing deodorizing and refreshing aromatherapy 10ML", "handle": "plant-based-essential-oil-for-moisturizing-skincare-soothing-deodorizing-and-refreshing-aromatherapy-10ml", "tags": "skincare", "url": "https://shop.aloha.id.vn/products/plant-based-essential-oil-for-moisturizing-skincare-soothing-deodorizing-and-refreshing-aromatherapy-10ml", "price": "13.80", "product_type": "", "vendor": "eprolo", "status": "active", "sku": "7E56D5ACB4DB4B1B8AF5936608FED21B", "variant": "cedar", "image": "https://cdn.shopify.com/s/files/1/0623/5340/8063/files/A0B08EBAEDAD716F7C73837F72B58ECB.png?v=1757002242", "inventory_quantity": 638, "available": true, "text": "Product: Plant based essential oil for moisturizing skincare soothing deodorizing and refreshing aromatherapy 10ML Type: Vendor: eprolo Tags: skincare Options: {\"aroma\": [\"Sweet Orange\", \"Lavender\", \"tea plant\", \"Mint\", \"Eucalyptus\", \"Lemon lemongrass\", \"rose\", \"rosemary\", \"lemon\", \"Grapefruit\", \"cedar\", \"cinnamon\", \"Silk Cypress\", \"myrrh\", \"Patchouli\", \"frankincense\", \"Bergamot\", \"chamomile\", \"Geranium\", \"Yanlan Grass\", \"Sage\", \"ginger\", \"clove\", \"thyme\", \"sandalwood\", \"Jasmine\", \"vanilla\", \"Yilan\", \"sweet basil\", \"Red Orange\", \"black pepper\", \"Lemongrass\", \"fennel\", \"Cajeput\", \"Juniper berry\", \"1 set of 35 bottles (1 bottle each)\"]} Variant: cedar SKU: 7E56D5ACB4DB4B1B8AF5936608FED21B Price: 13.80 Inventory: 638 Available: True Status: active Body: Effect: Soothing the mind Net content: "}, {"type": "product", "id": 7889136910399, "title": "Plant based essential oil for moisturizing skincare soothing deodorizing and refreshing aromatherapy 10ML", "handle": "plant-based-essential-oil-for-moisturizing-skincare-soothing-deodorizing-and-refreshing-aromatherapy-10ml", "tags": "skincare", "url": "https://shop.aloha.id.vn/products/plant-based-essential-oil-for-moisturizing-skincare-soothing-deodorizing-and-refreshing-aromatherapy-10ml", "price": "14.46", "product_type": "", "vendor": "eprolo", "status": "active", "sku": "B3C461E6FC3546ADAEF9105B3727B5A3", "variant": "cinnamon", "image": "https://cdn.shopify.com/s/files/1/0623/5340/8063/files/A0B08EBAEDAD716F7C73837F72B58ECB.png?v=1757002242", "inventory_quantity": 668, "available": true, "text": "Product: Plant based essential oil for moisturizing skincare soothing deodorizing and refreshing aromatherapy 10ML Type: Vendor: eprolo Tags: skincare Options: {\"aroma\": [\"Sweet Orange\", \"Lavender\", \"tea plant\", \"Mint\", \"Eucalyptus\", \"Lemon lemongrass\", \"rose\", \"rosemary\", \"lemon\", \"Grapefruit\", \"cedar\", \"cinnamon\", \"Silk Cypress\", \"myrrh\", \"Patchouli\", \"frankincense\", \"Bergamot\", \"chamomile\", \"Geranium\", \"Yanlan Grass\", \"Sage\", \"ginger\", \"clove\", \"thyme\", \"sandalwood\", \"Jasmine\", \"vanilla\", \"Yilan\", \"sweet basil\", \"Red Orange\", \"black pepper\", \"Lemongrass\", \"fennel\", \"Cajeput\", \"Juniper berry\", \"1 set of 35 bottles (1 bottle each)\"]} Variant: cinnamon SKU: B3C461E6FC3546ADAEF9105B3727B5A3 Price: 14.46 Inventory: 668 Available: True Status: active Body: Effect: Soothing the mind Net conten"}, {"type": "product", "id": 7889136910399, "title": "Plant based essential oil for moisturizing skincare soothing deodorizing and refreshing aromatherapy 10ML", "handle": "plant-based-essential-oil-for-moisturizing-skincare-soothing-deodorizing-and-refreshing-aromatherapy-10ml", "tags": "skincare", "url": "https://shop.aloha.id.vn/products/plant-based-essential-oil-for-moisturizing-skincare-soothing-deodorizing-and-refreshing-aromatherapy-10ml", "price": "13.80", "product_type": "", "vendor": "eprolo", "status": "active", "sku": "51D2FE4E6292478380B8FCF00C61A529", "variant": "Silk Cypress", "image": "https://cdn.shopify.com/s/files/1/0623/5340/8063/files/A0B08EBAEDAD716F7C73837F72B58ECB.png?v=1757002242", "inventory_quantity": 529, "available": true, "text": "Product: Plant based essential oil for moisturizing skincare soothing deodorizing and refreshing aromatherapy 10ML Type: Vendor: eprolo Tags: skincare Options: {\"aroma\": [\"Sweet Orange\", \"Lavender\", \"tea plant\", \"Mint\", \"Eucalyptus\", \"Lemon lemongrass\", \"rose\", \"rosemary\", \"lemon\", \"Grapefruit\", \"cedar\", \"cinnamon\", \"Silk Cypress\", \"myrrh\", \"Patchouli\", \"frankincense\", \"Bergamot\", \"chamomile\", \"Geranium\", \"Yanlan Grass\", \"Sage\", \"ginger\", \"clove\", \"thyme\", \"sandalwood\", \"Jasmine\", \"vanilla\", \"Yilan\", \"sweet basil\", \"Red Orange\", \"black pepper\", \"Lemongrass\", \"fennel\", \"Cajeput\", \"Juniper berry\", \"1 set of 35 bottles (1 bottle each)\"]} Variant: Silk Cypress SKU: 51D2FE4E6292478380B8FCF00C61A529 Price: 13.80 Inventory: 529 Available: True Status: active Body: Effect: Soothing the mind Net co"}, {"type": "product", "id": 7889136910399, "title": "Plant based essential oil for moisturizing skincare soothing deodorizing and refreshing aromatherapy 10ML", "handle": "plant-based-essential-oil-for-moisturizing-skincare-soothing-deodorizing-and-refreshing-aromatherapy-10ml", "tags": "skincare", "url": "https://shop.aloha.id.vn/products/plant-based-essential-oil-for-moisturizing-skincare-soothing-deodorizing-and-refreshing-aromatherapy-10ml", "price": "15.12", "product_type": "", "vendor": "eprolo", "status": "active", "sku": "524C33D8BE7143E38E5A70FEFD96F40B", "variant": "myrrh", "image": "https://cdn.shopify.com/s/files/1/0623/5340/8063/files/A0B08EBAEDAD716F7C73837F72B58ECB.png?v=1757002242", "inventory_quantity": 485, "available": true, "text": "Product: Plant based essential oil for moisturizing skincare soothing deodorizing and refreshing aromatherapy 10ML Type: Vendor: eprolo Tags: skincare Options: {\"aroma\": [\"Sweet Orange\", \"Lavender\", \"tea plant\", \"Mint\", \"Eucalyptus\", \"Lemon lemongrass\", \"rose\", \"rosemary\", \"lemon\", \"Grapefruit\", \"cedar\", \"cinnamon\", \"Silk Cypress\", \"myrrh\", \"Patchouli\", \"frankincense\", \"Bergamot\", \"chamomile\", \"Geranium\", \"Yanlan Grass\", \"Sage\", \"ginger\", \"clove\", \"thyme\", \"sandalwood\", \"Jasmine\", \"vanilla\", \"Yilan\", \"sweet basil\", \"Red Orange\", \"black pepper\", \"Lemongrass\", \"fennel\", \"Cajeput\", \"Juniper berry\", \"1 set of 35 bottles (1 bottle each)\"]} Variant: myrrh SKU: 524C33D8BE7143E38E5A70FEFD96F40B Price: 15.12 Inventory: 485 Available: True Status: active Body: Effect: Soothing the mind Net content: "}, {"type": "product", "id": 7889136910399, "title": "Plant based essential oil for moisturizing skincare soothing deodorizing and refreshing aromatherapy 10ML", "handle": "plant-based-essential-oil-for-moisturizing-skincare-soothing-deodorizing-and-refreshing-aromatherapy-10ml", "tags": "skincare", "url": "https://shop.aloha.id.vn/products/plant-based-essential-oil-for-moisturizing-skincare-soothing-deodorizing-and-refreshing-aromatherapy-10ml", "price": "15.12", "product_type": "", "vendor": "eprolo", "status": "active", "sku": "D2E1C298A79345978FCFE788FBAFA889", "variant": "Patchouli", "image": "https://cdn.shopify.com/s/files/1/0623/5340/8063/files/A0B08EBAEDAD716F7C73837F72B58ECB.png?v=1757002242", "inventory_quantity": 604, "available": true, "text": "Product: Plant based essential oil for moisturizing skincare soothing deodorizing and refreshing aromatherapy 10ML Type: Vendor: eprolo Tags: skincare Options: {\"aroma\": [\"Sweet Orange\", \"Lavender\", \"tea plant\", \"Mint\", \"Eucalyptus\", \"Lemon lemongrass\", \"rose\", \"rosemary\", \"lemon\", \"Grapefruit\", \"cedar\", \"cinnamon\", \"Silk Cypress\", \"myrrh\", \"Patchouli\", \"frankincense\", \"Bergamot\", \"chamomile\", \"Geranium\", \"Yanlan Grass\", \"Sage\", \"ginger\", \"clove\", \"thyme\", \"sandalwood\", \"Jasmine\", \"vanilla\", \"Yilan\", \"sweet basil\", \"Red Orange\", \"black pepper\", \"Lemongrass\", \"fennel\", \"Cajeput\", \"Juniper berry\", \"1 set of 35 bottles (1 bottle each)\"]} Variant: Patchouli SKU: D2E1C298A79345978FCFE788FBAFA889 Price: 15.12 Inventory: 604 Available: True Status: active Body: Effect: Soothing the mind Net conte"}, {"type": "product", "id": 7889136910399, "title": "Plant based essential oil for moisturizing skincare soothing deodorizing and refreshing aromatherapy 10ML", "handle": "plant-based-essential-oil-for-moisturizing-skincare-soothing-deodorizing-and-refreshing-aromatherapy-10ml", "tags": "skincare", "url": "https://shop.aloha.id.vn/products/plant-based-essential-oil-for-moisturizing-skincare-soothing-deodorizing-and-refreshing-aromatherapy-10ml", "price": "16.44", "product_type": "", "vendor": "eprolo", "status": "active", "sku": "C2675C79625742A886723B9C41695F9E", "variant": "frankincense", "image": "https://cdn.shopify.com/s/files/1/0623/5340/8063/files/A0B08EBAEDAD716F7C73837F72B58ECB.png?v=1757002242", "inventory_quantity": 337, "available": true, "text": "Product: Plant based essential oil for moisturizing skincare soothing deodorizing and refreshing aromatherapy 10ML Type: Vendor: eprolo Tags: skincare Options: {\"aroma\": [\"Sweet Orange\", \"Lavender\", \"tea plant\", \"Mint\", \"Eucalyptus\", \"Lemon lemongrass\", \"rose\", \"rosemary\", \"lemon\", \"Grapefruit\", \"cedar\", \"cinnamon\", \"Silk Cypress\", \"myrrh\", \"Patchouli\", \"frankincense\", \"Bergamot\", \"chamomile\", \"Geranium\", \"Yanlan Grass\", \"Sage\", \"ginger\", \"clove\", \"thyme\", \"sandalwood\", \"Jasmine\", \"vanilla\", \"Yilan\", \"sweet basil\", \"Red Orange\", \"black pepper\", \"Lemongrass\", \"fennel\", \"Cajeput\", \"Juniper berry\", \"1 set of 35 bottles (1 bottle each)\"]} Variant: frankincense SKU: C2675C79625742A886723B9C41695F9E Price: 16.44 Inventory: 337 Available: True Status: active Body: Effect: Soothing the mind Net co"}, {"type": "product", "id": 7889136910399, "title": "Plant based essential oil for moisturizing skincare soothing deodorizing and refreshing aromatherapy 10ML", "handle": "plant-based-essential-oil-for-moisturizing-skincare-soothing-deodorizing-and-refreshing-aromatherapy-10ml", "tags": "skincare", "url": "https://shop.aloha.id.vn/products/plant-based-essential-oil-for-moisturizing-skincare-soothing-deodorizing-and-refreshing-aromatherapy-10ml", "price": "14.46", "product_type": "", "vendor": "eprolo", "status": "active", "sku": "887F28B47E7F46A58D357642DCCEBE84", "variant": "Bergamot", "image": "https://cdn.shopify.com/s/files/1/0623/5340/8063/files/A0B08EBAEDAD716F7C73837F72B58ECB.png?v=1757002242", "inventory_quantity": 502, "available": true, "text": "Product: Plant based essential oil for moisturizing skincare soothing deodorizing and refreshing aromatherapy 10ML Type: Vendor: eprolo Tags: skincare Options: {\"aroma\": [\"Sweet Orange\", \"Lavender\", \"tea plant\", \"Mint\", \"Eucalyptus\", \"Lemon lemongrass\", \"rose\", \"rosemary\", \"lemon\", \"Grapefruit\", \"cedar\", \"cinnamon\", \"Silk Cypress\", \"myrrh\", \"Patchouli\", \"frankincense\", \"Bergamot\", \"chamomile\", \"Geranium\", \"Yanlan Grass\", \"Sage\", \"ginger\", \"clove\", \"thyme\", \"sandalwood\", \"Jasmine\", \"vanilla\", \"Yilan\", \"sweet basil\", \"Red Orange\", \"black pepper\", \"Lemongrass\", \"fennel\", \"Cajeput\", \"Juniper berry\", \"1 set of 35 bottles (1 bottle each)\"]} Variant: Bergamot SKU: 887F28B47E7F46A58D357642DCCEBE84 Price: 14.46 Inventory: 502 Available: True Status: active Body: Effect: Soothing the mind Net conten"}, {"type": "product", "id": 7889136910399, "title": "Plant based essential oil for moisturizing skincare soothing deodorizing and refreshing aromatherapy 10ML", "handle": "plant-based-essential-oil-for-moisturizing-skincare-soothing-deodorizing-and-refreshing-aromatherapy-10ml", "tags": "skincare", "url": "https://shop.aloha.id.vn/products/plant-based-essential-oil-for-moisturizing-skincare-soothing-deodorizing-and-refreshing-aromatherapy-10ml", "price": "15.12", "product_type": "", "vendor": "eprolo", "status": "active", "sku": "16BC6638199943DD93C6D6DB390F3E98", "variant": "chamomile", "image": "https://cdn.shopify.com/s/files/1/0623/5340/8063/files/A0B08EBAEDAD716F7C73837F72B58ECB.png?v=1757002242", "inventory_quantity": 369, "available": true, "text": "Product: Plant based essential oil for moisturizing skincare soothing deodorizing and refreshing aromatherapy 10ML Type: Vendor: eprolo Tags: skincare Options: {\"aroma\": [\"Sweet Orange\", \"Lavender\", \"tea plant\", \"Mint\", \"Eucalyptus\", \"Lemon lemongrass\", \"rose\", \"rosemary\", \"lemon\", \"Grapefruit\", \"cedar\", \"cinnamon\", \"Silk Cypress\", \"myrrh\", \"Patchouli\", \"frankincense\", \"Bergamot\", \"chamomile\", \"Geranium\", \"Yanlan Grass\", \"Sage\", \"ginger\", \"clove\", \"thyme\", \"sandalwood\", \"Jasmine\", \"vanilla\", \"Yilan\", \"sweet basil\", \"Red Orange\", \"black pepper\", \"Lemongrass\", \"fennel\", \"Cajeput\", \"Juniper berry\", \"1 set of 35 bottles (1 bottle each)\"]} Variant: chamomile SKU: 16BC6638199943DD93C6D6DB390F3E98 Price: 15.12 Inventory: 369 Available: True Status: active Body: Effect: Soothing the mind Net conte"}, {"type": "product", "id": 7889136910399, "title": "Plant based essential oil for moisturizing skincare soothing deodorizing and refreshing aromatherapy 10ML", "handle": "plant-based-essential-oil-for-moisturizing-skincare-soothing-deodorizing-and-refreshing-aromatherapy-10ml", "tags": "skincare", "url": "https://shop.aloha.id.vn/products/plant-based-essential-oil-for-moisturizing-skincare-soothing-deodorizing-and-refreshing-aromatherapy-10ml", "price": "16.44", "product_type": "", "vendor": "eprolo", "status": "active", "sku": "16EE5D4C19D2432E96E733E8DDD212FB", "variant": "Geranium", "image": "https://cdn.shopify.com/s/files/1/0623/5340/8063/files/A0B08EBAEDAD716F7C73837F72B58ECB.png?v=1757002242", "inventory_quantity": 777, "available": true, "text": "Product: Plant based essential oil for moisturizing skincare soothing deodorizing and refreshing aromatherapy 10ML Type: Vendor: eprolo Tags: skincare Options: {\"aroma\": [\"Sweet Orange\", \"Lavender\", \"tea plant\", \"Mint\", \"Eucalyptus\", \"Lemon lemongrass\", \"rose\", \"rosemary\", \"lemon\", \"Grapefruit\", \"cedar\", \"cinnamon\", \"Silk Cypress\", \"myrrh\", \"Patchouli\", \"frankincense\", \"Bergamot\", \"chamomile\", \"Geranium\", \"Yanlan Grass\", \"Sage\", \"ginger\", \"clove\", \"thyme\", \"sandalwood\", \"Jasmine\", \"vanilla\", \"Yilan\", \"sweet basil\", \"Red Orange\", \"black pepper\", \"Lemongrass\", \"fennel\", \"Cajeput\", \"Juniper berry\", \"1 set of 35 bottles (1 bottle each)\"]} Variant: Geranium SKU: 16EE5D4C19D2432E96E733E8DDD212FB Price: 16.44 Inventory: 777 Available: True Status: active Body: Effect: Soothing the mind Net conten"}, {"type": "product", "id": 7889136910399, "title": "Plant based essential oil for moisturizing skincare soothing deodorizing and refreshing aromatherapy 10ML", "handle": "plant-based-essential-oil-for-moisturizing-skincare-soothing-deodorizing-and-refreshing-aromatherapy-10ml", "tags": "skincare", "url": "https://shop.aloha.id.vn/products/plant-based-essential-oil-for-moisturizing-skincare-soothing-deodorizing-and-refreshing-aromatherapy-10ml", "price": "14.46", "product_type": "", "vendor": "eprolo", "status": "active", "sku": "15D79CF0E63947A28950415CDF84AC95", "variant": "Yanlan Grass", "image": "https://cdn.shopify.com/s/files/1/0623/5340/8063/files/A0B08EBAEDAD716F7C73837F72B58ECB.png?v=1757002242", "inventory_quantity": 304, "available": true, "text": "Product: Plant based essential oil for moisturizing skincare soothing deodorizing and refreshing aromatherapy 10ML Type: Vendor: eprolo Tags: skincare Options: {\"aroma\": [\"Sweet Orange\", \"Lavender\", \"tea plant\", \"Mint\", \"Eucalyptus\", \"Lemon lemongrass\", \"rose\", \"rosemary\", \"lemon\", \"Grapefruit\", \"cedar\", \"cinnamon\", \"Silk Cypress\", \"myrrh\", \"Patchouli\", \"frankincense\", \"Bergamot\", \"chamomile\", \"Geranium\", \"Yanlan Grass\", \"Sage\", \"ginger\", \"clove\", \"thyme\", \"sandalwood\", \"Jasmine\", \"vanilla\", \"Yilan\", \"sweet basil\", \"Red Orange\", \"black pepper\", \"Lemongrass\", \"fennel\", \"Cajeput\", \"Juniper berry\", \"1 set of 35 bottles (1 bottle each)\"]} Variant: Yanlan Grass SKU: 15D79CF0E63947A28950415CDF84AC95 Price: 14.46 Inventory: 304 Available: True Status: active Body: Effect: Soothing the mind Net co"}, {"type": "product", "id": 7889136910399, "title": "Plant based essential oil for moisturizing skincare soothing deodorizing and refreshing aromatherapy 10ML", "handle": "plant-based-essential-oil-for-moisturizing-skincare-soothing-deodorizing-and-refreshing-aromatherapy-10ml", "tags": "skincare", "url": "https://shop.aloha.id.vn/products/plant-based-essential-oil-for-moisturizing-skincare-soothing-deodorizing-and-refreshing-aromatherapy-10ml", "price": "14.46", "product_type": "", "vendor": "eprolo", "status": "active", "sku": "D70012F87C9C4981A7F28FF693B0E37C", "variant": "Sage", "image": "https://cdn.shopify.com/s/files/1/0623/5340/8063/files/A0B08EBAEDAD716F7C73837F72B58ECB.png?v=1757002242", "inventory_quantity": 567, "available": true, "text": "Product: Plant based essential oil for moisturizing skincare soothing deodorizing and refreshing aromatherapy 10ML Type: Vendor: eprolo Tags: skincare Options: {\"aroma\": [\"Sweet Orange\", \"Lavender\", \"tea plant\", \"Mint\", \"Eucalyptus\", \"Lemon lemongrass\", \"rose\", \"rosemary\", \"lemon\", \"Grapefruit\", \"cedar\", \"cinnamon\", \"Silk Cypress\", \"myrrh\", \"Patchouli\", \"frankincense\", \"Bergamot\", \"chamomile\", \"Geranium\", \"Yanlan Grass\", \"Sage\", \"ginger\", \"clove\", \"thyme\", \"sandalwood\", \"Jasmine\", \"vanilla\", \"Yilan\", \"sweet basil\", \"Red Orange\", \"black pepper\", \"Lemongrass\", \"fennel\", \"Cajeput\", \"Juniper berry\", \"1 set of 35 bottles (1 bottle each)\"]} Variant: Sage SKU: D70012F87C9C4981A7F28FF693B0E37C Price: 14.46 Inventory: 567 Available: True Status: active Body: Effect: Soothing the mind Net content: 1"}, {"type": "product", "id": 7889136910399, "title": "Plant based essential oil for moisturizing skincare soothing deodorizing and refreshing aromatherapy 10ML", "handle": "plant-based-essential-oil-for-moisturizing-skincare-soothing-deodorizing-and-refreshing-aromatherapy-10ml", "tags": "skincare", "url": "https://shop.aloha.id.vn/products/plant-based-essential-oil-for-moisturizing-skincare-soothing-deodorizing-and-refreshing-aromatherapy-10ml", "price": "15.12", "product_type": "", "vendor": "eprolo", "status": "active", "sku": "D2779FD35C344314A131D9FFE5CEF556", "variant": "ginger", "image": "https://cdn.shopify.com/s/files/1/0623/5340/8063/files/A0B08EBAEDAD716F7C73837F72B58ECB.png?v=1757002242", "inventory_quantity": 496, "available": true, "text": "Product: Plant based essential oil for moisturizing skincare soothing deodorizing and refreshing aromatherapy 10ML Type: Vendor: eprolo Tags: skincare Options: {\"aroma\": [\"Sweet Orange\", \"Lavender\", \"tea plant\", \"Mint\", \"Eucalyptus\", \"Lemon lemongrass\", \"rose\", \"rosemary\", \"lemon\", \"Grapefruit\", \"cedar\", \"cinnamon\", \"Silk Cypress\", \"myrrh\", \"Patchouli\", \"frankincense\", \"Bergamot\", \"chamomile\", \"Geranium\", \"Yanlan Grass\", \"Sage\", \"ginger\", \"clove\", \"thyme\", \"sandalwood\", \"Jasmine\", \"vanilla\", \"Yilan\", \"sweet basil\", \"Red Orange\", \"black pepper\", \"Lemongrass\", \"fennel\", \"Cajeput\", \"Juniper berry\", \"1 set of 35 bottles (1 bottle each)\"]} Variant: ginger SKU: D2779FD35C344314A131D9FFE5CEF556 Price: 15.12 Inventory: 496 Available: True Status: active Body: Effect: Soothing the mind Net content:"}, {"type": "product", "id": 7889136910399, "title": "Plant based essential oil for moisturizing skincare soothing deodorizing and refreshing aromatherapy 10ML", "handle": "plant-based-essential-oil-for-moisturizing-skincare-soothing-deodorizing-and-refreshing-aromatherapy-10ml", "tags": "skincare", "url": "https://shop.aloha.id.vn/products/plant-based-essential-oil-for-moisturizing-skincare-soothing-deodorizing-and-refreshing-aromatherapy-10ml", "price": "15.12", "product_type": "", "vendor": "eprolo", "status": "active", "sku": "D2779FD35C344314A131D9FFE5CEF556", "variant": "ginger", "image": "https://cdn.shopify.com/s/files/1/0623/5340/8063/files/A0B08EBAEDAD716F7C73837F72B58ECB.png?v=1757002242", "inventory_quantity": 496, "available": true, "text": " 10ml URL: https://shop.aloha.id.vn/products/plant-based-essential-oil-for-moisturizing-skincare-soothing-deodorizing-and-refreshing-aromatherapy-10ml"}, {"type": "product", "id": 7889136910399, "title": "Plant based essential oil for moisturizing skincare soothing deodorizing and refreshing aromatherapy 10ML", "handle": "plant-based-essential-oil-for-moisturizing-skincare-soothing-deodorizing-and-refreshing-aromatherapy-10ml", "tags": "skincare", "url": "https://shop.aloha.id.vn/products/plant-based-essential-oil-for-moisturizing-skincare-soothing-deodorizing-and-refreshing-aromatherapy-10ml", "price": "14.46", "product_type": "", "vendor": "eprolo", "status": "active", "sku": "531AF90F528541BEA09B83433EE8F817", "variant": "clove", "image": "https://cdn.shopify.com/s/files/1/0623/5340/8063/files/A0B08EBAEDAD716F7C73837F72B58ECB.png?v=1757002242", "inventory_quantity": 423, "available": true, "text": "Product: Plant based essential oil for moisturizing skincare soothing deodorizing and refreshing aromatherapy 10ML Type: Vendor: eprolo Tags: skincare Options: {\"aroma\": [\"Sweet Orange\", \"Lavender\", \"tea plant\", \"Mint\", \"Eucalyptus\", \"Lemon lemongrass\", \"rose\", \"rosemary\", \"lemon\", \"Grapefruit\", \"cedar\", \"cinnamon\", \"Silk Cypress\", \"myrrh\", \"Patchouli\", \"frankincense\", \"Bergamot\", \"chamomile\", \"Geranium\", \"Yanlan Grass\", \"Sage\", \"ginger\", \"clove\", \"thyme\", \"sandalwood\", \"Jasmine\", \"vanilla\", \"Yilan\", \"sweet basil\", \"Red Orange\", \"black pepper\", \"Lemongrass\", \"fennel\", \"Cajeput\", \"Juniper berry\", \"1 set of 35 bottles (1 bottle each)\"]} Variant: clove SKU: 531AF90F528541BEA09B83433EE8F817 Price: 14.46 Inventory: 423 Available: True Status: active Body: Effect: Soothing the mind Net content: "}, {"type": "product", "id": 7889136910399, "title": "Plant based essential oil for moisturizing skincare soothing deodorizing and refreshing aromatherapy 10ML", "handle": "plant-based-essential-oil-for-moisturizing-skincare-soothing-deodorizing-and-refreshing-aromatherapy-10ml", "tags": "skincare", "url": "https://shop.aloha.id.vn/products/plant-based-essential-oil-for-moisturizing-skincare-soothing-deodorizing-and-refreshing-aromatherapy-10ml", "price": "14.46", "product_type": "", "vendor": "eprolo", "status": "active", "sku": "0C5C0C850DD2448A8DC5B507C4E45E82", "variant": "thyme", "image": "https://cdn.shopify.com/s/files/1/0623/5340/8063/files/A0B08EBAEDAD716F7C73837F72B58ECB.png?v=1757002242", "inventory_quantity": 620, "available": true, "text": "Product: Plant based essential oil for moisturizing skincare soothing deodorizing and refreshing aromatherapy 10ML Type: Vendor: eprolo Tags: skincare Options: {\"aroma\": [\"Sweet Orange\", \"Lavender\", \"tea plant\", \"Mint\", \"Eucalyptus\", \"Lemon lemongrass\", \"rose\", \"rosemary\", \"lemon\", \"Grapefruit\", \"cedar\", \"cinnamon\", \"Silk Cypress\", \"myrrh\", \"Patchouli\", \"frankincense\", \"Bergamot\", \"chamomile\", \"Geranium\", \"Yanlan Grass\", \"Sage\", \"ginger\", \"clove\", \"thyme\", \"sandalwood\", \"Jasmine\", \"vanilla\", \"Yilan\", \"sweet basil\", \"Red Orange\", \"black pepper\", \"Lemongrass\", \"fennel\", \"Cajeput\", \"Juniper berry\", \"1 set of 35 bottles (1 bottle each)\"]} Variant: thyme SKU: 0C5C0C850DD2448A8DC5B507C4E45E82 Price: 14.46 Inventory: 620 Available: True Status: active Body: Effect: Soothing the mind Net content: "}, {"type": "product", "id": 7889136910399, "title": "Plant based essential oil for moisturizing skincare soothing deodorizing and refreshing aromatherapy 10ML", "handle": "plant-based-essential-oil-for-moisturizing-skincare-soothing-deodorizing-and-refreshing-aromatherapy-10ml", "tags": "skincare", "url": "https://shop.aloha.id.vn/products/plant-based-essential-oil-for-moisturizing-skincare-soothing-deodorizing-and-refreshing-aromatherapy-10ml", "price": "15.12", "product_type": "", "vendor": "eprolo", "status": "active", "sku": "64CAFC6A56F94FBDB4628B7AFD157E0D", "variant": "sandalwood", "image": "https://cdn.shopify.com/s/files/1/0623/5340/8063/files/A0B08EBAEDAD716F7C73837F72B58ECB.png?v=1757002242", "inventory_quantity": 757, "available": true, "text": "Product: Plant based essential oil for moisturizing skincare soothing deodorizing and refreshing aromatherapy 10ML Type: Vendor: eprolo Tags: skincare Options: {\"aroma\": [\"Sweet Orange\", \"Lavender\", \"tea plant\", \"Mint\", \"Eucalyptus\", \"Lemon lemongrass\", \"rose\", \"rosemary\", \"lemon\", \"Grapefruit\", \"cedar\", \"cinnamon\", \"Silk Cypress\", \"myrrh\", \"Patchouli\", \"frankincense\", \"Bergamot\", \"chamomile\", \"Geranium\", \"Yanlan Grass\", \"Sage\", \"ginger\", \"clove\", \"thyme\", \"sandalwood\", \"Jasmine\", \"vanilla\", \"Yilan\", \"sweet basil\", \"Red Orange\", \"black pepper\", \"Lemongrass\", \"fennel\", \"Cajeput\", \"Juniper berry\", \"1 set of 35 bottles (1 bottle each)\"]} Variant: sandalwood SKU: 64CAFC6A56F94FBDB4628B7AFD157E0D Price: 15.12 Inventory: 757 Available: True Status: active Body: Effect: Soothing the mind Net cont"}, {"type": "product", "id": 7889136910399, "title": "Plant based essential oil for moisturizing skincare soothing deodorizing and refreshing aromatherapy 10ML", "handle": "plant-based-essential-oil-for-moisturizing-skincare-soothing-deodorizing-and-refreshing-aromatherapy-10ml", "tags": "skincare", "url": "https://shop.aloha.id.vn/products/plant-based-essential-oil-for-moisturizing-skincare-soothing-deodorizing-and-refreshing-aromatherapy-10ml", "price": "16.44", "product_type": "", "vendor": "eprolo", "status": "active", "sku": "30BCA73E124F42FBA1A6001A5CE014C3", "variant": "Jasmine", "image": "https://cdn.shopify.com/s/files/1/0623/5340/8063/files/A0B08EBAEDAD716F7C73837F72B58ECB.png?v=1757002242", "inventory_quantity": 482, "available": true, "text": "Product: Plant based essential oil for moisturizing skincare soothing deodorizing and refreshing aromatherapy 10ML Type: Vendor: eprolo Tags: skincare Options: {\"aroma\": [\"Sweet Orange\", \"Lavender\", \"tea plant\", \"Mint\", \"Eucalyptus\", \"Lemon lemongrass\", \"rose\", \"rosemary\", \"lemon\", \"Grapefruit\", \"cedar\", \"cinnamon\", \"Silk Cypress\", \"myrrh\", \"Patchouli\", \"frankincense\", \"Bergamot\", \"chamomile\", \"Geranium\", \"Yanlan Grass\", \"Sage\", \"ginger\", \"clove\", \"thyme\", \"sandalwood\", \"Jasmine\", \"vanilla\", \"Yilan\", \"sweet basil\", \"Red Orange\", \"black pepper\", \"Lemongrass\", \"fennel\", \"Cajeput\", \"Juniper berry\", \"1 set of 35 bottles (1 bottle each)\"]} Variant: Jasmine SKU: 30BCA73E124F42FBA1A6001A5CE014C3 Price: 16.44 Inventory: 482 Available: True Status: active Body: Effect: Soothing the mind Net content"}, {"type": "product", "id": 7889136910399, "title": "Plant based essential oil for moisturizing skincare soothing deodorizing and refreshing aromatherapy 10ML", "handle": "plant-based-essential-oil-for-moisturizing-skincare-soothing-deodorizing-and-refreshing-aromatherapy-10ml", "tags": "skincare", "url": "https://shop.aloha.id.vn/products/plant-based-essential-oil-for-moisturizing-skincare-soothing-deodorizing-and-refreshing-aromatherapy-10ml", "price": "16.44", "product_type": "", "vendor": "eprolo", "status": "active", "sku": "30BCA73E124F42FBA1A6001A5CE014C3", "variant": "Jasmine", "image": "https://cdn.shopify.com/s/files/1/0623/5340/8063/files/A0B08EBAEDAD716F7C73837F72B58ECB.png?v=1757002242", "inventory_quantity": 482, "available": true, "text": ": 10ml URL: https://shop.aloha.id.vn/products/plant-based-essential-oil-for-moisturizing-skincare-soothing-deodorizing-and-refreshing-aromatherapy-10ml"}, {"type": "product", "id": 7889136910399, "title": "Plant based essential oil for moisturizing skincare soothing deodorizing and refreshing aromatherapy 10ML", "handle": "plant-based-essential-oil-for-moisturizing-skincare-soothing-deodorizing-and-refreshing-aromatherapy-10ml", "tags": "skincare", "url": "https://shop.aloha.id.vn/products/plant-based-essential-oil-for-moisturizing-skincare-soothing-deodorizing-and-refreshing-aromatherapy-10ml", "price": "14.46", "product_type": "", "vendor": "eprolo", "status": "active", "sku": "4650B24782024ADDB895E9F6CE83ECA6", "variant": "vanilla", "image": "https://cdn.shopify.com/s/files/1/0623/5340/8063/files/A0B08EBAEDAD716F7C73837F72B58ECB.png?v=1757002242", "inventory_quantity": 394, "available": true, "text": "Product: Plant based essential oil for moisturizing skincare soothing deodorizing and refreshing aromatherapy 10ML Type: Vendor: eprolo Tags: skincare Options: {\"aroma\": [\"Sweet Orange\", \"Lavender\", \"tea plant\", \"Mint\", \"Eucalyptus\", \"Lemon lemongrass\", \"rose\", \"rosemary\", \"lemon\", \"Grapefruit\", \"cedar\", \"cinnamon\", \"Silk Cypress\", \"myrrh\", \"Patchouli\", \"frankincense\", \"Bergamot\", \"chamomile\", \"Geranium\", \"Yanlan Grass\", \"Sage\", \"ginger\", \"clove\", \"thyme\", \"sandalwood\", \"Jasmine\", \"vanilla\", \"Yilan\", \"sweet basil\", \"Red Orange\", \"black pepper\", \"Lemongrass\", \"fennel\", \"Cajeput\", \"Juniper berry\", \"1 set of 35 bottles (1 bottle each)\"]} Variant: vanilla SKU: 4650B24782024ADDB895E9F6CE83ECA6 Price: 14.46 Inventory: 394 Available: True Status: active Body: Effect: Soothing the mind Net content"}, {"type": "product", "id": 7889136910399, "title": "Plant based essential oil for moisturizing skincare soothing deodorizing and refreshing aromatherapy 10ML", "handle": "plant-based-essential-oil-for-moisturizing-skincare-soothing-deodorizing-and-refreshing-aromatherapy-10ml", "tags": "skincare", "url": "https://shop.aloha.id.vn/products/plant-based-essential-oil-for-moisturizing-skincare-soothing-deodorizing-and-refreshing-aromatherapy-10ml", "price": "14.46", "product_type": "", "vendor": "eprolo", "status": "active", "sku": "3F78775E9ABD408EBD7CB77DBAE2F1AE", "variant": "Yilan", "image": "https://cdn.shopify.com/s/files/1/0623/5340/8063/files/A0B08EBAEDAD716F7C73837F72B58ECB.png?v=1757002242", "inventory_quantity": 623, "available": true, "text": "Product: Plant based essential oil for moisturizing skincare soothing deodorizing and refreshing aromatherapy 10ML Type: Vendor: eprolo Tags: skincare Options: {\"aroma\": [\"Sweet Orange\", \"Lavender\", \"tea plant\", \"Mint\", \"Eucalyptus\", \"Lemon lemongrass\", \"rose\", \"rosemary\", \"lemon\", \"Grapefruit\", \"cedar\", \"cinnamon\", \"Silk Cypress\", \"myrrh\", \"Patchouli\", \"frankincense\", \"Bergamot\", \"chamomile\", \"Geranium\", \"Yanlan Grass\", \"Sage\", \"ginger\", \"clove\", \"thyme\", \"sandalwood\", \"Jasmine\", \"vanilla\", \"Yilan\", \"sweet basil\", \"Red Orange\", \"black pepper\", \"Lemongrass\", \"fennel\", \"Cajeput\", \"Juniper berry\", \"1 set of 35 bottles (1 bottle each)\"]} Variant: Yilan SKU: 3F78775E9ABD408EBD7CB77DBAE2F1AE Price: 14.46 Inventory: 623 Available: True Status: active Body: Effect: Soothing the mind Net content: "}, {"type": "product", "id": 7889136910399, "title": "Plant based essential oil for moisturizing skincare soothing deodorizing and refreshing aromatherapy 10ML", "handle": "plant-based-essential-oil-for-moisturizing-skincare-soothing-deodorizing-and-refreshing-aromatherapy-10ml", "tags": "skincare", "url": "https://shop.aloha.id.vn/products/plant-based-essential-oil-for-moisturizing-skincare-soothing-deodorizing-and-refreshing-aromatherapy-10ml", "price": "14.46", "product_type": "", "vendor": "eprolo", "status": "active", "sku": "C9E4E374C7014C25AB648D774DA21DF7", "variant": "sweet basil", "image": "https://cdn.shopify.com/s/files/1/0623/5340/8063/files/A0B08EBAEDAD716F7C73837F72B58ECB.png?v=1757002242", "inventory_quantity": 570, "available": true, "text": "Product: Plant based essential oil for moisturizing skincare soothing deodorizing and refreshing aromatherapy 10ML Type: Vendor: eprolo Tags: skincare Options: {\"aroma\": [\"Sweet Orange\", \"Lavender\", \"tea plant\", \"Mint\", \"Eucalyptus\", \"Lemon lemongrass\", \"rose\", \"rosemary\", \"lemon\", \"Grapefruit\", \"cedar\", \"cinnamon\", \"Silk Cypress\", \"myrrh\", \"Patchouli\", \"frankincense\", \"Bergamot\", \"chamomile\", \"Geranium\", \"Yanlan Grass\", \"Sage\", \"ginger\", \"clove\", \"thyme\", \"sandalwood\", \"Jasmine\", \"vanilla\", \"Yilan\", \"sweet basil\", \"Red Orange\", \"black pepper\", \"Lemongrass\", \"fennel\", \"Cajeput\", \"Juniper berry\", \"1 set of 35 bottles (1 bottle each)\"]} Variant: sweet basil SKU: C9E4E374C7014C25AB648D774DA21DF7 Price: 14.46 Inventory: 570 Available: True Status: active Body: Effect: Soothing the mind Net con"}, {"type": "product", "id": 7889136910399, "title": "Plant based essential oil for moisturizing skincare soothing deodorizing and refreshing aromatherapy 10ML", "handle": "plant-based-essential-oil-for-moisturizing-skincare-soothing-deodorizing-and-refreshing-aromatherapy-10ml", "tags": "skincare", "url": "https://shop.aloha.id.vn/products/plant-based-essential-oil-for-moisturizing-skincare-soothing-deodorizing-and-refreshing-aromatherapy-10ml", "price": "14.46", "product_type": "", "vendor": "eprolo", "status": "active", "sku": "C9E4E374C7014C25AB648D774DA21DF7", "variant": "sweet basil", "image": "https://cdn.shopify.com/s/files/1/0623/5340/8063/files/A0B08EBAEDAD716F7C73837F72B58ECB.png?v=1757002242", "inventory_quantity": 570, "available": true, "text": "tent: 10ml URL: https://shop.aloha.id.vn/products/plant-based-essential-oil-for-moisturizing-skincare-soothing-deodorizing-and-refreshing-aromatherapy-10ml"}, {"type": "product", "id": 7889136910399, "title": "Plant based essential oil for moisturizing skincare soothing deodorizing and refreshing aromatherapy 10ML", "handle": "plant-based-essential-oil-for-moisturizing-skincare-soothing-deodorizing-and-refreshing-aromatherapy-10ml", "tags": "skincare", "url": "https://shop.aloha.id.vn/products/plant-based-essential-oil-for-moisturizing-skincare-soothing-deodorizing-and-refreshing-aromatherapy-10ml", "price": "13.80", "product_type": "", "vendor": "eprolo", "status": "active", "sku": "1E16BFD088804F11A672FE6478F52342", "variant": "Red Orange", "image": "https://cdn.shopify.com/s/files/1/0623/5340/8063/files/A0B08EBAEDAD716F7C73837F72B58ECB.png?v=1757002242", "inventory_quantity": 628, "available": true, "text": "Product: Plant based essential oil for moisturizing skincare soothing deodorizing and refreshing aromatherapy 10ML Type: Vendor: eprolo Tags: skincare Options: {\"aroma\": [\"Sweet Orange\", \"Lavender\", \"tea plant\", \"Mint\", \"Eucalyptus\", \"Lemon lemongrass\", \"rose\", \"rosemary\", \"lemon\", \"Grapefruit\", \"cedar\", \"cinnamon\", \"Silk Cypress\", \"myrrh\", \"Patchouli\", \"frankincense\", \"Bergamot\", \"chamomile\", \"Geranium\", \"Yanlan Grass\", \"Sage\", \"ginger\", \"clove\", \"thyme\", \"sandalwood\", \"Jasmine\", \"vanilla\", \"Yilan\", \"sweet basil\", \"Red Orange\", \"black pepper\", \"Lemongrass\", \"fennel\", \"Cajeput\", \"Juniper berry\", \"1 set of 35 bottles (1 bottle each)\"]} Variant: Red Orange SKU: 1E16BFD088804F11A672FE6478F52342 Price: 13.80 Inventory: 628 Available: True Status: active Body: Effect: Soothing the mind Net cont"}, {"type": "product", "id": 7889136910399, "title": "Plant based essential oil for moisturizing skincare soothing deodorizing and refreshing aromatherapy 10ML", "handle": "plant-based-essential-oil-for-moisturizing-skincare-soothing-deodorizing-and-refreshing-aromatherapy-10ml", "tags": "skincare", "url": "https://shop.aloha.id.vn/products/plant-based-essential-oil-for-moisturizing-skincare-soothing-deodorizing-and-refreshing-aromatherapy-10ml", "price": "14.46", "product_type": "", "vendor": "eprolo", "status": "active", "sku": "3AA97939EA264232B2C38BB4C87758C3", "variant": "black pepper", "image": "https://cdn.shopify.com/s/files/1/0623/5340/8063/files/A0B08EBAEDAD716F7C73837F72B58ECB.png?v=1757002242", "inventory_quantity": 740, "available": true, "text": "Product: Plant based essential oil for moisturizing skincare soothing deodorizing and refreshing aromatherapy 10ML Type: Vendor: eprolo Tags: skincare Options: {\"aroma\": [\"Sweet Orange\", \"Lavender\", \"tea plant\", \"Mint\", \"Eucalyptus\", \"Lemon lemongrass\", \"rose\", \"rosemary\", \"lemon\", \"Grapefruit\", \"cedar\", \"cinnamon\", \"Silk Cypress\", \"myrrh\", \"Patchouli\", \"frankincense\", \"Bergamot\", \"chamomile\", \"Geranium\", \"Yanlan Grass\", \"Sage\", \"ginger\", \"clove\", \"thyme\", \"sandalwood\", \"Jasmine\", \"vanilla\", \"Yilan\", \"sweet basil\", \"Red Orange\", \"black pepper\", \"Lemongrass\", \"fennel\", \"Cajeput\", \"Juniper berry\", \"1 set of 35 bottles (1 bottle each)\"]} Variant: black pepper SKU: 3AA97939EA264232B2C38BB4C87758C3 Price: 14.46 Inventory: 740 Available: True Status: active Body: Effect: Soothing the mind Net co"}, {"type": "product", "id": 7889136910399, "title": "Plant based essential oil for moisturizing skincare soothing deodorizing and refreshing aromatherapy 10ML", "handle": "plant-based-essential-oil-for-moisturizing-skincare-soothing-deodorizing-and-refreshing-aromatherapy-10ml", "tags": "skincare", "url": "https://shop.aloha.id.vn/products/plant-based-essential-oil-for-moisturizing-skincare-soothing-deodorizing-and-refreshing-aromatherapy-10ml", "price": "13.80", "product_type": "", "vendor": "eprolo", "status": "active", "sku": "92CCE4555B7140DA82F77E7A322BB93A", "variant": "Lemongrass", "image": "https://cdn.shopify.com/s/files/1/0623/5340/8063/files/A0B08EBAEDAD716F7C73837F72B58ECB.png?v=1757002242", "inventory_quantity": 391, "available": true, "text": "Product: Plant based essential oil for moisturizing skincare soothing deodorizing and refreshing aromatherapy 10ML Type: Vendor: eprolo Tags: skincare Options: {\"aroma\": [\"Sweet Orange\", \"Lavender\", \"tea plant\", \"Mint\", \"Eucalyptus\", \"Lemon lemongrass\", \"rose\", \"rosemary\", \"lemon\", \"Grapefruit\", \"cedar\", \"cinnamon\", \"Silk Cypress\", \"myrrh\", \"Patchouli\", \"frankincense\", \"Bergamot\", \"chamomile\", \"Geranium\", \"Yanlan Grass\", \"Sage\", \"ginger\", \"clove\", \"thyme\", \"sandalwood\", \"Jasmine\", \"vanilla\", \"Yilan\", \"sweet basil\", \"Red Orange\", \"black pepper\", \"Lemongrass\", \"fennel\", \"Cajeput\", \"Juniper berry\", \"1 set of 35 bottles (1 bottle each)\"]} Variant: Lemongrass SKU: 92CCE4555B7140DA82F77E7A322BB93A Price: 13.80 Inventory: 391 Available: True Status: active Body: Effect: Soothing the mind Net cont"}, {"type": "product", "id": 7889136910399, "title": "Plant based essential oil for moisturizing skincare soothing deodorizing and refreshing aromatherapy 10ML", "handle": "plant-based-essential-oil-for-moisturizing-skincare-soothing-deodorizing-and-refreshing-aromatherapy-10ml", "tags": "skincare", "url": "https://shop.aloha.id.vn/products/plant-based-essential-oil-for-moisturizing-skincare-soothing-deodorizing-and-refreshing-aromatherapy-10ml", "price": "13.80", "product_type": "", "vendor": "eprolo", "status": "active", "sku": "990A8FF0BB884E7BB17946E41EABCB4D", "variant": "fennel", "image": "https://cdn.shopify.com/s/files/1/0623/5340/8063/files/A0B08EBAEDAD716F7C73837F72B58ECB.png?v=1757002242", "inventory_quantity": 675, "available": true, "text": "Product: Plant based essential oil for moisturizing skincare soothing deodorizing and refreshing aromatherapy 10ML Type: Vendor: eprolo Tags: skincare Options: {\"aroma\": [\"Sweet Orange\", \"Lavender\", \"tea plant\", \"Mint\", \"Eucalyptus\", \"Lemon lemongrass\", \"rose\", \"rosemary\", \"lemon\", \"Grapefruit\", \"cedar\", \"cinnamon\", \"Silk Cypress\", \"myrrh\", \"Patchouli\", \"frankincense\", \"Bergamot\", \"chamomile\", \"Geranium\", \"Yanlan Grass\", \"Sage\", \"ginger\", \"clove\", \"thyme\", \"sandalwood\", \"Jasmine\", \"vanilla\", \"Yilan\", \"sweet basil\", \"Red Orange\", \"black pepper\", \"Lemongrass\", \"fennel\", \"Cajeput\", \"Juniper berry\", \"1 set of 35 bottles (1 bottle each)\"]} Variant: fennel SKU: 990A8FF0BB884E7BB17946E41EABCB4D Price: 13.80 Inventory: 675 Available: True Status: active Body: Effect: Soothing the mind Net content:"}, {"type": "product", "id": 7889136910399, "title": "Plant based essential oil for moisturizing skincare soothing deodorizing and refreshing aromatherapy 10ML", "handle": "plant-based-essential-oil-for-moisturizing-skincare-soothing-deodorizing-and-refreshing-aromatherapy-10ml", "tags": "skincare", "url": "https://shop.aloha.id.vn/products/plant-based-essential-oil-for-moisturizing-skincare-soothing-deodorizing-and-refreshing-aromatherapy-10ml", "price": "14.46", "product_type": "", "vendor": "eprolo", "status": "active", "sku": "C89E912C64DB407EB50E21C155C39F75", "variant": "Cajeput", "image": "https://cdn.shopify.com/s/files/1/0623/5340/8063/files/A0B08EBAEDAD716F7C73837F72B58ECB.png?v=1757002242", "inventory_quantity": 658, "available": true, "text": "Product: Plant based essential oil for moisturizing skincare soothing deodorizing and refreshing aromatherapy 10ML Type: Vendor: eprolo Tags: skincare Options: {\"aroma\": [\"Sweet Orange\", \"Lavender\", \"tea plant\", \"Mint\", \"Eucalyptus\", \"Lemon lemongrass\", \"rose\", \"rosemary\", \"lemon\", \"Grapefruit\", \"cedar\", \"cinnamon\", \"Silk Cypress\", \"myrrh\", \"Patchouli\", \"frankincense\", \"Bergamot\", \"chamomile\", \"Geranium\", \"Yanlan Grass\", \"Sage\", \"ginger\", \"clove\", \"thyme\", \"sandalwood\", \"Jasmine\", \"vanilla\", \"Yilan\", \"sweet basil\", \"Red Orange\", \"black pepper\", \"Lemongrass\", \"fennel\", \"Cajeput\", \"Juniper berry\", \"1 set of 35 bottles (1 bottle each)\"]} Variant: Cajeput SKU: C89E912C64DB407EB50E21C155C39F75 Price: 14.46 Inventory: 658 Available: True Status: active Body: Effect: Soothing the mind Net content"}, {"type": "product", "id": 7889136910399, "title": "Plant based essential oil for moisturizing skincare soothing deodorizing and refreshing aromatherapy 10ML", "handle": "plant-based-essential-oil-for-moisturizing-skincare-soothing-deodorizing-and-refreshing-aromatherapy-10ml", "tags": "skincare", "url": "https://shop.aloha.id.vn/products/plant-based-essential-oil-for-moisturizing-skincare-soothing-deodorizing-and-refreshing-aromatherapy-10ml", "price": "14.46", "product_type": "", "vendor": "eprolo", "status": "active", "sku": "EB876517546D4203B639628F4EFD2538", "variant": "Juniper berry", "image": "https://cdn.shopify.com/s/files/1/0623/5340/8063/files/A0B08EBAEDAD716F7C73837F72B58ECB.png?v=1757002242", "inventory_quantity": 637, "available": true, "text": "Product: Plant based essential oil for moisturizing skincare soothing deodorizing and refreshing aromatherapy 10ML Type: Vendor: eprolo Tags: skincare Options: {\"aroma\": [\"Sweet Orange\", \"Lavender\", \"tea plant\", \"Mint\", \"Eucalyptus\", \"Lemon lemongrass\", \"rose\", \"rosemary\", \"lemon\", \"Grapefruit\", \"cedar\", \"cinnamon\", \"Silk Cypress\", \"myrrh\", \"Patchouli\", \"frankincense\", \"Bergamot\", \"chamomile\", \"Geranium\", \"Yanlan Grass\", \"Sage\", \"ginger\", \"clove\", \"thyme\", \"sandalwood\", \"Jasmine\", \"vanilla\", \"Yilan\", \"sweet basil\", \"Red Orange\", \"black pepper\", \"Lemongrass\", \"fennel\", \"Cajeput\", \"Juniper berry\", \"1 set of 35 bottles (1 bottle each)\"]} Variant: Juniper berry SKU: EB876517546D4203B639628F4EFD2538 Price: 14.46 Inventory: 637 Available: True Status: active Body: Effect: Soothing the mind Net c"}, {"type": "product", "id": 7889136910399, "title": "Plant based essential oil for moisturizing skincare soothing deodorizing and refreshing aromatherapy 10ML", "handle": "plant-based-essential-oil-for-moisturizing-skincare-soothing-deodorizing-and-refreshing-aromatherapy-10ml", "tags": "skincare", "url": "https://shop.aloha.id.vn/products/plant-based-essential-oil-for-moisturizing-skincare-soothing-deodorizing-and-refreshing-aromatherapy-10ml", "price": "14.46", "product_type": "", "vendor": "eprolo", "status": "active", "sku": "EB876517546D4203B639628F4EFD2538", "variant": "Juniper berry", "image": "https://cdn.shopify.com/s/files/1/0623/5340/8063/files/A0B08EBAEDAD716F7C73837F72B58ECB.png?v=1757002242", "inventory_quantity": 637, "available": true, "text": "ontent: 10ml URL: https://shop.aloha.id.vn/products/plant-based-essential-oil-for-moisturizing-skincare-soothing-deodorizing-and-refreshing-aromatherapy-10ml"}, {"type": "product", "id": 7889136910399, "title": "Plant based essential oil for moisturizing skincare soothing deodorizing and refreshing aromatherapy 10ML", "handle": "plant-based-essential-oil-for-moisturizing-skincare-soothing-deodorizing-and-refreshing-aromatherapy-10ml", "tags": "skincare", "url": "https://shop.aloha.id.vn/products/plant-based-essential-oil-for-moisturizing-skincare-soothing-deodorizing-and-refreshing-aromatherapy-10ml", "price": "207.70", "product_type": "", "vendor": "eprolo", "status": "active", "sku": "55C48BEF73934C00B3D7A6FD0A847A9A", "variant": "1 set of 35 bottles (1 bottle each)", "image": "https://cdn.shopify.com/s/files/1/0623/5340/8063/files/A0B08EBAEDAD716F7C73837F72B58ECB.png?v=1757002242", "inventory_quantity": 386, "available": true, "text": "Product: Plant based essential oil for moisturizing skincare soothing deodorizing and refreshing aromatherapy 10ML Type: Vendor: eprolo Tags: skincare Options: {\"aroma\": [\"Sweet Orange\", \"Lavender\", \"tea plant\", \"Mint\", \"Eucalyptus\", \"Lemon lemongrass\", \"rose\", \"rosemary\", \"lemon\", \"Grapefruit\", \"cedar\", \"cinnamon\", \"Silk Cypress\", \"myrrh\", \"Patchouli\", \"frankincense\", \"Bergamot\", \"chamomile\", \"Geranium\", \"Yanlan Grass\", \"Sage\", \"ginger\", \"clove\", \"thyme\", \"sandalwood\", \"Jasmine\", \"vanilla\", \"Yilan\", \"sweet basil\", \"Red Orange\", \"black pepper\", \"Lemongrass\", \"fennel\", \"Cajeput\", \"Juniper berry\", \"1 set of 35 bottles (1 bottle each)\"]} Variant: 1 set of 35 bottles (1 bottle each) SKU: 55C48BEF73934C00B3D7A6FD0A847A9A Price: 207.70 Inventory: 386 Available: True Status: active Body: Effect: "}, {"type": "product", "id": 7889136910399, "title": "Plant based essential oil for moisturizing skincare soothing deodorizing and refreshing aromatherapy 10ML", "handle": "plant-based-essential-oil-for-moisturizing-skincare-soothing-deodorizing-and-refreshing-aromatherapy-10ml", "tags": "skincare", "url": "https://shop.aloha.id.vn/products/plant-based-essential-oil-for-moisturizing-skincare-soothing-deodorizing-and-refreshing-aromatherapy-10ml", "price": "207.70", "product_type": "", "vendor": "eprolo", "status": "active", "sku": "55C48BEF73934C00B3D7A6FD0A847A9A", "variant": "1 set of 35 bottles (1 bottle each)", "image": "https://cdn.shopify.com/s/files/1/0623/5340/8063/files/A0B08EBAEDAD716F7C73837F72B58ECB.png?v=1757002242", "inventory_quantity": 386, "available": true, "text": "Soothing the mind Net content: 10ml URL: https://shop.aloha.id.vn/products/plant-based-essential-oil-for-moisturizing-skincare-soothing-deodorizing-and-refreshing-aromatherapy-10ml"}, {"type": "product", "id": 7890248794175, "title": "PREMIUM FEMINE BALANCE GUMMIES Women's Balance Gummies", "handle": "premium-femine-balance-gummies-womens-balance-gummies", "tags": "", "url": "https://shop.aloha.id.vn/products/premium-femine-balance-gummies-womens-balance-gummies", "price": "21.08", "product_type": "", "vendor": "eprolo", "status": "active", "sku": "92177B5EC666472E9B857F4C7AE78E03", "variant": "bag", "image": "https://cdn.shopify.com/s/files/1/0623/5340/8063/files/787C8F5877E926FE87DF329582084AE9.jpg?v=1757165187", "inventory_quantity": 98259, "available": true, "text": "Product: PREMIUM FEMINE BALANCE GUMMIES Women's Balance Gummies Type: Vendor: eprolo Tags: Options: {\"Packaging specifications\": [\"bag\"]} Variant: bag SKU: 92177B5EC666472E9B857F4C7AE78E03 Price: 21.08 Inventory: 98259 Available: True Status: active Body: Product Name: 60 Women's Balance Gummies Type: Soft Candy Target audience: Adults Not suitable for: pregnant women and children Product Category: Soft Candy URL: https://shop.aloha.id.vn/products/premium-femine-balance-gummies-womens-balance-gummies"}, {"type": "product", "id": 7889479237695, "title": "Retinol Face Serum, Lighten Fine Lines, Moisturize Tender, White, Firming And Anti-Wrinkle Beauty Solution", "handle": "retinol-face-serum-lighten-fine-lines-moisturize-tender-white-firming-and-anti-wrinkle-beauty-solution", "tags": "skincare", "url": "https://shop.aloha.id.vn/products/retinol-face-serum-lighten-fine-lines-moisturize-tender-white-firming-and-anti-wrinkle-beauty-solution", "price": "22.78", "product_type": "", "vendor": "eprolo", "status": "active", "sku": "WEA02-A004-30-BU1", "variant": "default title", "image": "https://cdn.shopify.com/s/files/1/0623/5340/8063/files/8EBB1A7BB8400B43A6F5A2D739EEEC89.jpg?v=1757045959", "inventory_quantity": 94, "available": true, "text": "Product: Retinol Face Serum, Lighten Fine Lines, Moisturize Tender, White, Firming And Anti-Wrinkle Beauty Solution Type: Vendor: eprolo Tags: skincare Options: {\"color\": [\"default title\"]} Variant: default title SKU: WEA02-A004-30-BU1 Price: 22.78 Inventory: 94 Available: True Status: active Body: Our retinol face serum contains retinol, hyaluronic acid and vitamin E. It provides deep moisture, helps reduce the appearance of fine lines and wrinkles, improves skin elasticity, enhances skin shine, and provides strong nutrients to the skin. Its use method is very simple: after cleansing and toning, take an appropriate amount of essence evenly apply to the face, and massage gently from inside to outside with your fingertips until absorbed. And can prevent signs of skin aging. URL: https://sho"}, {"type": "product", "id": 7889479237695, "title": "Retinol Face Serum, Lighten Fine Lines, Moisturize Tender, White, Firming And Anti-Wrinkle Beauty Solution", "handle": "retinol-face-serum-lighten-fine-lines-moisturize-tender-white-firming-and-anti-wrinkle-beauty-solution", "tags": "skincare", "url": "https://shop.aloha.id.vn/products/retinol-face-serum-lighten-fine-lines-moisturize-tender-white-firming-and-anti-wrinkle-beauty-solution", "price": "22.78", "product_type": "", "vendor": "eprolo", "status": "active", "sku": "WEA02-A004-30-BU1", "variant": "default title", "image": "https://cdn.shopify.com/s/files/1/0623/5340/8063/files/8EBB1A7BB8400B43A6F5A2D739EEEC89.jpg?v=1757045959", "inventory_quantity": 94, "available": true, "text": "p.aloha.id.vn/products/retinol-face-serum-lighten-fine-lines-moisturize-tender-white-firming-and-anti-wrinkle-beauty-solution"}, {"type": "product", "id": 7890232442943, "title": "Retinol Night Moisturizer, Gentle Moisturizing Facial Skin Moisturizing Skin Cream", "handle": "retinol-night-moisturizer-gentle-moisturizing-facial-skin-moisturizing-skin-cream", "tags": "skincare", "url": "https://shop.aloha.id.vn/products/retinol-night-moisturizer-gentle-moisturizing-facial-skin-moisturizing-skin-cream", "price": "22.78", "product_type": "", "vendor": "eprolo", "status": "active", "sku": "WE-A05-0339-01", "variant": "default title", "image": "https://cdn.shopify.com/s/files/1/0623/5340/8063/files/0A40E96B5135C24D402DD45FC38F7678.jpg?v=1757158042", "inventory_quantity": 160, "available": true, "text": "Product: Retinol Night Moisturizer, Gentle Moisturizing Facial Skin Moisturizing Skin Cream Type: Vendor: eprolo Tags: skincare Options: {\"color\": [\"default title\"]} Variant: default title SKU: WE-A05-0339-01 Price: 22.78 Inventory: 160 Available: True Status: active Body: Our retinol night moisturizer contains vitamin C, retinyl palmitate. It promotes epidermal regeneration and leaves skin smooth and smooth. Its application method is very simple: clean dry facial skin, apply appropriate amount of this product evenly on the face, gently massage until absorbed. It also locks in moisture and leaves skin hydrated and plump. URL: https://shop.aloha.id.vn/products/retinol-night-moisturizer-gentle-moisturizing-facial-skin-moisturizing-skin-cream"}, {"type": "product", "id": 7889466884159, "title": "Retinol Serum, Face Anti-Wrinkle Firming Brightening Soft And Smooth Skin Serum", "handle": "retinol-serum-face-anti-wrinkle-firming-brightening-soft-and-smooth-skin-serum", "tags": "skincare", "url": "https://shop.aloha.id.vn/products/retinol-serum-face-anti-wrinkle-firming-brightening-soft-and-smooth-skin-serum", "price": "22.78", "product_type": "", "vendor": "eprolo", "status": "active", "sku": "OU012212221-10ml", "variant": "default title", "image": "https://cdn.shopify.com/s/files/1/0623/5340/8063/files/CCFE1C44F7EB47F8C09FB8C2977F1BA8.jpg?v=1757040410", "inventory_quantity": 100, "available": true, "text": "Product: Retinol Serum, Face Anti-Wrinkle Firming Brightening Soft And Smooth Skin Serum Type: Vendor: eprolo Tags: skincare Options: {\"color\": [\"default title\"]} Variant: default title SKU: OU012212221-10ml Price: 22.78 Inventory: 100 Available: True Status: active Body: Our retinol serum contains plant extract, vitamin A, and retinol 2.5%. It can support natural cell renewal, improve skin texture and tone, reduce aging, deeply moisturize and nourish, tighten skin, and increase skin elasticity. Its use method is very simple: First after cleansing, take an appropriate amount of this product with the dropper gently pat the face until absorbed. It can be used every day to supplement the nutrition of the skin, repair and hydrate the skin deeply, fill the dry and dehydrated skin, effectively f"}, {"type": "product", "id": 7889466884159, "title": "Retinol Serum, Face Anti-Wrinkle Firming Brightening Soft And Smooth Skin Serum", "handle": "retinol-serum-face-anti-wrinkle-firming-brightening-soft-and-smooth-skin-serum", "tags": "skincare", "url": "https://shop.aloha.id.vn/products/retinol-serum-face-anti-wrinkle-firming-brightening-soft-and-smooth-skin-serum", "price": "22.78", "product_type": "", "vendor": "eprolo", "status": "active", "sku": "OU012212221-10ml", "variant": "default title", "image": "https://cdn.shopify.com/s/files/1/0623/5340/8063/files/CCFE1C44F7EB47F8C09FB8C2977F1BA8.jpg?v=1757040410", "inventory_quantity": 100, "available": true, "text": "ade the fine lines on the face, and make your skin more delicate and smooth. URL: https://shop.aloha.id.vn/products/retinol-serum-face-anti-wrinkle-firming-brightening-soft-and-smooth-skin-serum"}, {"type": "product", "id": 7889136091199, "title": "Rotating cosmetic storage box transparent desktop display rack makeup brush skincare product storage rack", "handle": "rotating-cosmetic-storage-box-transparent-desktop-display-rack-makeup-brush-skincare-product-storage-rack", "tags": "skincare", "url": "https://shop.aloha.id.vn/products/rotating-cosmetic-storage-box-transparent-desktop-display-rack-makeup-brush-skincare-product-storage-rack", "price": "46.00", "product_type": "", "vendor": "eprolo", "status": "active", "sku": "7954253E943E468C828A8489C75121C8", "variant": "Diamond pattern-23 CM diameter", "image": "https://cdn.shopify.com/s/files/1/0623/5340/8063/files/B2D4A5E2D4889231F6E86E72E9005D52.jpg?v=1757002199", "inventory_quantity": 398, "available": true, "text": "Product: Rotating cosmetic storage box transparent desktop display rack makeup brush skincare product storage rack Type: Vendor: eprolo Tags: skincare Options: {\"color\": [\"Diamond pattern-23 CM diameter\", \"Smooth surface -23 CM diameter\"]} Variant: Diamond pattern-23 CM diameter SKU: 7954253E943E468C828A8489C75121C8 Price: 46.00 Inventory: 398 Available: True Status: active Body: Material PS URL: https://shop.aloha.id.vn/products/rotating-cosmetic-storage-box-transparent-desktop-display-rack-makeup-brush-skincare-product-storage-rack"}, {"type": "product", "id": 7889136091199, "title": "Rotating cosmetic storage box transparent desktop display rack makeup brush skincare product storage rack", "handle": "rotating-cosmetic-storage-box-transparent-desktop-display-rack-makeup-brush-skincare-product-storage-rack", "tags": "skincare", "url": "https://shop.aloha.id.vn/products/rotating-cosmetic-storage-box-transparent-desktop-display-rack-makeup-brush-skincare-product-storage-rack", "price": "46.00", "product_type": "", "vendor": "eprolo", "status": "active", "sku": "DE2B5785B8C848F1B008E1DF0F06005C", "variant": "Smooth surface -23 CM diameter", "image": "https://cdn.shopify.com/s/files/1/0623/5340/8063/files/B2D4A5E2D4889231F6E86E72E9005D52.jpg?v=1757002199", "inventory_quantity": 759, "available": true, "text": "Product: Rotating cosmetic storage box transparent desktop display rack makeup brush skincare product storage rack Type: Vendor: eprolo Tags: skincare Options: {\"color\": [\"Diamond pattern-23 CM diameter\", \"Smooth surface -23 CM diameter\"]} Variant: Smooth surface -23 CM diameter SKU: DE2B5785B8C848F1B008E1DF0F06005C Price: 46.00 Inventory: 759 Available: True Status: active Body: Material PS URL: https://shop.aloha.id.vn/products/rotating-cosmetic-storage-box-transparent-desktop-display-rack-makeup-brush-skincare-product-storage-rack"}, {"type": "product", "id": 7890224545855, "title": "Roxelis Lavender Fragrance Solid Balm Everyday Portable Ladies Solid Balm Elegant Fresh Light Fragrance", "handle": "roxelis-lavender-fragrance-solid-balm-everyday-portable-ladies-solid-balm-elegant-fresh-light-fragrance", "tags": "skincare", "url": "https://shop.aloha.id.vn/products/roxelis-lavender-fragrance-solid-balm-everyday-portable-ladies-solid-balm-elegant-fresh-light-fragrance", "price": "24.10", "product_type": "", "vendor": "eprolo", "status": "active", "sku": "RO-A10-0294-01", "variant": "default title", "image": "https://cdn.shopify.com/s/files/1/0623/5340/8063/files/98B16F68737C6881173282A298D4460E.jpg?v=1757155951", "inventory_quantity": 187, "available": true, "text": "Product: Roxelis Lavender Fragrance Solid Balm Everyday Portable Ladies Solid Balm Elegant Fresh Light Fragrance Type: Vendor: eprolo Tags: skincare Options: {\"color\": [\"default title\"]} Variant: default title SKU: RO-A10-0294-01 Price: 24.10 Inventory: 187 Available: True Status: active Body: Our lavender scented solid balm contains mineral oil and white beeswax. It can create beautiful fragrances every day. Compact design for anytime, anywhere use. Its use is simple: open the lid of the balm box, take the appropriate amount of balm, and apply it to the inside of the wrist, the back of the neck, or behind the ears where there is a significant pulse. Gently massage the applied area with your fingertips to evenly coat the balm. And can be delicate packaging, suitable for various occasions. "}, {"type": "product", "id": 7890224545855, "title": "Roxelis Lavender Fragrance Solid Balm Everyday Portable Ladies Solid Balm Elegant Fresh Light Fragrance", "handle": "roxelis-lavender-fragrance-solid-balm-everyday-portable-ladies-solid-balm-elegant-fresh-light-fragrance", "tags": "skincare", "url": "https://shop.aloha.id.vn/products/roxelis-lavender-fragrance-solid-balm-everyday-portable-ladies-solid-balm-elegant-fresh-light-fragrance", "price": "24.10", "product_type": "", "vendor": "eprolo", "status": "active", "sku": "RO-A10-0294-01", "variant": "default title", "image": "https://cdn.shopify.com/s/files/1/0623/5340/8063/files/98B16F68737C6881173282A298D4460E.jpg?v=1757155951", "inventory_quantity": 187, "available": true, "text": "URL: https://shop.aloha.id.vn/products/roxelis-lavender-fragrance-solid-balm-everyday-portable-ladies-solid-balm-elegant-fresh-light-fragrance"}, {"type": "product", "id": 7890224513087, "title": "Roxelis Sandalwood Cologne Romantic Perfume, Releases Charm Couple Niche Atmosphere Fragrance Fresh And Lasting Fragrance Portable Bag", "handle": "roxelis-sandalwood-cologne-romantic-perfume-releases-charm-couple-niche-atmosphere-fragrance-fresh-and-lasting-fragrance-portable-bag", "tags": "skincare", "url": "https://shop.aloha.id.vn/products/roxelis-sandalwood-cologne-romantic-perfume-releases-charm-couple-niche-atmosphere-fragrance-fresh-and-lasting-fragrance-portable-bag", "price": "24.10", "product_type": "", "vendor": "eprolo", "status": "active", "sku": "RO-A10-0342-01", "variant": "default title", "image": "https://cdn.shopify.com/s/files/1/0623/5340/8063/files/44A4B466251E8AEDFB9274E6AB5E6C12.jpg?v=1757155931", "inventory_quantity": 193, "available": true, "text": "Product: Roxelis Sandalwood Cologne Romantic Perfume, Releases Charm Couple Niche Atmosphere Fragrance Fresh And Lasting Fragrance Portable Bag Type: Vendor: eprolo Tags: skincare Options: {\"color\": [\"default title\"]} Variant: default title SKU: RO-A10-0342-01 Price: 24.10 Inventory: 193 Available: True Status: active Body: Our romantic perfume (Sandalwood Cologne) is carefully blended with sandalwood oil and rosemary extract. Designed for people with heavy body odor, obvious sweat smell and excessive oil secretion. The method of application is extremely convenient: Spray 1-2 times at the pulse point. Avoid rubbing the skin after use. Re-spray after 6 hours to extend the effect. Avoid rubbing your skin. And the strength of the fragrance can be adjusted through body movements. URL: https://"}, {"type": "product", "id": 7890224513087, "title": "Roxelis Sandalwood Cologne Romantic Perfume, Releases Charm Couple Niche Atmosphere Fragrance Fresh And Lasting Fragrance Portable Bag", "handle": "roxelis-sandalwood-cologne-romantic-perfume-releases-charm-couple-niche-atmosphere-fragrance-fresh-and-lasting-fragrance-portable-bag", "tags": "skincare", "url": "https://shop.aloha.id.vn/products/roxelis-sandalwood-cologne-romantic-perfume-releases-charm-couple-niche-atmosphere-fragrance-fresh-and-lasting-fragrance-portable-bag", "price": "24.10", "product_type": "", "vendor": "eprolo", "status": "active", "sku": "RO-A10-0342-01", "variant": "default title", "image": "https://cdn.shopify.com/s/files/1/0623/5340/8063/files/44A4B466251E8AEDFB9274E6AB5E6C12.jpg?v=1757155931", "inventory_quantity": 193, "available": true, "text": "shop.aloha.id.vn/products/roxelis-sandalwood-cologne-romantic-perfume-releases-charm-couple-niche-atmosphere-fragrance-fresh-and-lasting-fragrance-portable-bag"}, {"type": "product", "id": 7890224447551, "title": "Roxelis Vanilla Coconut Body Perfume Spray, Long-Lasting Fragrance And Exudes A Unique Charm. It Is A Fresh, Romantic And Portable Perfume", "handle": "roxelis-vanilla-coconut-body-perfume-spray-long-lasting-fragrance-and-exudes-a-unique-charm-it-is-a-fresh-romantic-and-portable-perfume", "tags": "skincare", "url": "https://shop.aloha.id.vn/products/roxelis-vanilla-coconut-body-perfume-spray-long-lasting-fragrance-and-exudes-a-unique-charm-it-is-a-fresh-romantic-and-portable-perfume", "price": "24.10", "product_type": "", "vendor": "eprolo", "status": "active", "sku": "RO-A10-0356-01", "variant": "default title", "image": "https://cdn.shopify.com/s/files/1/0623/5340/8063/files/D3EBD3F95B2E93D907860D660DE3B824.jpg?v=1757155911", "inventory_quantity": 98, "available": true, "text": "Product: Roxelis Vanilla Coconut Body Perfume Spray, Long-Lasting Fragrance And Exudes A Unique Charm. It Is A Fresh, Romantic And Portable Perfume Type: Vendor: eprolo Tags: skincare Options: {\"color\": [\"default title\"]} Variant: default title SKU: RO-A10-0356-01 Price: 24.10 Inventory: 98 Available: True Status: active Body: Our Vanilla Coconut Body perfume spray is carefully formulated with glycerin and PEG-40 hydrogenated castor oil. Designed for a long-lasting fragrance, it exudes an alluring aroma throughout the day. The usage method is extremely convenient: Open the bottle cap, press the nozzle, and spray the product onto the hair, neck, wrists or other parts of the body. And it has a vanilla flavor, bringing fresh and creamy flavors; The coconut aroma is warm and charming, enhancin"}, {"type": "product", "id": 7890224447551, "title": "Roxelis Vanilla Coconut Body Perfume Spray, Long-Lasting Fragrance And Exudes A Unique Charm. It Is A Fresh, Romantic And Portable Perfume", "handle": "roxelis-vanilla-coconut-body-perfume-spray-long-lasting-fragrance-and-exudes-a-unique-charm-it-is-a-fresh-romantic-and-portable-perfume", "tags": "skincare", "url": "https://shop.aloha.id.vn/products/roxelis-vanilla-coconut-body-perfume-spray-long-lasting-fragrance-and-exudes-a-unique-charm-it-is-a-fresh-romantic-and-portable-perfume", "price": "24.10", "product_type": "", "vendor": "eprolo", "status": "active", "sku": "RO-A10-0356-01", "variant": "default title", "image": "https://cdn.shopify.com/s/files/1/0623/5340/8063/files/D3EBD3F95B2E93D907860D660DE3B824.jpg?v=1757155911", "inventory_quantity": 98, "available": true, "text": "g personal charm. URL: https://shop.aloha.id.vn/products/roxelis-vanilla-coconut-body-perfume-spray-long-lasting-fragrance-and-exudes-a-unique-charm-it-is-a-fresh-romantic-and-portable-perfume"}, {"type": "product", "id": 7890232246335, "title": "Shea Butter Moisturizer Hydrating Moisturizing Skin Care Relief Dry Soft Smooth Moisturizer", "handle": "shea-butter-moisturizer-hydrating-moisturizing-skin-care-relief-dry-soft-smooth-moisturizer", "tags": "skincare", "url": "https://shop.aloha.id.vn/products/shea-butter-moisturizer-hydrating-moisturizing-skin-care-relief-dry-soft-smooth-moisturizer", "price": "22.78", "product_type": "", "vendor": "eprolo", "status": "active", "sku": "OC-A06-0173-01", "variant": "default title", "image": "https://cdn.shopify.com/s/files/1/0623/5340/8063/files/E04F9A32864F82E25091977D7E52A156.jpg?v=1757157950", "inventory_quantity": 85, "available": true, "text": "Product: Shea Butter Moisturizer Hydrating Moisturizing Skin Care Relief Dry Soft Smooth Moisturizer Type: Vendor: eprolo Tags: skincare Options: {\"color\": [\"default title\"]} Variant: default title SKU: OC-A06-0173-01 Price: 22.78 Inventory: 85 Available: True Status: active Body: Our shea butter moisturizer contains shea butter, Jojoba seed oil and sweet orange blossom extract. It deeply nourishes the skin and keeps it healthy and moisturized. The way to use it is simple: 1. Clean your skin and keep it dry. 2. Apply proper amount of the product to the whole body. 3. Massage gently in circular motions to promote absorption. Light texture, easy to apply, fast absorption, suitable for daily use, no greasy feeling. URL: https://shop.aloha.id.vn/products/shea-butter-moisturizer-hydrating-moist"}, {"type": "product", "id": 7890232246335, "title": "Shea Butter Moisturizer Hydrating Moisturizing Skin Care Relief Dry Soft Smooth Moisturizer", "handle": "shea-butter-moisturizer-hydrating-moisturizing-skin-care-relief-dry-soft-smooth-moisturizer", "tags": "skincare", "url": "https://shop.aloha.id.vn/products/shea-butter-moisturizer-hydrating-moisturizing-skin-care-relief-dry-soft-smooth-moisturizer", "price": "22.78", "product_type": "", "vendor": "eprolo", "status": "active", "sku": "OC-A06-0173-01", "variant": "default title", "image": "https://cdn.shopify.com/s/files/1/0623/5340/8063/files/E04F9A32864F82E25091977D7E52A156.jpg?v=1757157950", "inventory_quantity": 85, "available": true, "text": "urizing-skin-care-relief-dry-soft-smooth-moisturizer"}, {"type": "product", "id": 7890249285695, "title": "Sleep Aid Patch, Body Relief Staying Up Late To Improve Sleep Decompression Acupoint Health Care Patch", "handle": "sleep-aid-patch-body-relief-staying-up-late-to-improve-sleep-decompression-acupoint-health-care-patch", "tags": "", "url": "https://shop.aloha.id.vn/products/sleep-aid-patch-body-relief-staying-up-late-to-improve-sleep-decompression-acupoint-health-care-patch", "price": "22.78", "product_type": "", "vendor": "eprolo", "status": "active", "sku": "S标smfzt88rx01-10pcs/袋", "variant": "default title", "image": "https://cdn.shopify.com/s/files/1/0623/5340/8063/files/175DD1452A213B77547B2707739FFA7C.jpg?v=1757165406", "inventory_quantity": 100, "available": true, "text": "Product: Sleep Aid Patch, Body Relief Staying Up Late To Improve Sleep Decompression Acupoint Health Care Patch Type: Vendor: eprolo Tags: Options: {\"color\": [\"default title\"]} Variant: default title SKU: S标smfzt88rx01-10pcs/袋 Price: 22.78 Inventory: 100 Available: True Status: active Body: Our sleep aid patch contains codonopsis, Coptis. It can stimulate the heat-sensing organs in the body, accelerate blood circulation, regulate the abnormal excited state of nerves, thereby relaxing muscles, relaxing tense nerves, and helping sleep. The way to use it is simple: wash and dry your belly button before use, put a patch on your belly button before going to bed, and remove it when you get up (about 8-12 hours). And it can help you sleep and fall asleep quickly. URL: https://shop.aloha.id.vn/pro"}, {"type": "product", "id": 7890249285695, "title": "Sleep Aid Patch, Body Relief Staying Up Late To Improve Sleep Decompression Acupoint Health Care Patch", "handle": "sleep-aid-patch-body-relief-staying-up-late-to-improve-sleep-decompression-acupoint-health-care-patch", "tags": "", "url": "https://shop.aloha.id.vn/products/sleep-aid-patch-body-relief-staying-up-late-to-improve-sleep-decompression-acupoint-health-care-patch", "price": "22.78", "product_type": "", "vendor": "eprolo", "status": "active", "sku": "S标smfzt88rx01-10pcs/袋", "variant": "default title", "image": "https://cdn.shopify.com/s/files/1/0623/5340/8063/files/175DD1452A213B77547B2707739FFA7C.jpg?v=1757165406", "inventory_quantity": 100, "available": true, "text": "ducts/sleep-aid-patch-body-relief-staying-up-late-to-improve-sleep-decompression-acupoint-health-care-patch"}, {"type": "product", "id": 7890232541247, "title": "Snail Moisturizer, Nourishing And Moisturizing Facial Care Moisturizing Cream To Improve Dull Skin", "handle": "snail-moisturizer-nourishing-and-moisturizing-facial-care-moisturizing-cream-to-improve-dull-skin", "tags": "skincare", "url": "https://shop.aloha.id.vn/products/snail-moisturizer-nourishing-and-moisturizing-facial-care-moisturizing-cream-to-improve-dull-skin", "price": "22.78", "product_type": "", "vendor": "eprolo", "status": "active", "sku": "HO-A05-0353-01", "variant": "default title", "image": "https://cdn.shopify.com/s/files/1/0623/5340/8063/files/17BC35E77F7445245719C3B41714CDB9.jpg?v=1757158060", "inventory_quantity": 671, "available": true, "text": "Product: Snail Moisturizer, Nourishing And Moisturizing Facial Care Moisturizing Cream To Improve Dull Skin Type: Vendor: eprolo Tags: skincare Options: {\"color\": [\"default title\"]} Variant: default title SKU: HO-A05-0353-01 Price: 22.78 Inventory: 671 Available: True Status: active Body: Our snail moisturizer contains elm root extract, Macadamia nut seed oil. It can significantly improve skin firmness and help facial lines become clearer. The way to apply it is simple: clean your face and keep it dry, take the right amount of cream, apply it evenly on your face, and massage it gently with your fingertips in circular motions until it is completely absorbed. It can effectively reduce facial fine lines and significantly improve skin smoothness URL: https://shop.aloha.id.vn/products/snail-moi"}, {"type": "product", "id": 7890232541247, "title": "Snail Moisturizer, Nourishing And Moisturizing Facial Care Moisturizing Cream To Improve Dull Skin", "handle": "snail-moisturizer-nourishing-and-moisturizing-facial-care-moisturizing-cream-to-improve-dull-skin", "tags": "skincare", "url": "https://shop.aloha.id.vn/products/snail-moisturizer-nourishing-and-moisturizing-facial-care-moisturizing-cream-to-improve-dull-skin", "price": "22.78", "product_type": "", "vendor": "eprolo", "status": "active", "sku": "HO-A05-0353-01", "variant": "default title", "image": "https://cdn.shopify.com/s/files/1/0623/5340/8063/files/17BC35E77F7445245719C3B41714CDB9.jpg?v=1757158060", "inventory_quantity": 671, "available": true, "text": "sturizer-nourishing-and-moisturizing-facial-care-moisturizing-cream-to-improve-dull-skin"}, {"type": "product", "id": 7890229493823, "title": "Snail Mucin 92% Moisturizer, Moisturizing And Smoothing Facial Wrinkles Firming And Elastic Skin Care Cream", "handle": "snail-mucin-92-moisturizer-moisturizing-and-smoothing-facial-wrinkles-firming-and-elastic-skin-care-cream", "tags": "skincare", "url": "https://shop.aloha.id.vn/products/snail-mucin-92-moisturizer-moisturizing-and-smoothing-facial-wrinkles-firming-and-elastic-skin-care-cream", "price": "22.78", "product_type": "", "vendor": "eprolo", "status": "active", "sku": "OUA05-A031-50-MX1", "variant": "default title", "image": "https://cdn.shopify.com/s/files/1/0623/5340/8063/files/5CC203668B12FC2A33B12B7EFC5A3711.jpg?v=1757157100", "inventory_quantity": 490, "available": true, "text": "Product: Snail Mucin 92% Moisturizer, Moisturizing And Smoothing Facial Wrinkles Firming And Elastic Skin Care Cream Type: Vendor: eprolo Tags: skincare Options: {\"color\": [\"default title\"]} Variant: default title SKU: OUA05-A031-50-MX1 Price: 22.78 Inventory: 490 Available: True Status: active Body: Our Snail Mucin 92% Moisturizer contains Snail Secretion Filtrate, Macadamia Ternifolia Seed Oil, Ulmus Davidiana Root Extract. It can support the natural moisturizing barrier of the skin, making it look healthy, protecting and preventing water loss, gently improving the appearance of dark spots, and even skin tone. The application method is very simple: dry the face after cleaning, apply proper amount of face cream evenly on the face, gently massage in circles with your hands until it is abso"}, {"type": "product", "id": 7890229493823, "title": "Snail Mucin 92% Moisturizer, Moisturizing And Smoothing Facial Wrinkles Firming And Elastic Skin Care Cream", "handle": "snail-mucin-92-moisturizer-moisturizing-and-smoothing-facial-wrinkles-firming-and-elastic-skin-care-cream", "tags": "skincare", "url": "https://shop.aloha.id.vn/products/snail-mucin-92-moisturizer-moisturizing-and-smoothing-facial-wrinkles-firming-and-elastic-skin-care-cream", "price": "22.78", "product_type": "", "vendor": "eprolo", "status": "active", "sku": "OUA05-A031-50-MX1", "variant": "default title", "image": "https://cdn.shopify.com/s/files/1/0623/5340/8063/files/5CC203668B12FC2A33B12B7EFC5A3711.jpg?v=1757157100", "inventory_quantity": 490, "available": true, "text": "rbed. The filtrate secreted by snails is rich in various nutrients, which can help reduce facial wrinkles, support skin elasticity, and improve skin firmness. URL: https://shop.aloha.id.vn/products/snail-mucin-92-moisturizer-moisturizing-and-smoothing-facial-wrinkles-firming-and-elastic-skin-care-cream"}, {"type": "product", "id": 7890229231679, "title": "Tinted Moisturizer, Outdoor UV Protection Brightening Skin Hydrating Protective Cream", "handle": "tinted-moisturizer-outdoor-uv-protection-brightening-skin-hydrating-protective-cream", "tags": "skincare", "url": "https://shop.aloha.id.vn/products/tinted-moisturizer-outdoor-uv-protection-brightening-skin-hydrating-protective-cream", "price": "22.78", "product_type": "", "vendor": "eprolo", "status": "active", "sku": "HOA05-A039-50-WH1", "variant": "default title", "image": "https://cdn.shopify.com/s/files/1/0623/5340/8063/files/B9D5C4C4962611D43B5FCCB9F3F4C18C.jpg?v=1757157060", "inventory_quantity": 85, "available": true, "text": "Product: Tinted Moisturizer, Outdoor UV Protection Brightening Skin Hydrating Protective Cream Type: Vendor: eprolo Tags: skincare Options: {\"color\": [\"default title\"]} Variant: default title SKU: HOA05-A039-50-WH1 Price: 22.78 Inventory: 85 Available: True Status: active Body: Our Tinted Moisturizer contains glycerin, hydrolyzed collagen, and titanium dioxide. It can cover blemishes on the skin, make the skin look more even and delicate, and enhance the natural beauty of the skin tone, help protect the skin from UVA and UVB rays, and repair significantly aged and damaged skin. The way to use it is simple: clean your face, apply the sunscreen evenly to your face, and gently massage until it is fully absorbed. The sunscreen effect is long-lasting, and the protective effect can be maintained"}, {"type": "product", "id": 7890229231679, "title": "Tinted Moisturizer, Outdoor UV Protection Brightening Skin Hydrating Protective Cream", "handle": "tinted-moisturizer-outdoor-uv-protection-brightening-skin-hydrating-protective-cream", "tags": "skincare", "url": "https://shop.aloha.id.vn/products/tinted-moisturizer-outdoor-uv-protection-brightening-skin-hydrating-protective-cream", "price": "22.78", "product_type": "", "vendor": "eprolo", "status": "active", "sku": "HOA05-A039-50-WH1", "variant": "default title", "image": "https://cdn.shopify.com/s/files/1/0623/5340/8063/files/B9D5C4C4962611D43B5FCCB9F3F4C18C.jpg?v=1757157060", "inventory_quantity": 85, "available": true, "text": " in outdoor activities or long-term exposure to the sun, without frequent supplementation. URL: https://shop.aloha.id.vn/products/tinted-moisturizer-outdoor-uv-protection-brightening-skin-hydrating-protective-cream"}, {"type": "product", "id": 7889163714623, "title": "Viareline Salicylic Acid Cleanser Gently Cleanses Face, Refreshing Oil Control, Delicate Pores, Moisturizing And Brightening", "handle": "viareline-salicylic-acid-cleanser-gently-cleanses-face-refreshing-oil-control-delicate-pores-moisturizing-and-brightening", "tags": "skincare", "url": "https://shop.aloha.id.vn/products/viareline-salicylic-acid-cleanser-gently-cleanses-face-refreshing-oil-control-delicate-pores-moisturizing-and-brightening", "price": "21.80", "product_type": "", "vendor": "eprolo", "status": "active", "sku": "VI-A05-0014-01", "variant": "default title", "image": "https://cdn.shopify.com/s/files/1/0623/5340/8063/files/6A4EE26AD644AAF11661CFF6BA4683EC.jpg?v=1757003464", "inventory_quantity": 551, "available": true, "text": "Product: Viareline Salicylic Acid Cleanser Gently Cleanses Face, Refreshing Oil Control, Delicate Pores, Moisturizing And Brightening Type: Vendor: eprolo Tags: skincare Options: {\"color\": [\"default title\"]} Variant: default title SKU: VI-A05-0014-01 Price: 21.80 Inventory: 551 Available: True Status: active Body: Our salicylic acid cleanser contains sodium cocoyl glycine, hydroxypropyl methyl cellulose. It is a cleansing formula that penetrates pores, removes excess oil and dirt and helps skin retain moisture, moisturize and replenish moisture. Its use method is very simple: take the appropriate amount of this product in the palm, rub with warm water into a foam, apply the foam on the face skin, gently massage clean. Rinse well with water. And can be formulated gently, suitable for daily "}, {"type": "product", "id": 7889163714623, "title": "Viareline Salicylic Acid Cleanser Gently Cleanses Face, Refreshing Oil Control, Delicate Pores, Moisturizing And Brightening", "handle": "viareline-salicylic-acid-cleanser-gently-cleanses-face-refreshing-oil-control-delicate-pores-moisturizing-and-brightening", "tags": "skincare", "url": "https://shop.aloha.id.vn/products/viareline-salicylic-acid-cleanser-gently-cleanses-face-refreshing-oil-control-delicate-pores-moisturizing-and-brightening", "price": "21.80", "product_type": "", "vendor": "eprolo", "status": "active", "sku": "VI-A05-0014-01", "variant": "default title", "image": "https://cdn.shopify.com/s/files/1/0623/5340/8063/files/6A4EE26AD644AAF11661CFF6BA4683EC.jpg?v=1757003464", "inventory_quantity": 551, "available": true, "text": "use, and take care of your skin. URL: https://shop.aloha.id.vn/products/viareline-salicylic-acid-cleanser-gently-cleanses-face-refreshing-oil-control-delicate-pores-moisturizing-and-brightening"}, {"type": "product", "id": 7890221400127, "title": "Viareline Vitamin C Deep Cleansing Mud Mask Gently Cleans, Hydrates And Moisturizes Facial Skin", "handle": "viareline-vitamin-c-deep-cleansing-mud-mask-gently-cleans-hydrates-and-moisturizes-facial-skin", "tags": "skincare", "url": "https://shop.aloha.id.vn/products/viareline-vitamin-c-deep-cleansing-mud-mask-gently-cleans-hydrates-and-moisturizes-facial-skin", "price": "31.12", "product_type": "", "vendor": "eprolo", "status": "active", "sku": "VI-A05-0016-03", "variant": "default title", "image": "https://cdn.shopify.com/s/files/1/0623/5340/8063/files/E015CEC8886DF8DE0A0ECA2820B15489.jpg?v=1757155089", "inventory_quantity": 2160, "available": true, "text": "Product: Viareline Vitamin C Deep Cleansing Mud Mask Gently Cleans, Hydrates And Moisturizes Facial Skin Type: Vendor: eprolo Tags: skincare Options: {\"color\": [\"default title\"]} Variant: default title SKU: VI-A05-0016-03 Price: 31.12 Inventory: 2160 Available: True Status: active Body: Our Vitamin C deep cleaning mud film contains kaolin and bentonite. It penetrates into pores, cleans dirt, and rejuvenates the skin. Improves skin brightness and evenness. The way to use it is simple: clean your face and keep it dry. Apply appropriate amount to face evenly. Leave on for 5-10 minutes, then wash off with warm water. It can also gently remove surface impurities, leaving skin feeling smoother. URL: https://shop.aloha.id.vn/products/viareline-vitamin-c-deep-cleansing-mud-mask-gently-cleans-hydra"}, {"type": "product", "id": 7890221400127, "title": "Viareline Vitamin C Deep Cleansing Mud Mask Gently Cleans, Hydrates And Moisturizes Facial Skin", "handle": "viareline-vitamin-c-deep-cleansing-mud-mask-gently-cleans-hydrates-and-moisturizes-facial-skin", "tags": "skincare", "url": "https://shop.aloha.id.vn/products/viareline-vitamin-c-deep-cleansing-mud-mask-gently-cleans-hydrates-and-moisturizes-facial-skin", "price": "31.12", "product_type": "", "vendor": "eprolo", "status": "active", "sku": "VI-A05-0016-03", "variant": "default title", "image": "https://cdn.shopify.com/s/files/1/0623/5340/8063/files/E015CEC8886DF8DE0A0ECA2820B15489.jpg?v=1757155089", "inventory_quantity": 2160, "available": true, "text": "tes-and-moisturizes-facial-skin"}, {"type": "product", "id": 7890232279103, "title": "Vitamin C Moisturizer, Hydrating, Moisturizing And Brightening The Whole Body Universal Skin Revitalizing Moisturizer", "handle": "vitamin-c-moisturizer-hydrating-moisturizing-and-brightening-the-whole-body-universal-skin-revitalizing-moisturizer", "tags": "skincare", "url": "https://shop.aloha.id.vn/products/vitamin-c-moisturizer-hydrating-moisturizing-and-brightening-the-whole-body-universal-skin-revitalizing-moisturizer", "price": "22.78", "product_type": "", "vendor": "eprolo", "status": "active", "sku": "OU-A06-0258-07", "variant": "default title", "image": "https://cdn.shopify.com/s/files/1/0623/5340/8063/files/F618920EAA338E98250376A6F732EFFE.jpg?v=1757157976", "inventory_quantity": 150, "available": true, "text": "Product: Vitamin C Moisturizer, Hydrating, Moisturizing And Brightening The Whole Body Universal Skin Revitalizing Moisturizer Type: Vendor: eprolo Tags: skincare Options: {\"color\": [\"default title\"]} Variant: default title SKU: OU-A06-0258-07 Price: 22.78 Inventory: 150 Available: True Status: active Body: Our Vitamin C moisturizer contains coconut oil, vitamin E (tocopherol). It enhances skin firmness and improves relaxation. Its application method is very simple: clean the skin, keep the skin dry, evenly apply the product to all parts of the body skin, gently massage until absorbed. It also reduces fine lines and wrinkles, making skin look younger. URL: https://shop.aloha.id.vn/products/vitamin-c-moisturizer-hydrating-moisturizing-and-brightening-the-whole-body-universal-skin-revitalizi"}, {"type": "product", "id": 7890232279103, "title": "Vitamin C Moisturizer, Hydrating, Moisturizing And Brightening The Whole Body Universal Skin Revitalizing Moisturizer", "handle": "vitamin-c-moisturizer-hydrating-moisturizing-and-brightening-the-whole-body-universal-skin-revitalizing-moisturizer", "tags": "skincare", "url": "https://shop.aloha.id.vn/products/vitamin-c-moisturizer-hydrating-moisturizing-and-brightening-the-whole-body-universal-skin-revitalizing-moisturizer", "price": "22.78", "product_type": "", "vendor": "eprolo", "status": "active", "sku": "OU-A06-0258-07", "variant": "default title", "image": "https://cdn.shopify.com/s/files/1/0623/5340/8063/files/F618920EAA338E98250376A6F732EFFE.jpg?v=1757157976", "inventory_quantity": 150, "available": true, "text": "ng-moisturizer"}, {"type": "product", "id": 7889479335999, "title": "Vitamin C Serum, Firming Hydrating Whitening And Anti-Wrinkle Serum", "handle": "vitamin-c-serum-firming-hydrating-whitening-and-anti-wrinkle-serum", "tags": "skincare", "url": "https://shop.aloha.id.vn/products/vitamin-c-serum-firming-hydrating-whitening-and-anti-wrinkle-serum", "price": "22.78", "product_type": "", "vendor": "eprolo", "status": "active", "sku": "EEA02-A140-30-WH1", "variant": "default title", "image": "https://cdn.shopify.com/s/files/1/0623/5340/8063/files/FD86BB83FBDB9243D0D7BDBED28B1B77.jpg?v=1757045981", "inventory_quantity": 95, "available": true, "text": "Product: Vitamin C Serum, Firming Hydrating Whitening And Anti-Wrinkle Serum Type: Vendor: eprolo Tags: skincare Options: {\"color\": [\"default title\"]} Variant: default title SKU: EEA02-A140-30-WH1 Price: 22.78 Inventory: 95 Available: True Status: active Body: Our Vitamin C Serum contain vitamin E, coffee extract, psoralen phenol. It can anti aging, replenish moisture, moisturize and nourish skin, fade wrinkles, increase skin elasticity. Its usage is simple: After cleansing and toning, press 1-2 pumps of the essence on the palm, spread evenly on the face and neck skin, and gently massage with hands in circular motions for absorption. Reduces wrinkles, anti-aging, tightens skin, and makes you look younger and more radiant. URL: https://shop.aloha.id.vn/products/vitamin-c-serum-firming-hydra"}, {"type": "product", "id": 7889479335999, "title": "Vitamin C Serum, Firming Hydrating Whitening And Anti-Wrinkle Serum", "handle": "vitamin-c-serum-firming-hydrating-whitening-and-anti-wrinkle-serum", "tags": "skincare", "url": "https://shop.aloha.id.vn/products/vitamin-c-serum-firming-hydrating-whitening-and-anti-wrinkle-serum", "price": "22.78", "product_type": "", "vendor": "eprolo", "status": "active", "sku": "EEA02-A140-30-WH1", "variant": "default title", "image": "https://cdn.shopify.com/s/files/1/0623/5340/8063/files/FD86BB83FBDB9243D0D7BDBED28B1B77.jpg?v=1757045981", "inventory_quantity": 95, "available": true, "text": "ting-whitening-and-anti-wrinkle-serum"}, {"type": "product", "id": 7889465999423, "title": "West&Month Facial Care Patch, Firming And Lifting Facial Skin Deep Nourishing Care Face Lift Patch", "handle": "west-month-facial-care-patch-firming-and-lifting-facial-skin-deep-nourishing-care-face-lift-patch", "tags": "skincare", "url": "https://shop.aloha.id.vn/products/west-month-facial-care-patch-firming-and-lifting-facial-skin-deep-nourishing-care-face-lift-patch", "price": "24.10", "product_type": "", "vendor": "eprolo", "status": "active", "sku": "WE-A05-0266-01", "variant": "default title", "image": "https://cdn.shopify.com/s/files/1/0623/5340/8063/files/F95B7127B74EB3D038BFF7FDFE845769.jpg?v=1757040071", "inventory_quantity": 194, "available": true, "text": "Product: West&Month Facial Care Patch, Firming And Lifting Facial Skin Deep Nourishing Care Face Lift Patch Type: Vendor: eprolo Tags: skincare Options: {\"color\": [\"default title\"]} Variant: default title SKU: WE-A05-0266-01 Price: 24.10 Inventory: 194 Available: True Status: active Body: Our face anti-wrinkle patches contain acetyl tripeptide-1, collagen. It can increase collagen production and improve skin elasticity and firmness. Its application is simple: thoroughly clean and dry the skin, remove the patch, apply it to the appropriate skin area on the face, leave it on for 30 minutes, remove it, and then clean the skin with water. And it protects the skin from environmental damage. URL: https://shop.aloha.id.vn/products/west-month-facial-care-patch-firming-and-lifting-facial-skin-deep-"}, {"type": "product", "id": 7889465999423, "title": "West&Month Facial Care Patch, Firming And Lifting Facial Skin Deep Nourishing Care Face Lift Patch", "handle": "west-month-facial-care-patch-firming-and-lifting-facial-skin-deep-nourishing-care-face-lift-patch", "tags": "skincare", "url": "https://shop.aloha.id.vn/products/west-month-facial-care-patch-firming-and-lifting-facial-skin-deep-nourishing-care-face-lift-patch", "price": "24.10", "product_type": "", "vendor": "eprolo", "status": "active", "sku": "WE-A05-0266-01", "variant": "default title", "image": "https://cdn.shopify.com/s/files/1/0623/5340/8063/files/F95B7127B74EB3D038BFF7FDFE845769.jpg?v=1757040071", "inventory_quantity": 194, "available": true, "text": "nourishing-care-face-lift-patch"}, {"type": "product", "id": 7889477206079, "title": "West&Month Firming Serum, Hydrating, Moisturizing, Firming And Smoothing Fine Lines Facial Treatment Essence", "handle": "west-month-firming-serum-hydrating-moisturizing-firming-and-smoothing-fine-lines-facial-treatment-essence", "tags": "skincare", "url": "https://shop.aloha.id.vn/products/west-month-firming-serum-hydrating-moisturizing-firming-and-smoothing-fine-lines-facial-treatment-essence", "price": "24.12", "product_type": "", "vendor": "eprolo", "status": "active", "sku": "WE-A05-0263-01", "variant": "default title", "image": "https://cdn.shopify.com/s/files/1/0623/5340/8063/files/17FF5DB087E25CEAE53ED028E7DA7638.jpg?v=1757045349", "inventory_quantity": 250, "available": true, "text": "Product: West&Month Firming Serum, Hydrating, Moisturizing, Firming And Smoothing Fine Lines Facial Treatment Essence Type: Vendor: eprolo Tags: skincare Options: {\"color\": [\"default title\"]} Variant: default title SKU: WE-A05-0263-01 Price: 24.12 Inventory: 250 Available: True Status: active Body: Our firming serum contains green tea extract and avocado oil. It can quickly restore the skin's natural glow. Its application method is very simple: clean the facial skin, keep the skin dry, apply appropriate amount of this product evenly on the facial skin, gently massage until completely absorbed. And deep care can be provided. URL: https://shop.aloha.id.vn/products/west-month-firming-serum-hydrating-moisturizing-firming-and-smoothing-fine-lines-facial-treatment-essence"}, {"type": "product", "id": 7889477271615, "title": "West&Month Firming Serum, Moisturizing And Hydrating Facial Skin Care Serum", "handle": "west-month-firming-serum-moisturizing-and-hydrating-facial-skin-care-serum", "tags": "", "url": "https://shop.aloha.id.vn/products/west-month-firming-serum-moisturizing-and-hydrating-facial-skin-care-serum", "price": "24.10", "product_type": "", "vendor": "eprolo", "status": "active", "sku": "WE-A05-0279-01", "variant": "default title", "image": "https://cdn.shopify.com/s/files/1/0623/5340/8063/files/AADE7BA9190735118F66517ABE8616C6.jpg?v=1757045367", "inventory_quantity": 121, "available": true, "text": "Product: West&Month Firming Serum, Moisturizing And Hydrating Facial Skin Care Serum Type: Vendor: eprolo Tags: Options: {\"color\": [\"default title\"]} Variant: default title SKU: WE-A05-0279-01 Price: 24.10 Inventory: 121 Available: True Status: active Body: Our firming serum contains tocopherol (vitamin E), hyaluronic acid, collagen. It can enhance skin elasticity and rejuvenate. Its application method is very simple: completely clean and dry facial skin, apply appropriate amount of this product evenly on the facial skin, gently massage to promote better absorption. It can provide deep and lasting moisturizing effect, increase collagen production, and improve skin elasticity and firmness. URL: https://shop.aloha.id.vn/products/west-month-firming-serum-moisturizing-and-hydrating-facial-skin"}, {"type": "product", "id": 7889477271615, "title": "West&Month Firming Serum, Moisturizing And Hydrating Facial Skin Care Serum", "handle": "west-month-firming-serum-moisturizing-and-hydrating-facial-skin-care-serum", "tags": "", "url": "https://shop.aloha.id.vn/products/west-month-firming-serum-moisturizing-and-hydrating-facial-skin-care-serum", "price": "24.10", "product_type": "", "vendor": "eprolo", "status": "active", "sku": "WE-A05-0279-01", "variant": "default title", "image": "https://cdn.shopify.com/s/files/1/0623/5340/8063/files/AADE7BA9190735118F66517ABE8616C6.jpg?v=1757045367", "inventory_quantity": 121, "available": true, "text": "-care-serum"}, {"type": "product", "id": 7890236735551, "title": "West&Month Plain Face Cream, Brightening Skin And Toning Natural Concealer Beauty", "handle": "west-month-plain-face-cream-brightening-skin-and-toning-natural-concealer-beauty", "tags": "skincare", "url": "https://shop.aloha.id.vn/products/west-month-plain-face-cream-brightening-skin-and-toning-natural-concealer-beauty", "price": "24.12", "product_type": "", "vendor": "eprolo", "status": "active", "sku": "WEA05-A059-100-BK1", "variant": "default title", "image": "https://cdn.shopify.com/s/files/1/0623/5340/8063/files/0B81579E41824A2AA5B09ABD910EC429.jpg?v=1757160118", "inventory_quantity": 64, "available": true, "text": "Product: West&Month Plain Face Cream, Brightening Skin And Toning Natural Concealer Beauty Type: Vendor: eprolo Tags: skincare Options: {\"color\": [\"default title\"]} Variant: default title SKU: WEA05-A059-100-BK1 Price: 24.12 Inventory: 64 Available: True Status: active Body: Our Plain Face Cream contains Niacinamide, Ascorbic Acid, Aloe Barbadensis Leaf Extract. It can lighten skin tone, enhance skin protection, improve skin tone, increase skin shine, deep hydration, and soothe skin. Its application method is very simple: clean facial skin, keep dry, apply appropriate amount of this product evenly on facial skin, gently pat with fingertips until the skin tone is even. It can quickly even out skin tone, improve skin brightness, deeply nourish, lock in moisture, moisturize all day, narrow po"}, {"type": "product", "id": 7890236735551, "title": "West&Month Plain Face Cream, Brightening Skin And Toning Natural Concealer Beauty", "handle": "west-month-plain-face-cream-brightening-skin-and-toning-natural-concealer-beauty", "tags": "skincare", "url": "https://shop.aloha.id.vn/products/west-month-plain-face-cream-brightening-skin-and-toning-natural-concealer-beauty", "price": "24.12", "product_type": "", "vendor": "eprolo", "status": "active", "sku": "WEA05-A059-100-BK1", "variant": "default title", "image": "https://cdn.shopify.com/s/files/1/0623/5340/8063/files/0B81579E41824A2AA5B09ABD910EC429.jpg?v=1757160118", "inventory_quantity": 64, "available": true, "text": "res, and make skin more delicate and smooth. URL: https://shop.aloha.id.vn/products/west-month-plain-face-cream-brightening-skin-and-toning-natural-concealer-beauty"}, {"type": "product", "id": 7889465573439, "title": "West&Month Skin Repair Serum Gently Moisturizes Facial Skin, Improves Dull And Brightening Skin Care Essence", "handle": "west-month-skin-repair-serum-gently-moisturizes-facial-skin-improves-dull-and-brightening-skin-care-essence", "tags": "skincare", "url": "https://shop.aloha.id.vn/products/west-month-skin-repair-serum-gently-moisturizes-facial-skin-improves-dull-and-brightening-skin-care-essence", "price": "24.10", "product_type": "", "vendor": "eprolo", "status": "active", "sku": "WE-A05-0320-01", "variant": "default title", "image": "https://cdn.shopify.com/s/files/1/0623/5340/8063/files/E4E358A16DE5AECDCC39A664B90D6009.jpg?v=1757039838", "inventory_quantity": 341, "available": true, "text": "Product: West&Month Skin Repair Serum Gently Moisturizes Facial Skin, Improves Dull And Brightening Skin Care Essence Type: Vendor: eprolo Tags: skincare Options: {\"color\": [\"default title\"]} Variant: default title SKU: WE-A05-0320-01 Price: 24.10 Inventory: 341 Available: True Status: active Body: Our Dark Spot Healing Serum contains peppermint extract and vitamin E. It can promote skin metabolism, accelerate the metabolic function of old dead skin cells, and make skin more delicate. Its application method is very simple: clean the skin, keep the skin dry, apply appropriate amount of this product evenly on the face, gently massage until absorbed. And it can reduce the uneven skin tone caused by sunburn and other reasons, so that the skin looks smoother. URL: https://shop.aloha.id.vn/produ"}, {"type": "product", "id": 7889465573439, "title": "West&Month Skin Repair Serum Gently Moisturizes Facial Skin, Improves Dull And Brightening Skin Care Essence", "handle": "west-month-skin-repair-serum-gently-moisturizes-facial-skin-improves-dull-and-brightening-skin-care-essence", "tags": "skincare", "url": "https://shop.aloha.id.vn/products/west-month-skin-repair-serum-gently-moisturizes-facial-skin-improves-dull-and-brightening-skin-care-essence", "price": "24.10", "product_type": "", "vendor": "eprolo", "status": "active", "sku": "WE-A05-0320-01", "variant": "default title", "image": "https://cdn.shopify.com/s/files/1/0623/5340/8063/files/E4E358A16DE5AECDCC39A664B90D6009.jpg?v=1757039838", "inventory_quantity": 341, "available": true, "text": "cts/west-month-skin-repair-serum-gently-moisturizes-facial-skin-improves-dull-and-brightening-skin-care-essence"}, {"type": "product", "id": 7889466916927, "title": "West&Month Vitamin C Face Serum, Moisturizing, Hydrating, Brightening, Tender And Smooth Skin Essence", "handle": "west-month-vitamin-c-face-serum-moisturizing-hydrating-brightening-tender-and-smooth-skin-essence", "tags": "skincare", "url": "https://shop.aloha.id.vn/products/west-month-vitamin-c-face-serum-moisturizing-hydrating-brightening-tender-and-smooth-skin-essence", "price": "24.12", "product_type": "", "vendor": "eprolo", "status": "active", "sku": "WEA05-A046-30-WH1", "variant": "default title", "image": "https://cdn.shopify.com/s/files/1/0623/5340/8063/files/35D46D980E7201BDF92B27D19B6540A0.jpg?v=1757040425", "inventory_quantity": 176, "available": true, "text": "Product: West&Month Vitamin C Face Serum, Moisturizing, Hydrating, Brightening, Tender And Smooth Skin Essence Type: Vendor: eprolo Tags: skincare Options: {\"color\": [\"default title\"]} Variant: default title SKU: WEA05-A046-30-WH1 Price: 24.12 Inventory: 176 Available: True Status: active Body: Our Vitamin C face serum contains vitamin C, tocopherol. It balances skin tone, lightening spots and acne marks, and making skin fairer. Excellent moisturizing effect that keeps skin hydrated throughout the day. Its application method is very simple: clean and dry facial skin, take an appropriate amount of essence, evenly apply on the face, gently massage until absorbed. And powerful antioxidants that fight free radicals and reverse the signs of aging. URL: https://shop.aloha.id.vn/products/west-mon"}, {"type": "product", "id": 7889466916927, "title": "West&Month Vitamin C Face Serum, Moisturizing, Hydrating, Brightening, Tender And Smooth Skin Essence", "handle": "west-month-vitamin-c-face-serum-moisturizing-hydrating-brightening-tender-and-smooth-skin-essence", "tags": "skincare", "url": "https://shop.aloha.id.vn/products/west-month-vitamin-c-face-serum-moisturizing-hydrating-brightening-tender-and-smooth-skin-essence", "price": "24.12", "product_type": "", "vendor": "eprolo", "status": "active", "sku": "WEA05-A046-30-WH1", "variant": "default title", "image": "https://cdn.shopify.com/s/files/1/0623/5340/8063/files/35D46D980E7201BDF92B27D19B6540A0.jpg?v=1757040425", "inventory_quantity": 176, "available": true, "text": "th-vitamin-c-face-serum-moisturizing-hydrating-brightening-tender-and-smooth-skin-essence"}, {"type": "product", "id": 7889163321407, "title": "West&Month Vitamin C Serum, Vitamin C Brightening And Darkening Face Gentle Moisturizing Serum", "handle": "west-month-vitamin-c-serum-vitamin-c-brightening-and-darkening-face-gentle-moisturizing-serum", "tags": "skincare", "url": "https://shop.aloha.id.vn/products/west-month-vitamin-c-serum-vitamin-c-brightening-and-darkening-face-gentle-moisturizing-serum", "price": "24.10", "product_type": "", "vendor": "eprolo", "status": "active", "sku": "WE-A05-0271-01", "variant": "default title", "image": "https://cdn.shopify.com/s/files/1/0623/5340/8063/files/BCEBCD7ECA69E883E4F099E1CBF51162.jpg?v=1757003438", "inventory_quantity": 345, "available": true, "text": "Product: West&Month Vitamin C Serum, Vitamin C Brightening And Darkening Face Gentle Moisturizing Serum Type: Vendor: eprolo Tags: skincare Options: {\"color\": [\"default title\"]} Variant: default title SKU: WE-A05-0271-01 Price: 24.10 Inventory: 345 Available: True Status: active Body: Our vitamin C essence contains glycerin, carbomer and sodium hyaluronate. It can stimulate collagen to generate and enhance skin elasticity. Its usage method is very simple: Clean the facial skin, keep the skin dry, take an appropriate amount of this product and apply it evenly to the facial skin, gently massage until it is fully absorbed. And it can significantly brighten the complexion, improve dullness and restore the skin's luster. URL: https://shop.aloha.id.vn/products/west-month-vitamin-c-serum-vitamin-"}, {"type": "product", "id": 7889163321407, "title": "West&Month Vitamin C Serum, Vitamin C Brightening And Darkening Face Gentle Moisturizing Serum", "handle": "west-month-vitamin-c-serum-vitamin-c-brightening-and-darkening-face-gentle-moisturizing-serum", "tags": "skincare", "url": "https://shop.aloha.id.vn/products/west-month-vitamin-c-serum-vitamin-c-brightening-and-darkening-face-gentle-moisturizing-serum", "price": "24.10", "product_type": "", "vendor": "eprolo", "status": "active", "sku": "WE-A05-0271-01", "variant": "default title", "image": "https://cdn.shopify.com/s/files/1/0623/5340/8063/files/BCEBCD7ECA69E883E4F099E1CBF51162.jpg?v=1757003438", "inventory_quantity": 345, "available": true, "text": "c-brightening-and-darkening-face-gentle-moisturizing-serum"}, {"type": "product", "id": 7890227986495, "title": "WoodSleep Body Butter Moisturizer With Bergamot And Grapefruit Flavor Hydrates And Moisturizes Skin All Over", "handle": "woodsleep-body-butter-moisturizer-with-bergamot-and-grapefruit-flavor-hydrates-and-moisturizes-skin-all-over", "tags": "skincare", "url": "https://shop.aloha.id.vn/products/woodsleep-body-butter-moisturizer-with-bergamot-and-grapefruit-flavor-hydrates-and-moisturizes-skin-all-over", "price": "24.10", "product_type": "", "vendor": "eprolo", "status": "active", "sku": "WO-B06-0007-04", "variant": "default title", "image": "https://cdn.shopify.com/s/files/1/0623/5340/8063/files/7E8F1722DCB85BB15FCB2FC911D24D02.jpg?v=1757156572", "inventory_quantity": 135, "available": true, "text": "Product: WoodSleep Body Butter Moisturizer With Bergamot And Grapefruit Flavor Hydrates And Moisturizes Skin All Over Type: Vendor: eprolo Tags: skincare Options: {\"color\": [\"default title\"]} Variant: default title SKU: WO-B06-0007-04 Price: 24.10 Inventory: 135 Available: True Status: active Body: Our Body Butter Moisturizer (Bergamot and grapefruit flavor) contains shea butter, bergamot extract, grapefruit extract. It deeply nourishes the skin, keeps it moist and reduces discomfort caused by dryness. Its application method is simple: 1. Clean the skin and keep it dry. 2. Apply proper amount of the product to the whole body. 3. Gently massage until absorbed. Improves dullness and leaves skin smooth and bright. Relieve dry skin discomfort and improve skin comfort. URL: https://shop.aloha.i"}, {"type": "product", "id": 7890227986495, "title": "WoodSleep Body Butter Moisturizer With Bergamot And Grapefruit Flavor Hydrates And Moisturizes Skin All Over", "handle": "woodsleep-body-butter-moisturizer-with-bergamot-and-grapefruit-flavor-hydrates-and-moisturizes-skin-all-over", "tags": "skincare", "url": "https://shop.aloha.id.vn/products/woodsleep-body-butter-moisturizer-with-bergamot-and-grapefruit-flavor-hydrates-and-moisturizes-skin-all-over", "price": "24.10", "product_type": "", "vendor": "eprolo", "status": "active", "sku": "WO-B06-0007-04", "variant": "default title", "image": "https://cdn.shopify.com/s/files/1/0623/5340/8063/files/7E8F1722DCB85BB15FCB2FC911D24D02.jpg?v=1757156572", "inventory_quantity": 135, "available": true, "text": "d.vn/products/woodsleep-body-butter-moisturizer-with-bergamot-and-grapefruit-flavor-hydrates-and-moisturizes-skin-all-over"}, {"type": "product", "id": 7890250170431, "title": "WoodSleep Sunflower Magnesium Oil Spray supplements with magnesium to soothe the body, nourish sleep and boost vitality", "handle": "woodsleep-sunflower-magnesium-oil-spray-supplements-with-magnesium-to-soothe-the-body-nourish-sleep-and-boost-vitality", "tags": "", "url": "https://shop.aloha.id.vn/products/woodsleep-sunflower-magnesium-oil-spray-supplements-with-magnesium-to-soothe-the-body-nourish-sleep-and-boost-vitality", "price": "24.10", "product_type": "", "vendor": "eprolo", "status": "active", "sku": "WO-A06-0035-02", "variant": "default title", "image": "https://cdn.shopify.com/s/files/1/0623/5340/8063/files/8ADFA107AE13B4ADDB77E1D1F41E59CB.jpg?v=1757165478", "inventory_quantity": 202, "available": true, "text": "Product: WoodSleep Sunflower Magnesium Oil Spray supplements with magnesium to soothe the body, nourish sleep and boost vitality Type: Vendor: eprolo Tags: Options: {\"color\": [\"default title\"]} Variant: default title SKU: WO-A06-0035-02 Price: 24.10 Inventory: 202 Available: True Status: active Body: Our sunflower Magnesium oil sprays contain magnesium chloride and sunflower oil. It is available in the form of a spray, which quickly penetrates into the skin and provides an instant magnesium supplement. Effective in reducing muscle cramps and pain, suitable for use after exercise. The way to use it is very simple: 1. First thoroughly clean and dry the skin 2. Spray the product evenly on the skin of the torso, chest, feet, legs, arms, or other parts of the body 3. Gently massage until fully "}, {"type": "product", "id": 7890250170431, "title": "WoodSleep Sunflower Magnesium Oil Spray supplements with magnesium to soothe the body, nourish sleep and boost vitality", "handle": "woodsleep-sunflower-magnesium-oil-spray-supplements-with-magnesium-to-soothe-the-body-nourish-sleep-and-boost-vitality", "tags": "", "url": "https://shop.aloha.id.vn/products/woodsleep-sunflower-magnesium-oil-spray-supplements-with-magnesium-to-soothe-the-body-nourish-sleep-and-boost-vitality", "price": "24.10", "product_type": "", "vendor": "eprolo", "status": "active", "sku": "WO-A06-0035-02", "variant": "default title", "image": "https://cdn.shopify.com/s/files/1/0623/5340/8063/files/8ADFA107AE13B4ADDB77E1D1F41E59CB.jpg?v=1757165478", "inventory_quantity": 202, "available": true, "text": "absorbed. And can promote cell energy metabolism, enhance physical strength and endurance. Improve immune function and prevent disease. URL: https://shop.aloha.id.vn/products/woodsleep-sunflower-magnesium-oil-spray-supplements-with-magnesium-to-soothe-the-body-nourish-sleep-and-boost-vitality"}, {"type": "product", "id": 7890236670015, "title": "Ximonth Beauty Essential Oil Gently Moisturizes Skin, Hydrates And Moisturizes Lazy Body Massage Care Drops", "handle": "ximonth-beauty-essential-oil-gently-moisturizes-skin-hydrates-and-moisturizes-lazy-body-massage-care-drops", "tags": "skincare", "url": "https://shop.aloha.id.vn/products/ximonth-beauty-essential-oil-gently-moisturizes-skin-hydrates-and-moisturizes-lazy-body-massage-care-drops", "price": "24.12", "product_type": "", "vendor": "eprolo", "status": "active", "sku": "XIB08-A029-30-WH1", "variant": "default title", "image": "https://cdn.shopify.com/s/files/1/0623/5340/8063/files/085D409AB6C8E449DF1BBDAE46196140.jpg?v=1757160102", "inventory_quantity": 130, "available": true, "text": "Product: Ximonth Beauty Essential Oil Gently Moisturizes Skin, Hydrates And Moisturizes Lazy Body Massage Care Drops Type: Vendor: eprolo Tags: skincare Options: {\"color\": [\"default title\"]} Variant: default title SKU: XIB08-A029-30-WH1 Price: 24.12 Inventory: 130 Available: True Status: active Body: Our essential oils contain ginger root extract, mugwort extract, black pepper fruit extract. It can stimulate the skin, wake up the skin vitality, fresh skin. Enhances skin tone and improves relaxation. The way to use it is simple: 1. Clean and dry the belly skin. 2. Apply appropriate amount of this product evenly on abdomen skin. 3. Gently massage in circular motions to fully absorb. Keep your skin smooth and delicate for a long time so you can continue to experience it. Can be easily used at"}, {"type": "product", "id": 7890236670015, "title": "Ximonth Beauty Essential Oil Gently Moisturizes Skin, Hydrates And Moisturizes Lazy Body Massage Care Drops", "handle": "ximonth-beauty-essential-oil-gently-moisturizes-skin-hydrates-and-moisturizes-lazy-body-massage-care-drops", "tags": "skincare", "url": "https://shop.aloha.id.vn/products/ximonth-beauty-essential-oil-gently-moisturizes-skin-hydrates-and-moisturizes-lazy-body-massage-care-drops", "price": "24.12", "product_type": "", "vendor": "eprolo", "status": "active", "sku": "XIB08-A029-30-WH1", "variant": "default title", "image": "https://cdn.shopify.com/s/files/1/0623/5340/8063/files/085D409AB6C8E449DF1BBDAE46196140.jpg?v=1757160102", "inventory_quantity": 130, "available": true, "text": " home or on the go. Easy to carry, you can take care of skin anytime, anywhere. URL: https://shop.aloha.id.vn/products/ximonth-beauty-essential-oil-gently-moisturizes-skin-hydrates-and-moisturizes-lazy-body-massage-care-drops"}]